sentimen,tahun,teksbersih
Positif,2021,tiap weekend pasti buat konten untuk chanel youtube retno listyarti begitu weekend ini ngobrol tentang ppdb dalam bentuk saya tanya ketua panitia ppdb provinsi daerah khusus ibukota jakarta jawab nanti video iya insyaallah manfaat
Positif,2021,eh ppdb jakarta ada tahap anjing neng banget bisa ikut tahap saya
Positif,2021,dengan ppdb warga bisa oleh didik kualitas di daerah khusus ibukota jakarta dan nppdb dapat bentuk sekolah sekolah negeri dengan variasi serta didik yang tinggi dan rasa gotong royong untuk maju sama dan dan
Positif,2021,dengan ppdb warga bisa oleh didik kualitas di daerah khusus ibukota jakarta dan nppdb dapat bentuk sekolah sekolah negeri dengan variasi serta didik yang tinggi dan rasa gotong royong untuk maju sama dan dan
Positif,2021,dear teman teman yang punya putra putri mau masuk sekolah informasi ppdb daerah khusus ibukota jakarta ini moga manfaat
Positif,2021,untuk capai nilai raport yang bagus memang tidak bisa laku cara instant semua nya harus lalu proses ajar yang terus terus dan dan
Positif,2021,ppdb adalah ikhtiar kita sama dalam cipta didik yang tuntas dan kualitas mari lanjut dan banyak kolaborasi dan sama kita semua demi tara sempat dapat didik bagi anak anak daerah khusus ibukota jakarta dan
Positif,2021,didik adalah tanggung jawab kita sama maka dari itu dinas didik daerah khusus ibukota jakarta sangat harga kolaborasi kita semua dalam tahap susun bijak ppdb
Positif,2021,paling enak ppdb jakarta sah
Positif,2021,dahulu aku benar benar taat banget sama perintah allah pas dekat dekat ppdb jakarta tiap hari tahajud doa solawat in sekolah yang aku ingin tapi takdir kata lain seperti allah beri aku yang baik aku tendang sama mana pun akhir daftar smk mungkinini yang baik
Positif,2021,waktu itu misuh misuh sama ppdb jakarta sekarang aku syukur sangat bisa temu teman yang support lebih support diri aku sendiri dripada teman smp dan yaa sekarang aku enjoy sangat sama sklhku sekarang walaupun praktek nya banyak banget iya nama juga smk sih wkwkw
Positif,2021,berkas untuk sekolah negeri tahun kemarin dasar alam saya daftar keponakan saya di sd negeri kalau di jakarta sudah bisa online system ppdb di jakarta sudah bagus nada juga tahap daftar ulang telah itu ini saya tidak tahu proses bagaimana orang tua yang urus
Negatif,2022,bagus sich sayang perata biaya didik dari apbn dan apbd belum adil harus semua siswa yang aju diri untuk sekolah lewat ppdb perintah provinsi jakarta layan semua kalau kuota negeri kurang alih kah swasta di subsidi terus jangan yang punya kjp dan pip saja
Negatif,2022,perata biaya didik yang sumber dari apbn dan apbd belum adil harus semua siswa yang aju diri lewat ppdb kah perintah provinsi jakarta harus layan semua jika kuota negeri kurang maka alih kah sekolah swasta yang mau terima pembiayaansubsidi
Negatif,2022,ingat gasihhh pas ppdb juga orang tua sudah demo gasih tapi perintah bahkan ketawa tidak peduli seperti beneran pas lagi unjuk rasa diketawain dan dibodohin gitu di depan para demo ini demi ajar loh perintah memang jahat itu iya kalgasal waktu itu pas demo kah dinas didik jakarta
Negatif,2022,kemendikbud walaupun angkat akan jadi coba nntinya hahaha semangat iya karena jujur saya masuk smk juga karena coba tertawa yang orang jakarta tahu lah iya bagaimana kacau ppdb jakarta so iya sudah cukup ppdb yang jadi hal saya waktu itu kecewa sama sistem
Negatif,2022,highschool in jakarta highschool in jakarta saya tolak ppdb daerah khusus ibukota ancrit
Negatif,2022,bukan bagamana ygy sman jakarta rangking mnrt saya pun masih tetap segani soal akan sekolah negeri sekarang sudah random gara sistem ppdb yang tidak jelas tapi tetap masih bisa masuk top iya masih bagus tadi nya saya tidak berekspektasi takut nurun jadi rank gitu anjing
Negatif,2022,tangerang oasu ppdb jakarta nolak saya akan jadi tidak bisa ikut trend high school in jakarta sudah lama tapi tetap saja sakit masih asa men
Negatif,2022,kalau negeri iya tahun kalau swasta siap anak dan ntambahan informasi saja di jakarta ntahun ajar baru ini turut sistem ppdb sodaraku yang umur tahun tendang dari daftar siswa karena ada yang umur tahun baru masuk sd bukan based rayon lagi utama based umur cobaaa
Negatif,2022,anda dana itu bisa bantu anak saya masuk sekolah sedih iya tuhan karena anak bodoh dan umur muda tidak dapat sekolah negeri padahal karena bodoh makanya saya sekolah ppdb jakarta sangat sakit hati saya bagai orgtua tunggal moga perintah provinsi dkibisa beri solusi untuk anak kami
Negatif,2022,gonta ganti bijak ppdb jakarta nilai banyak timbulkanpersoalan
Negatif,2022,juang ppdb jakarta yang belum lolos menang saja tidak apa saya juga ngerasain bagaimana tidak adil sistem sama kita yang sudah usaha maksimal mungkin semangat teman nilai tinggi percuma nyata tertawa
Negatif,2022,ppdb jakarta mohon tidak jelas banget
Negatif,2022,iyanih kayak error melulu web ppdb jakarta dari kemarin ngeselin juga
Negatif,2022,ppdb zonasi jakarta kemarin anjing nama saya pas awal awal ada di pilih pertama terus iseng lihat dua pilih saya yang lain tidak ada uang nama saya pas balik kah pilih pertama kok sudah tidak ada uang yah bolak balik scroll atas bawah dan refresh tetap tidak ada uang anjing panik akan main
Negatif,2022,tidak terima soal ppdb kunyuk jakarta tidak pakai nilai cuma zonasi sama umur
Negatif,2022,ppdb jakarta ingin saya bantai masih kesel banget saya
Negatif,2022,ppdb jakarta harus tahun anjirr saya yang tahun bulan utg di jawa barat
Negatif,2022,tidak adil banget najis ppdb zonasi jakarta masa yang udaa tua pada masuk sama tidak logiss banget anak yang harus masuk sama bahkan pada tendang masa kita harus tunggu tahun depan buat masuk sama negeri akan gila mau sampai kapa sistem nya seperti begini
Negatif,2022,ombudsman jakarta raya disdik daerah khusus ibukota jakarta gagal tanggulang histeria publik hadap ppdb lalu berita
Negatif,2022,dilema ppdb sekolah negeri jakarta numur tahun pada daftar sama negeri numur tahun pada daftar smp negeri numur di bawah nya pada geser kalau mereka daftar nnilai raport akademik kalah sama umur
Negatif,2022,dilema ppdb sekolah negeri jakarta rangking besar juara kelas juara sekolah banyak yang belum terima periode ppdb sekarang kalah sama yang punya title juara lomba atau yang punya kartu kjp
Negatif,2022,ppdb jakarta hancur banget buset
Negatif,2022,dua minggu lagi masuk sekolah dan nyata adik saya tidak terima di sekolah negeri karena sistem ppdb jakarta yang tidak masuk akal
Negatif,2022,ppdb zonasi jakarta knpsih masa teman saya harus masuk swasta gara halang umur saja padahal nilai dia trmsuk tinggi marah banget
Negatif,2022,tolong saya tidak mau gap year lagi ppdb jakarta tolong be bagus to me
Negatif,2022,ppdb jakarta jalur zonasi kenapa pada tua tua nich
Negatif,2022,sistem ppdb jakarta resah
Negatif,2022,drama ppdb online daerah khusus ibukota jakarta kembali sudah part kaya neeehh hiks hiks ketika anak dengan nilai tinggi kalah dengan anak dengan umur tinggi
Negatif,2022,ppdb jakarta kenapa tua tua banget anjing
Negatif,2022,di sama jakarta ada yang tahun kalau kata ibu saya tahun kawin saja tidak perlu daftar sama
Negatif,2022,ade nin tidak nyangkut di skolah negeri ggra klah umur mau maraaaaahhhh ppdb daerah khusus ibukota jakarta gajelaassss fakultas
Negatif,2022,ppdb jakarta seperti kotor
Negatif,2022,tidak adil ppdb zonasi jakarta
Negatif,2022,ppdb jakarta error parah ajsnnsjsjw
Negatif,2022,website ppdb jakarta cacat ngecrash melulu kaya lagi perang tiket padahal saya dari jam banget standby
Negatif,2022,web ppdb jakarta hancur ygy
Negatif,2022,apakah ada masalah pagi ini sulit sekali untuk akses web ppdb jakarta
Negatif,2022,ppdb jakarta ini kenapa gagal melulu iya padahal jaring aman kok
Negatif,2022,ini ppdb jakarta kenapa lemah otak bgttt
Negatif,2022,web ppdb jakarta mengapa beginiii
Netral,2022,untuk penuh butuh masyarakat dapat layan paud dinas didik provinsi daerah khusus ibukota jakarta buka layan ppdb tahun ajar di satu paud negerivtersebar di jakarta dengan jumlah minat yang daftar kah satu paud negeri tingkat dari tahun belum
Netral,2022,untuk penuh butuh masyarakat dapat layan paud dinas didik provinsi daerah khusus ibukota jakarta buka layan ppdb tahun ajar di satu paud negerivtersebar di jakarta dengan jumlah minat yang daftar kah satu paud negeri tingkat dari tahun belum
Netral,2022,yaallah allahu akbar ngue nyesel banget kenapa pas ppdb dahulu saya tidak milih sman atau sman jakarta nsekarang rasa nyesel dan rasa salah ampun besar banget
Netral,2022,terima serta didik baru ppdb online sama fons vitae marsudirini koja jakarta utara tahun
Netral,2022,ehhh akt afirmasi pakai umur iya untuk ppdb jakarta waktu aku akt tidak pakai umur sih soal aku afirmasi liat hanya prio zona waktu
Netral,2022,saya lihat di web ppdb jakarta walaupun sudah pakai zonasi tetapi urut pakai nya nilai akhir beda dengan jawa barat tengah timur yang zonasi mungkin banyak pakai jarak
Netral,2022,di jakarta pas ppdb sudah zonasi tapi waktu itu masih ada jalur non zonasi terus masih pakai nem atas masuk pakai umur jadi kayak di jakarta ubah baru lihat tahun depan sih
Netral,2022,harus sih pengaruh iya nder tapi bukan di jakarta itu baru mulai ppdb non un angkat iya jadi turun angkat harus bukan karena ppdb non un
Netral,2022,jakarta ppdb tidak pakai zonasi jadi pada naik
Netral,2022,jangan di daerah di jakarta saja masih ada orang tua yang gagap teknologi karena pernah saat saya lagi antri token buat isi data ppdb pertama kali tahun ada orang tua yang melas kah tugas minta dibantuin input data karena gagap teknologi bagaimana yang di daerah apalagi di area non signal kok tidak ada yang mikir iya
Netral,2022,hallo sabtu agustus pukul untuk pkbm negeri tahap rupa batas akhir lapor diri ppdb tahun dan njangan lupa bagi informasi ini kah teman mu yang butuh iya dan dan
Netral,2022,catat ini link daftar ppdb pkbm tahap tahun daerah khusus ibukota jakarta
Netral,2022,daftar ppdb pkbm tahap di daerah khusus ibukota jakarta resmi buka simak jadwal
Netral,2022,kakak kakak kelas yang kemarin ikut ppdb jakarta terus ngegunain urus ekstrakulikuler itu perlu surat di lantik atau surat akhir begitu tidak si kaya urus osis
Netral,2022,hallo ikut jadwal daftar ppdb pkbm negeri tahap tahun dan njangan lupa bagi informasi ini kah teman mu yang butuh iya dan dan
Netral,2022,hallo ikut jadwal daftar ppdb pkbm negeri tahap tahun dan njangan lupa bagi informasi ini kah teman mu yang butuh iya dan dan
Netral,2022,hallo hari ini rabu agustus pukul untuk pkbm negeri tahap rupa batas akhir lapor diri ppdb tahun dan njangan lupa bagi informasi ini kah teman mu yang butuh iya dan dan
Netral,2022,hallo ikut jadwal lapor diri ppdb pkbm negeri tahap i tahun dan njangan lupa bagi informasi ini kah teman mu yang butuh iya dan dan
Netral,2022,tidak di jakarta saja kota kota lain juga banyak tambah sama sistem ppdb yang seperti sekarang
Netral,2022,giat asn pada pusat latih kerja daerah jakarta timur ikut podcast rabu ajar episode kah dengan tema terima serta didik baru ppdb lalu kanal youtube jakarta public policy center bpsdm daerah khusus ibukota jakarta selenggara oleh bpsdmprovinsi daerah khusus ibukota jakarta
Netral,2022,mungkin tidak diterapin di jakarta kalau ppdb sekolah negeri itu sudah zonasi arti harus yang satu camat gitu iya sama sekolah tapi kurang vaham juga sih kayak masih ada yang tinggal jauuh
Netral,2022,bagi orang tua atau wali yang sah dari siswa yang ingin daftar anak di jalur zonasi zonasi siswa baru ppdb daerah khusus ibukota jakarta untuk smp dan sama tahun harap acu
Netral,2022,deobitna proudly present ppdb jalur playlist resah jacob in jakarta ayo temennya diajakin daftar dan
Netral,2022,iyaaa tapi tangerang sama jakarta memang samaaa maksud kamu sudah tauu belum sistem ppdb tangerang gimanaaaa apa sama saja
Netral,2022,hahahaha haloo aku kakel mts kamu ngomong-ngomong tapi aku tidak jadi daftar di sana karena tahun kemarin ppdb sama jakarta tidak nerima kakak tangerang
Netral,2022,hallo hari ini jumat juli pukul rupa batas akhir lapor diri ppdb tahun cara daring dan njangan lupa bagi informasi ini kah teman mu yang butuh iya dan dan
Netral,2022,hallo hari ini jumat juli pukul rupa batas akhir lapor diri ppdb tahun cara daring dan njangan lupa bagi informasi ini kah teman mu yang butuh iya dan dan
Netral,2022,sur sur liaatt sudah sur tertawa ncr ppdb jakarta
Netral,2022,cara lapor diri ppdb jakarta tinggal klik
Netral,2022,hallo ikut jadwal lapor diri ppdb tahun cara daring dan njangan lupa bagi informasi ini kah teman mu yang butuh iya dan dan
Netral,2022,ppdb sama sama smk daerah khusus ibukota jakarta tahap akhir dan cara lapor diri
Netral,2022,hallo ikut jadwal lapor diri ppdb tahun cara daring dan njangan lupa bagi informasi ini kah teman mu yang butuh iya dan dan
Netral,2022,ppdb sd daerah khusus ibukota jakarta tahap tiga link umum dan cara lapor diri
Netral,2022,ppdb jakarta sudah tutup akan ini tidak bisa daftar lagi kann
Netral,2022,ppdb mtsn man daerah khusus ibukota jakarta tahap akhir link umum dan cara lapor diri
Netral,2022,ppdb mtsn man daerah khusus ibukota jakarta tahap akhir link umum dan cara lapor diri
Netral,2022,alam ikut ppdb online daerah khusus ibukota jakarta part
Netral,2022,mau tanya apakah bisa ikut ppdb depok jika kakak daerah khusus ibukota jakarta tapi tinggal daerah cere mohon info apa saja syarat dan jalur mana yang harus diikiuti terima kasih
Netral,2022,aku cuma nyeritain soal tim coach saya yang siap buat igt terus si emak nyeletuk kamu tidak ikut kah jakarta juga nbusetdah kata join igt seperti ppdb sama apa menang banget
Netral,2022,ppdb sama hang tuah jakarta sudah tutup selamat gabung di sama hang tuah jakarta dan dan
Positif,2022,bu di pulau ribu itu sama nya cara fisik bagus tapi kalau liat di ppdb banyak yang tidak daftar ulang mau usul kenapa tidak buat kayak sama unggul saja yang pakai asrama jadi calon siswa dari jakarta tidak perlu khawatir untuk daftar sana
Positif,2022,baik sistem zonasi ppdb daerah khusus ibukota jakarta indikasi numpang kakak banyak laku nhapuskan lurah langsung camat saja lalu sort pakai waktu daftar dan pilih sekolah boleh tambah nilai ipk umur hapus dan dan
Positif,2022,benar semua hal harus syukur cuma if i could do this waktu ppdb saya harus tetap milih sekolah di jakarta apa itu sekolah asal di jakarta
Positif,2022,wakil gubernur daerah khusus ibukota sebut sistem ppdb di jakarta tingkat kualitas siswa dan sekolah dan dan
Positif,2022,wakil gubernur daerah khusus ibukota jakarta ahmad riza patria klaim sistem terima serta didik baru ppdb saat ini hasil tingkat kualitas murid dan sekolah
Positif,2022,saat akhir ppdb ulang tahun telah ayah benar usaha dengan keras agar aku sekolah negeri dan akhir aku bisa masuk kah makin favorite di jakarta bahkan besar di indonesia aku menang lompat dengan sahabat karena bisa sekolah lagi telah tahun kerja
Positif,2022,kak min sori link lapor diri nya di mana saya cari cari di website ppdb jakarta tidak ketemu juga mesti kasih kolom button khusus lapor diri telah kolom pantau hasil seleksi supaya mudah tolong kasih link yang benar terima kasih
Positif,2022,buset ppdb tangerang japresnya tidak bisa liat hasil seleksi di webnya curiga pada nyogok tertawa buset deh bang asa kemarin jakarta tidak gitu banget sudah jakarta mana berani begini tertawa kepseknya langsung panggil kali
Positif,2022,kenapa sistem ppdb online banten tidak kayak daerah khusus ibukota jakarta iya semua serta tampil di web terima gaknya clear lihat karena nilai raport lihat peluang suap juga susah tapi kalau tutup ujug umum apa yang jadi di balik itu yang bisa jadi tidak fair
Positif,2022,saya turut prihatin apabila adik ini harus gap year lama tahun dan nnamun usul soal zonasi harus sampai kah gubernur daerah khusus ibukota jakarta dan bukan kah admin ppdb sebab meta zonasi tetap oleh atur gubernur ada nomor dan nadmin ppdb tidak bisa apa apa juga sih
Positif,2022,kalau ppdb jakarta ada sekolah unggul dan nilai bagus
Positif,2022,turut saya usaha nder saya pindah kakak buat sekolah gara-gara keluarga tidak ada uang buat sekolah jadi mau tidak mau cari sekolah yang gratis iya jakarta saja jadi pindah ngomong-ngomong nder ngurusnya gratis kok cuma bayar fc data saja lagi saya pindah pas belum ada sistem ppdb zonasikok tertawa
Positif,2022,sandang disabilitas juga bisa ikut ppdb sama daerah khusus ibukota jakarta kok dan dan
Positif,2022,ppdb jakarta japres lolos seleksi dan lulus di smp juga huhuhu puji tuhan syukur sangat nbuat teman yang belum lolos seleksi ppdb japres moga di jalur afirmasi zonasi bisa terima di sama yang ingin aaamiiinnnn ngood luck teman semangat
Positif,2022,alhamdulillah terima ppdb jakarta jalur prestasi walaupun bukan di sama yang saya bayang tapi ini cukup untuk saya nthanks god
Positif,2022,hari pertama ppdb daerah khusus ibukota jakarta jalan lancar dan dan
Positif,2022,komisi lindung anak indonesia ppdb jakarta jalan lancar lupa password akun dominasi masalah di poskoppdb
Positif,2022,moga lolos ppdb gel jakarta moga juga kakak jauh dari sial lancar dan mudah dalam segala urus aamiin rajin doa saja kak semangat jangan nyerah njaga sehat iya banyak makan minum istirahat bagus luck have a bagus day
Positif,2022,salut sih sama yang bikin presentil akademik ppdb daerah khusus ibukota jakarta tahun ini bisa detail itu dalam hitung presentil akademik nilai akademik nilai non akademik akreditasi peringkat angkat semua ramu jadi satu nilai untuk wakil ikut jalur prestasi
Positif,2022,kalau ada yang sulit ppdb daerah khusus ibukota jakarta bisa japri aku yaaa karena lagi stand by depan laptop juga bantuin sodara
Positif,2022,ppdb jalur zonasi beda dengan jalur afirmasi kjp dan kawan njalur ini ada karena aspirasi keluh warga di sekitar sekolah tapi dapat sekolah yang jauh nutk jakarta kota besar mungkin tidak masalah karena jml sekolah banyak jarak cukup rapat tapi di daerah ada yang harus keluar wil kabupaten
Positif,2022,demi mudah orang tua murid posko layan ppdb wilayah ii jakarta barat akan sedia laptop
Positif,2022,demi mudah orang tua murid posko layan ppdb wilayah ii jakarta barat akan sedia laptop
Positif,2022,ombudsman jakarta raya minta agar seluruh pihak agar sama sama jaga integritas laksana ppdb dan nkira kira apa saja yang sering kalian alami ketika laksana ppdb
Positif,2022,tapi memang iya sih miin ppdb banten itu tidak transparan tidak kaya ppdb jakarta dan yang harus sekolah negeri itu tidak boleh siswa kelas tapi nyata banyak sekolah negeri satu kelas sampai orang siswa
Positif,2022,informasi ppdb jakarta mulai cari purwosusilo sistem lebih variatif tara masyarakat
Positif,2022,guna hindar salah serta hal yang tidak ingin suku dinas didik wilayah jakarta pusat gencar sosialisasi mekanisme daftar ppdb kepada orang tua murid dan dan dan dan dan dan dan
Positif,2022,perintah provinsi daerah khusus ibukota jakarta nyata terima serta didik baru ppdb daring lebih variatif demi bentuk kualitas didik yang lebih baik dan dan
Positif,2022,selain cari informasi aku saranin kamu ikut ppdb jakarta juga karena kalau ppdb banten sistem nya turut ku kurang transparan jadi gantung hoki terus kalau ppdb banten itu pas seleksi nya kita tidak bisa lihat tapi kalau ppdb jakarta kita bisa pantau lewat web begitu
Positif,2022,wakil gubernur daerah khusus ibukota jakarta ahmad riza patria kata selenggara terima serta didik baru ppdb akan jalan makin baik
Positif,2022,saya ppdb jakarta pakai jalur luar kota alhamdulillah langsung terima pil nder tidak geser padahal umur nya masuk muda tidak tahu si ini diitung apa tidak
Positif,2022,didik adalah tanggung jawab kita sama maka dari itu dinas didik daerah khusus ibukota jakarta sangat harga semua masuk dalam tahap susun bijak ppdb tahun ajar
