sentimen,tahun,teksbersih
Negatif,2021,please mau sekolah mana cobaa di tolak tidak sekolah sama ppdb tahap jakarta pliss saya sudah kalah di japres karena persentil di zonasi saya kalah umur tahap kenapa persentil lagi sii woiii
Negatif,2021,sudah capek saya ppdb jakarta gajelas
Negatif,2021,sudah sekian jam sejak buka tampil masih begini bagaimana kita tahu bahwa kita masuk atau tidak
Negatif,2021,serius ingin tanya ada yang tahu tidak kenapa perintah buat sistem ppdb jakarta jalur zonasi pakai umur dan jarak begini bukan nilai kalau seperti begini terus bisa stress karena umur saya muda
Negatif,2021,bulan stress cuma karena ppdb jakarta aneh
Negatif,2021,web ppdb jakarta eror terus huhu
Negatif,2021,ppdb jakarta makan gaji buta gajelas atur kasi anak
Negatif,2021,ppdb jakarta tolong pecat pegawai pegawai yang tidak bisa kerja bijak yang gamasuk akal makin gila saja atur kola iya pakai nilai bukan umur
Negatif,2021,ppdb jakarta gajelas
Negatif,2021,oalah luar jakarta itu offline iya kalau di jakarta dari sudah ppdb online lupa sejak kapan mulai online dan dari dahulu sampai sekarang pasti ada saja masalah di servernya heran saya tidak ubah padahal sudah tahun tahun
Negatif,2021,kasihan banget lihat ibu yang pasrah tunggu sisa kursi sekolah benar ppdb yang uras emosiiiii
Negatif,2021,ppdb jakarta sekarang kacau banget sistem prestasi pakai umur persentil sistem zonasi pakai umur sudah deh yang umur muda tapi pintar kalah sama yang umur lebih lebih lebih
Negatif,2021,ppdb jakarta ngaretnya lebih ih sia sia saya bangun pagi aaaabbhhjiiiinnggg
Negatif,2021,ppdb jakarta kenapa sistem ngeselin sudah
Negatif,2021,ppdb jakarta tahap dua belum bisa pilih skolah padahal sudah jam lewat
Negatif,2021,ini ppdb jakarta bagamana sii saya mau daftarin sepupu saya biar cepat bahkan tidak bisa milih skolah
Negatif,2021,ini bagaimana ppdb jakarta masa tidak ada pilih sekolah nya
Negatif,2021,ini bukan cuma saya saja akan yang tahap dua tidak ada tulis pilih sekolah sumpaahh takut bnget dan dan
Negatif,2021,welcome to jakarta ndimana ppdb njalur prestasi bukan nilai akademik saja ntetapi bahkan ada nilai non akademik dan nwelcome to jakarta ndimana ppdb yang kata jalur zonasi ntapi yang terima bahkan yang umur lebih tua
Negatif,2021,heh iya sih aku juga kaget di ppdb jakarta untung di tempat ku belum ada sistem umur masih nilai
Negatif,2021,baru lihat ppdb sama negeri di daerah khusus ibukota salah satu sama kualitas di jakarta barat dari siswa yang terima semua atas tahun yang usia bawah tidak terima dan nkeberpihakan tidak nkeadilan tidak dan ncarut marut bijak
Negatif,2021,orangtua protes ppdb zonasi jakarta jarak meter tidak lolos gara gara kalah umur nklik untuk baca dan nterpaksa kalah karena sistem tidak jelas paksa tidak sekolah karena tidak bisa saing sama yang lebih tua kasi s dd dan
Negatif,2021,sistem ppdb jakarta hancur hancur
Negatif,2021,ppdb jakarta anjing sudah
Negatif,2021,umur punya kartu tanda duduk bisa kerja numur tahun kartu tanda duduk tidak punya mau kerja apa bagi calon siswa yang tidak mampu masuk swasta dan dan dan
Negatif,2021,ngeselin sudah pakai umur segala zonasi saya yang masih tahun bulan tidak bisa apa apa lebih baik kalau kemarin jalur prestasi pakai rapot saja saya bisa masuk anj padahal nilai saya besar
Negatif,2021,dan dan dan nditunggu action nya npara orang tua sudah pusing soal covid njangan tambah beban lagi soal ppdb dan dan dan
Negatif,2021,semangat yaa aku dom jakarta juga pusing banget mau masuk sama ppdb sistem gajelas kemarin aku ikut zonasi kalah di umur semangat kamuuu fighting pasti ada jalan keluarr
Negatif,2021,gajelas banget bolol ini orang memang kualitas negeri jakarta sudah jelek gede rasa ppdb dari tahun lalu makanya saudara laki main dahulu sini kah jakarta biar tahu keras nya bagamana didik sekarang sini kamu ngerasain saja kgk
Negatif,2021,bubarkaan nhanya bikin rusak generasi terus dengan bodoh sistem dan dan dan dan dan dan
Negatif,2021,aduh kasi deh cilandak barat tidak punya sama negeri
Negatif,2021,pusing banget sama ppdb jakarta umur saya baru tahun bulan belum ada menit langsung kah gepak seperti kereta cepat
Negatif,2021,ppdb jakarta stress anjing
Negatif,2021,hah memang ppdb jakarta masih pakai umur
Negatif,2021,iya salah banget ppdb jakarta masa iya tahun baru mau masuk sama jdnya yang kecil pada swasta sedih banget
Negatif,2021,sudah tahun ini ppdb daerah khusus ibukota masalah didik kualitas atau umur yang kualitas tidak semua keluarga di jakarta mampu untuk sekolah swasta pilih gap year bahkan timbul gunung es kah depan tolong bapak ibu yang hormat timbang ulang
Negatif,2021,ada yang orang jakarta tidak kamu tidak kesel apa sama ppdb zonasiii tahun masih terima jing duhhh kalau gni saya gaush pikir nilai yang penting umur saya tua
Negatif,2021,plss depresot banget sama ppdb jakarta sistem zonasi kurang adil
Negatif,2021,yang tua yang sekolah nyg muda hancurrr nmenuju dan dan dan dan
Negatif,2021,jalur umur ini mah bukan jalur zonasi badut banget ppdb jakarta
Negatif,2021,mungkin kalau aku ppdb di jakarta sudah tidak masuk deh
Negatif,2021,lelah sama sistem ppdb jakarta
Negatif,2021,tidak tahu ini bohong banget memang ppdb jakarta tidak jelas
Negatif,2021,gimanasi ppdb jakarta katamya zonasi kok pakai umur aneh
Negatif,2021,rebut booking vaksin di jakarta bikin sakit perut asa ppdb
Negatif,2021,tolong iya ini mah yang tua bisa terima padahal jarak nya jauh mksdny gman iya lalu kita yang lahir nya tahun yang mana umur umum anak sama baru tidak terima itu bagaimana nengga erti sama jalan fikir perintah yang nerapin sistem baru ppdb jakarta nkita orang yang benar mau sekolah
Netral,2021,kalau di dom jakarta tidak pengaruh nder kemarin aku ppdb yang pakai rapot smstr saja
Netral,2021,bisa nder coba search ppdb saja sebentar juga muncul kalau masalah nilai yang murni di ppdb jakarta bidang prestasi kurang tapi dar informasi saja yang kuat itu kalau ada nilai dari lomba lomba urus ekskul
Netral,2021,lombanyaa kira kapann soalya kalau ppdb jakarta kalau gasalaa lomba maksimal bulan belum daftar ppdb gituu
Netral,2021,kalau kamu di daerah jakarta pakai zona zona saja nder yang ppdb kemarin dan kalo jarak kah sekolah m bisa gamasuk zona utama begitu tapi kalau bukan di jakarta kurang tahu deh
Netral,2021,sudah siap ikut tes seleksi ppdb madrasah istiqlal jakarta t per dan dan njangan sampai lewat iya sabtu desember
Netral,2021,presentasi ppdb di smp dan jakarta dan
Netral,2021,presentasi ppdb di smp dan jakarta dan
Netral,2021,hari ini kita tim ppdb tahun ajar kunjung kah smp dan jakarta dan
Netral,2021,indonesia
Netral,2021,indonesia
Netral,2021,kemarin sudah ngecek ppdb jakarta sd negeri inceran dia paling kecil masuk usia tahun bulan mudah an nanti nadim lolos deh di smp sama negeri karena mirip kamu mbak meth ingin sd swasta smp sama nya negeri
Netral,2021,akan kita pasti dapat apa iya semacem sertif urus osis iya nah itu sama sekolah dilampirin gituu jadi kayak dapat nilai plus ngomong-ngomong ini aku ppdb jakarta
Netral,2021,yahhh karena ppdb jadi tidak bisa iya kamu memang di jakarta mana deh
Netral,2021,ppdb sama sama daerah khusus ibukota jakarta mulai ini daftar sama swasta yang libat serta kuota
Netral,2021,ppdb sama sama daerah khusus ibukota jakarta mulai ini daftar sama swasta yang libat serta kuota
Netral,2021,ppdb sama sama daerah khusus ibukota jakarta mulai ini daftar sama swasta yang libat serta kuota
Netral,2021,ppdb sama sama daerah khusus ibukota jakarta mulai ini daftar sama swasta yang libat serta kuota
Netral,2021,ppdb sama sama daerah khusus ibukota jakarta mulai ini daftar sama swasta yang libat serta kuota
Netral,2021,ppdb sama sama daerah khusus ibukota jakarta mulai ini daftar sama swasta yang libat serta kuota
Netral,2021,ppdb sama sama daerah khusus ibukota jakarta mulai ini daftar sama swasta yang libat serta kuota
Netral,2021,ppdb sama sama daerah khusus ibukota jakarta mulai ini daftar sama swasta yang libat serta kuota
Netral,2021,ppdb sama sama daerah khusus ibukota jakarta mulai ini daftar sama swasta yang libat serta kuota
Netral,2021,ppdb sama sama daerah khusus ibukota jakarta mulai ini daftar sama swasta yang libat serta kuota
Netral,2021,ppdb sama sama daerah khusus ibukota jakarta mulai ini daftar sama swasta yang libat serta kuota
Netral,2021,smk mau tanya misal aku dari jakarta timur mau ppdb di jakarta selatan itu bisa tidak
Netral,2021,saya mau tanya deh misal dari jakarta timur mau ppdb sama di jakarta selatan itu bisa tidak
Netral,2021,ppdb sama sama daerah khusus ibukota jakarta mulai ini daftar sama swasta yang libat serta kuota
Netral,2021,ppdb sama sama daerah khusus ibukota jakarta mulai ini daftar sama swasta yang libat serta kuota
Netral,2021,ppdb sama sama daerah khusus ibukota jakarta mulai ini daftar sama swasta yang libat serta kuota
Netral,2021,ppdb sama sama daerah khusus ibukota jakarta mulai ini daftar sama swasta yang libat serta kuota
Netral,2021,sd kartika jaya tidak jakarta dengan kepala sekolah pak pamuji sukses jadi yang baik di daerah khusus ibukota jakarta apa tips beliau untuk guru anak dan orang tua untuk ajar dan ppdb di masa pandemi ayo kita poin teman
Netral,2021,ngomong-ngomong itu aku ppdb jakarta iya coba tanya ppdb kota saja
Netral,2021,catat baik baik begini alur dan tempat ppdb sd sama jalur zonasi di jakarta
Netral,2021,adik saya tahun ini lulus smp dan mau lanjut kah sama ikut ppdb daerah khusus ibukota jakarta beuh iya ampun deg degan
Netral,2021,buka sampai besok ini tata cara daftar ppdb sama sekolah negeri dan swasta di jakarta dan dan
Netral,2021,catat baik baik begini alur dan tempat ppdb sd sama jalur zonasi di jakarta
Netral,2021,tidak ada total calon serta didik cpd yang telah advokasi pada tanggal juni hingga juli oleh posko ppdb psi jakarta antara hasil terima di sekolah yang pilih dan dan
Netral,2021,ppdb sama sama daerah khusus ibukota jakarta mulai ini daftar sama swasta yang libat serta kuota
Netral,2021,catat baik baik begini alur dan tempat ppdb sd sama jalur zonasi di jakarta
Netral,2021,stud teman ada yang tahu sistem ppdb jakarta tahun depan tidak untuk japres nmakasih
Netral,2021,simak jadwal lengkap ppdb madrasah daerah khusus ibukota jakarta jenjang mi mts dan sama
Netral,2021,anies baswedan batal sistem zonasi ppdb daerah khusus ibukota jakarta tandatangani petisi lalu
Netral,2021,ombudsman jakarta raya panggil kadisdik provinsi jawa barat kait ppdb jenjang sama smk wilayah bogor depok dan bekas lalu
Netral,2021,ombudsman jakarta raya layang panggil pada kadisdik jawa barat kait ppdb sama smk di bodebek dan
Netral,2021,dalam lapor kait ppdb sama smk di bodebek ombudsman panggil kadisdik jawa barat beberapa masalah yang lapor kepada ombudsman jakarta raya yakni upa duga tindak malaadministrasi usul kuota siswa selain itu proses nilai pada
Netral,2021,jakarta sudah ri depok masih ribet ppdb yak
Netral,2021,bisa tapi kalau ikut ppdb jakarta yang jalur zonasi umur tidak akan lolos kayak
Netral,2021,kamis komisioner komisi lindung anak indonesia retno listyarti tim laku awas ptm dan ppdb di sman jakarta komisi lindung anak indonesia juga minta jelas kait laksana vaksin anak usia tahun yang akan masif dengan libat pihaksekolah dan puskemas dekat
Netral,2021,beda dengan ppdb daerah khusus ibukota jakarta ombudsman sebut ada temu duga maladministrasi di ppdb bodebek dan dan lewat
Netral,2021,ppdb jakarta dan yogyakarta dan dan nso junghwan one tweet angkat udara dan gionashe
Netral,2021,ombudsman akan periksa kadisdik provinsi jawa barat dan provinsi banten ihwal duga jumlah langgar dalam laksana ppdb tahun ajar ppdb di daerah khusus ibukota jakarta pun dapat jumlah catat minor
Netral,2021,simak jadwal lengkap ppdb madrasah daerah khusus ibukota jakarta jenjang mi mts dan sama
Netral,2021,anies baswedan batal sistem zonasi ppdb daerah khusus ibukota jakarta tandatangani petisi lewat
Netral,2021,ombudsman akan periksa kepala dinas didik provinsi jawa barat dan provinsi banten ihwal duga jumlah langgar dalam laksana terima serta didik baru ppdb tahun ajar dalam laksana ppdb di daerah khusus ibukota jakarta
Netral,2021,assalamualaikum warahmatullahi wabarakatuh dan ninformasi ppdb smk gita kirtti jakarta dan nbarangkali masih bingung cari sekolah yang tepat untuk putra putri smk gita kirtti masih terima daftar siswa baru dan nterima kasih atas perhati nwassalamualaikum wr wb dan dan
Netral,2021,laksana ppdb tahun ajar di makin jakarta
Netral,2021,tutup ppdb tanggal juli homeschooling talenta jakarta timur
Netral,2021,ppdb sama sama daerah khusus ibukota jakarta mulai ini daftar sama swasta yang libat serta kuota
Netral,2021,ppdb smk gita kirtti jakarta masih buka npendaftaran jangkau segera daftar segera anak saudara tetangga kalian kah sekolah kami ndalam bidang managemen dan bisnis kita maju sama dan
Netral,2021,tahu waktu itu akan kamu pernah ngetweet ppdb begitu jakarta
Netral,2021,
Netral,2021,
Netral,2021,untuk informasi lebih lanjut kena ppdb daerah khusus ibukota jakarta sila hubung call center di bawah ini pada hari dan jam kerja dan ntelp hotline dan dan ntelp posko dinas dan dan dan dan dan dan dan nterima kasih
Netral,2021,assalamu alaikum wr wb dan nbagi putra i ayah bunda yang belum dapat pilih sekolah dapat daftar lalu batas dan dan
Netral,2021,untuk informasi lebih lanjut kalian dapat ikut dan ninstagram
Netral,2021,ombudsman wakil jakarta raya temu beberapa duga malaadministrasi pada ppdb tingkat sama smk di bodebek
Positif,2021,tidak juga si nder aku juga tidak aktif dahulu tapi kalau di ppdb terus ppdb jakarta masuk kah organisasi jadi urus ekskul bakal peran besar nderr jadi coba lakuin hal itu kalau mau lanjut kah negeri
Positif,2021,daerah khusus ibukota itu paling bagus ppkm masih bisa salur bansos juta per kakak untuk yang hak program vaksin sudah ajar tatap muka sudah ppdb lancar dead rate covid dahulu tinggi sekarang jadi turun jakarta pintar jakarta linko warga daerah lain saja iri dengan daerah khusus ibukota
Positif,2021,saya ingat saat mas goldy papar dampak positif dari ppdb daerah khusus ibukota jakarta yang sempat tuai profesional kontra saat rapat sama di dan nada sesuai data antara latar belakang ekonomi keluarga siswa baru dengan data tingkat ekonomi per kelompok masyarakat di daerah khusus ibukota jakarta
Positif,2021,kemarin di ppdb jakarta osis juga penting apalagi kalau jabat osisnya tinggi lumayan banget tambah nilai
Positif,2021,ppdb dan alhamdulillah nya di ini aku bisa terima di salah satu sama negeri di jakarta pusat jadi poin utama dan kalau kalian yang angkat smp mau ikut ppdb sama lagi tahun alias gapyear bisa langsung ikut saja tanpa harus datang kah mana
Positif,2021,komisi lindung anak indonesia ppdb daerah khusus ibukota jakarta libat sekolah swasta patut tiru
Positif,2021,aku korban ppdb jakarta sudah usaha maximal buat ips tapi belum rezeki jjr sedih banget asli sempat kacau banget pas tidak terima ips aku mau swasta tapi ada ekonomi lagi kurang bagus jadi yaudahlah ipa saja inti semangat semua mau kalian linjur atau tidak
Positif,2021,yang punya kjp lebih baik daftar tahap sama yang swasta biar rata bagi sekolah swasta masih banyak yang kosong ppdb jakarta
Positif,2021,buat orang tua ini saran buat ikut ppdb tahun depan jamin masuk sekolah yang tuju beli rumah yang satu retweet rw sama sekolah yang tuju dari sekarang kalau anak belum tahun gapyear saja main tahun lagi di sd smp lebih bagus tahun main
Positif,2021,kemarin sore saya unjung posko ppdb terima serta didik baru di sekolah sman jakarta terima siswa jalan lancar tapi ada beberapa catat aspirasi yang saya terima dan nanti akan saya tindak lanjut kah dinas kait
Positif,2021,saya sudah kira jalur zonasi bakal rumit ini sih makan pas japres saya hantem saja terus an mau sekolah jauh seperti atau bukan sekolah impi saya karena tidak mampu kalau sekolah swasta awal saya sakit hati karena tidak terima nilai saya harus bisa masuk sekolah yang saya mau
Positif,2021,ppdb jakarta bagus juga bisa pantau begitu calon serta didik saya yang kudet apa memang ini sistem baru
Positif,2021,semangat buat podb jakarta minggu kemarin ngurusin ppdb tidak bisa tidur alhamdulillah sudah selesai
Positif,2021,buat yang belum terima jakarta atau belum ada nama di daftar seleksi login ulang kemudian daftar lagi dengan pilih sman lain yang masih dalam zona nya nanti akan muncul status terima atau belum terima nklo belum terima daftar lagi saja semangat
Positif,2021,mbak saya memang tidak di jakarta tapi mau usul saja kalau di jogja sini nemu kendala saat daftar sekolah kita langsung kah dinas didik konsul sana nanti arah biasa masalah bisa beres kecuali kalau kita memang langgar atur ppdb
Positif,2021,hai ada sekolah rupa tidak di jakarta aku sudah coba hubung bberapa orang untuk tolong anak kawan aku yang ancam tidak sekolah lagi tahun ini karena kembali gusur di ppdb daerah khusus ibukota tapi belum ada yang merespon terimakasih iya
Positif,2021,untuk penuh minta masyarakat pada tahun ini psi jakarta kembali buka posko layan ppdb pada titik di daerah khusus ibukota jakarta dan dan dan
Positif,2021,saya baru tahu ppdb jawa barat hasil seleksi tidak bisa di pantau tiap hari seperti ppdb jakarta iya
Positif,2021,hallo sahabatdisdik apa kamu tahu npemprov daerah khusus ibukota jakarta pada saat ini punya program ppdb sama pada program ini dinas didik provinsi daerah khusus ibukota jakarta kolaborasi sama sekolah swasta dalam tingkat daya tampung serta didik serta tingkat tara mutu didik
Positif,2021,hebat posko ppdb jakarta professional sangat layan masyarakat sungguh salut ingin segera pindah kah jakarta tapi kalau pindah sekarang tahun depan kknya belum genap tahun takut bingung daftar skolah
Positif,2021,ppdb jakarta nyata ada yang bagus juga
Positif,2021,siang saya saat ini sedang ecek bagaimana jalan ppdb yang sedang langsung di sman manggis jakarta barat semua proses memang lebih atur banding tahun lalu namun ada beberapa catat yang dapat optimal depan dan
Positif,2021,terima kasih atas percaya warga yang telah manfaat layan posko ppdb dari psi jakarta dan nayo maanfaatkan layan damping daftar ppdb online cara gratis cek thread di bawah ini untuk informasi kontak dan lokasi layan dan dan
Positif,2021,kamu temu masalah lama proses ppdb jakarta kamu bisa loh lapor masalah kah kanal adu milik perintah provinsi daerah khusus ibukota jakarta dan npenting untuk tahu cara lapor masalah ppdb dengan baik dan benar baca artikel ikut iya dan dan
Positif,2021,benar deh saya kecewa sama sistem sumpah tapi yaa mau bagaimana lagi doain iya kakak saya bakal nyoba lagi jalur zonasi yang tidak terima semangat jangan menyerahh masih ada jalur lanjut okee always doa yaaa love love dan dan
Positif,2021,kemarin sila cpdb meng update data di sidanira ini buka peluang kepada siswa menginput data tambah tentang urus siswa di osis atau ekskul siswa orang tua buru hadap sekolah dengan bawa bukti tambah urus di osis atau ekskul dan
Positif,2021,perintah daerah khusus ibukota jakarta gandeng sekolah swasta untuk tambah daya tampung bagi calon siswa dari jalur afirmasi dalam terima serta didik baru ppdb tahun ini kerja sama ini utama di lurah yang tidak milik sekolah
Positif,2021,keren pak anies masalah sudah beres tapi akan lebih baik lagi kalau tidak perlu ada masalah sejak hari pertama bapak akan dahulu juga menteri akan pak tahu akan pak daftar ppdb seperti apa dan dan
Positif,2021,keren pak anies masalah sudah beres tapi akan lebih baik lagi kalau tidak perlu ada masalah sejak hari pertama bapak akan dahulu juga menteri akan pak tahu akan pak daftar ppdb seperti apa dan dan
Positif,2021,jakarta update posko ppdb partai adil sejahtera pasar rebo siap bantu masyarakat
Positif,2021,keren pak anies masalah sudah beres tapi akan lebih baik lagi kalau tidak perlu ada masalah sejak hari pertama bapak akan dahulu juga menteri akan pak tahu akan pak daftar ppdb seperti apa dan dan
Positif,2021,kurang lebih ini kriteria nilai seleksi jalur prestasi ppdb daerah khusus ibukota jakarta tahun ini sila yang punya adik anggota keluarga yang masih sekolah bisa motivasi dari sekarang
Positif,2021,komisi lindung anak indonesia ppdb daerah khusus ibukota jakarta libat sekolah swasta patut tiru
Positif,2021,ppdb daerah khusus ibukota jakarta akan libat sekolah swasta bagai pilih didik calon siswa adapun biaya spp siswa yang terima akan gratis lalu detikedu
Positif,2021,wakil gubernur daerah khusus ibukota ppdb cara online di jakarta langsung sangat baik
Positif,2021,ppdb di jakarta utara jalan baik
Positif,2021,perintah kota administrasi jakarta utara pasti laksana daftar serta didik baru ppdb kendali dan dan dan dan
Positif,2021,pada ppdb ini dinas didik ingin hilang stigma sekolah negeri favorit seluruh sekolah negeri di jakarta milik mutu yang sama sehingga bentuk sekolah sekolah negeri dengan variasi serta didik yang tinggi dan rasa gotong royong untuk maju sama
Positif,2021,apresiasi untuk disdik provinsi daerah khusus ibukota jakarta dalam layan masyarakat di masa ppdb ini dan dan
Positif,2021,gubernur daerah khusus ibukota jakartaanies baswedanmemastikan dua masalah situsppdbdki jakarta tahun sudah beres dan tangan dengan baik dan
Positif,2021,sudah ada baik betul anak saya juga ikut ppdb daerah khusus ibukota awal memang agak masalah program sidanira bahkan luar biasa gubernur daerah khusus ibukota jakarta ikut pantau karena dia mantan mendikbud ri jadi tahu ini hal yang vital bagi bibit sdm di daerah khusus ibukota jakarta kah depan gercep monitor yang sangkut
Positif,2021,senjata saya saat itu adalah pc intel atom dengan memori gb modem flash telkomsel dan ntahun demi tahun lalu sulit ketidakcakapan akses inet nyata masih kerap muncul dan nuntungnya beberapa warung internet di jakarta buka jasa asistensi ppdb solidaritas yang bagus
Positif,2021,sempat kendala perintah provinsi daerah khusus ibukota hasil baik sistem ppdbjakarta
Positif,2021,kendala teknis sudah baik gubernur anies pasti proses ppdb di jakarta landas tara berita jakarta
Positif,2021,kendala teknis sudah baik gubernur anies pasti proses ppdb di jakarta berlandaskankesetaraan
Positif,2021,kendala teknis sudah baik gubernur anies pasti proses ppdb di jakarta berlandaskankesetaraan
Positif,2021,gubernur daerah khusus ibukota jakarta anies baswedan gercep dan pasti sulit dalam aju akun saat ppdb tahun ajar sudah bisa atas dan sudah bisa akses
Positif,2021,gercep banget ini dan nppdb daerah khusus ibukota jakarta masalah pak gubernur turun tangan pasti proses lancar dan nbangga saya punya gubernur seperti beliau
Positif,2021,baik di respon cepat telah dapat aspirasi dari masyarakat dan dan
Positif,2021,alhamdulillah kendala yang kemarin sempat muncul dan rasa para siswa dan orangtua yang ikut ppdb jakarta sudah tangan dengan baik dan dan dan
Positif,2021,demi beri layan baik unti para wali murid yang sulit untuk akses ebsite terima serta didik baru ppdb gubernur daerah khusus ibukota jakarta anies baswedan siap tempat layan di jumlah titik dan dan
Positif,2021,posko ppdb psi jakarta hadir kembali dan nkami siap damping kamu dalam proses daftar terima serta didik baru ppdb daerah khusus ibukota jakarta hubung nomor di bawah ini sesuai dengan domisili kamu dan nsebarkan jangan henti di kamu dan dan
Positif,2021,karena tiap kita adalah juang apa upaya baik yang sedang juang dan nbeberapa dpra partai adil sejahtera di daerah khusus ibukota jakarta buka posko untuk bantu mudah para juang ppdb online bukan begitu bang mpok min
Positif,2021,portal ppdb online sulit akses catat nomor posko adu di jumlah wilayah daerah khusus ibukota jakarta dan dan
Positif,2021,anies langsung gelar rapat dengan dirut telekomunikasi untuk atas masalah akses di ppdb jakarta
Positif,2021,posko ppdb psi di jakarta selatan bagi masyarakat yang butuh bantu dalam proses daftar silah hubung kontak tera atau datang kah posko pada alamat yang tera pada postingan dan nsalam solidaritas dan dan
Positif,2021,wah selamat iya tipsnya guna buat daftar moga bisa istirahat buat yang lain moga manfaat yaa
Positif,2021,terima serta didik baru ppdb tahun ajar di daerah khusus ibukota jakarta telah mulai senin dan npemprov daerah khusus ibukota jakarta komitmen wujud tara sempat didik bagi warga jakarta dari seluruh latar belakang tuk dapat didik dan nsumber
Positif,2021,kasih untuk para staff dan urus ppdb daerah khusus ibukota jakarta akhir sekian lama bisa daftar japres moga hal ini tidak jadi di tahun yang akan datang dan bisa jadi ajar supaya sistem didik di indonesia bisa maju yang milik sdm unggul
Positif,2021,dapat tips kata kode keamananny tidak perlu ganti jadi pencet lanjut saja terus tadi saya juga begitu dan skarang sudah daftar tinggal pantengin tendang atau tidak moga tipsnya guna kalau tidak yah tetap semangat tidur tenang
Positif,2021,halo warga jakarta timur nberikut adalah nomor playanan untuk ppdb sila tanya iya nik anak nya kepada tugas kami dan untuk tahu warga jakarta timur bagai sarana untuk dapat informasi nahi segala layan dokumen duduk agar mudah cepat dan gratis
Positif,2021,penting bagi para orangtua yang anak akan daftar ppdb di daerah khusus ibukota jakarta dan njika manfaat mohon dishare komen like dan subscribe iya
Positif,2021,ombudsman jakarta nilai banyak baik yang laku perintah provinsi daerah khusus ibukota kait laksana ppdb tahun baik ini baik dari aspek regulasi maupun substansi atur
Positif,2021,ombudsman nilai ada baik kait ppdb di jakarta dari aspek regulasi maupun substansi atur
Positif,2021,ombudsman apresiasi baik ppdb daerah khusus ibukota jakarta
Positif,2021,ayo dukung ppdb jakarta cara daring dengan tetap selenggara ppdb tuju untuk wujud tara sempat bagi semua warga dari seluruh latar belakang dengan begitu warga bisa oleh didik kualitas di daerah khusus ibukota jakarta
Positif,2021,ombudsman ri wakil jakarta raya apresiasi dinas didik daerah khusus ibukota jakarta yang telah laku sosialisasi laksana terima serta didik baru ppdb tahun
