sentimen,tahun,teksbersih
Negatif,2018,jakarta terap sistem zonasi sekolah untuk terima serta didik baru ppdb masih buntut masalah di bagai daerah jumlah orangtua yang daftar anak anak kah
Negatif,2018,baru sampai di jakarta yang dipikirin ingin demo soal ppdb yang pakai sistem zona dan tidak ada hubung sama svt coba
Negatif,2018,jalur afirmasi di jakarta bukti dengan rekening bank bahwa calon siswa terima kjp bawa sktm dan saing nilai lagi antar terima kjp yang ndaftar yang singkir bisa kah sekolah swasta yang masih terima siswa baru telah umum ppdb
Negatif,2018,umum bangku kosong tahap umum jalur domisili daerah khusus ibukota jakarta tingkat sama tidak bisa akses di ppdb online min nklau dari jadwal akan tanggal juli pukul wib tapi cari web ppdb tidak ada
Negatif,2018,ppdb akan laku di banyak provinsi kenapa hanya jateng yang ulas jalur afirmasi kjp di jakarta juga ada di tahap tapi batas maksimal orang per sekolah apa ini juga salah prosedur
Negatif,2018,sama di ppdb online di jakarta juga begitu mas yang terima di jalur afirmasi untuk terima kjp nilai kecil banget pada masuk sama favorit nem bawah masuk smtr anak lewat untuk jurus dan sama yang sama
Negatif,2018,ibu ibu protes kait rumit proses ppdb daerah khusus ibukota jakarta mereka tanya sosialisasi daftar yang tidak jelas
Negatif,2018,ibu ibu protes kait rumit proses ppdb daerah khusus ibukota jakarta mereka tanya sosialisasi daftar yang tidak jelas
Negatif,2018,beberapa ibu ibu protes kait rumit proses ppdb daerah khusus ibukota jakarta wali murid protes sosialisasi daftar yang tidak jelas begini keluh dan dan
Negatif,2018,juang nilai anak kami yang benar saja kami sudah sulit tambah zonasi yang buka untuk wilayah jatinegara yang nyata jakarta timur mana letak adil buat putra putri kami mohon pak ppdb online lokal telah tutup tapi kami masih harap
Negatif,2018,itu tadi alam ppdb daerah khusus ibukota iya konon daerah lain lebih sehat praktek antara lain ukur jarak dari alamat sesuai kakak kah sekolah sementara timbang daerah khusus ibukota hanya angka dan usia perlu sekali ajar kah praktek ppdb di luar jakarta
Negatif,2018,bagaimana ini niali un kali revisi ppdb online disii oleh jakarta timur betul zona lokal jakarta selatan apakah liput jakarta timur juga
Negatif,2018,di smk jakarta yang daftar di ppdb online beberapa jurus cantum syarat tinggi badan salah satu contoh untuk jurus bisnis daring dan pasar sayang saja jika kita ada sempat untuk masuk di jurus itu tapi kendala oleh tinggi badan
Negatif,2018,pak mohon evaluasi tentang sistem ppdb smp dan daerah khusus ibukota kita bagai warga daerah khusus ibukota yang sekolah di daerah khusus ibukota khusus jakarta selatan rasa tidak fair lihat kondisi daftar yang sekolah dari luar daerah khusus ibukota bisa ikut seleksi lihat kondisi hasil usbn daerah khusus ibukota cara seluruh nilai
Negatif,2018,pak mohon evaluasi tentang sistem ppdb smp dan daerah khusus ibukota kita bagai warga daerah khusus ibukota yang sekolah di daerah khusus ibukota khusus jakarta selatan rasa tidak fair lihat kondisi daftar yang sekolah dari luar daerah khusus ibukota bisa ikut seleksi lihat kondisi hasil usbn daerah khusus ibukota cara seluruh nilai
Negatif,2018,pak mohon evaluasi tentang sistem ppdb smp dan daerah khusus ibukota kita bagai warga daerah khusus ibukota yang sekolah di daerah khusus ibukota khusus jakarta selatan rasa tidak fair lihat kondisi daftar yang sekolah dari luar daerah khusus ibukota bisa ikut seleksi lihat kondisi hasil usbn daerah khusus ibukota cara seluruh nilai
Negatif,2018,daftar ppdb bikin bingung ini kata kepala sekolah sman jakarta
Negatif,2018,jika jarak jadi komponen yang hitung dalam ppdb daerah khusus ibukota tentu siswa luar daerah khusus ibukota tidak bondong daftar kah sama fav yang letak di tengah kota jakarta lama ini hanya nilai tinggi yang jadi tentu walau rumah mereka di papua sekalipun
Negatif,2018,turut saya jalur luar kota pada ppdb daerah khusus ibukota juga kurang tepat mungkin untuk sekolah yang batas bisa lah luar kota itu tembus batas zonasi banget sementara anak jakarta batas zonasi kasi lah anak jakartanya
Negatif,2018,walau sejak tahun lalu sudah ada permendikbud yang atur zonasi minimal namun ppdb jakarta tahun ini masih belum terap itu lokal hanya dan nilai un tetap utama
Netral,2018,come and join us at dan nppdb smk telekomunikasi jakarta dan dan dan nsmk telekomunikasi jakarta nsekolah yang keren dan nkami terap budaya redi ccp character content process bas r olah raga
Netral,2018,come and join us dan nppdb smk telekomunikasi jakarta dan nsmk telekomunikasi jakarta nsekolah yang keren dan nkami terap budaya redi ccp character content process bas r olah raga
Netral,2018,promosi ppdb tiada henti dan nsilaturahmi dan promosi kah mts dan smpn sambut hangat oleh bapak kepala sekolah bapak waka dan siswa siswi smp dan mts dengan sangat antusias dan nsmk telekomunikasi jakarta nsekolah yang
Netral,2018,tidak ngobrol tidak apa balik lulus now what saya kah jakarta dan stay sana untuk waktu yang agak lama karena tdnya saya mau sama di jakarta tapi gajadi wkwkwk eh pas saya balik dari jakarta haris hubung lagi bagaimana kabar saya kembang ppdb saya bagaimana
Netral,2018,daftar ppdb tahun ajar masih buka gelombang dan nayo segera daftar dan ikut jalur mau jadi hafizh qur an sd muhammadiyah jakarta tempat dan ninformasi lebih lanjut kena
Netral,2018,passing grade hasil ppdb smk daerah khusus ibukota jakarta tahun
Netral,2018,informasi ppdb dapat hubung telepon hunting extension tidak sd smp sama smk dan smk
Netral,2018,ppdb sdn daerah khusus ibukota jakarta tidak perlu serta kia
Netral,2018,ppdb sdn daerah khusus ibukota jakarta tidak perlu serta kia
Netral,2018,ppdb sd daerah khusus ibukota jakarta tidak pakai kartu identitas anak lalu
Netral,2018,nselamat sore admin nsaya ingin tanya napakah publik dapat unduh database arsip ppdb daerah khusus ibukota jakarta
Netral,2018,team ppdb persentasi di smpn dan nantusias yang tinggi dari siswa siswi smpn dan nsmk telekomunikasi jakarta nsekolah yang keren dan nkami terap budaya redi ccp character content process bas r
Netral,2018,team ppdb persentasi di smpn dan nantusias yang tinggi dari siswa siswi smpn dan nsmk telekomunikasi jakarta nsekolah yang keren dan nkami terap budaya redi ccp character content
Netral,2018,kepala dinas didik dan budaya tangsel bantah pihak korupsi kait ppdb dan simpetas lewat
Netral,2018,kepala dinas didik dan budaya tangsel bantah pihak korupsi kait ppdb dan simpetas lewat
Netral,2018,passing grade hasil ppdb smk daerah khusus ibukota jakarta tahun ke blog
Netral,2018,online jakarta mati calon siswa smp sama
Netral,2018,passing grade hasil ppdb sama daerah khusus ibukota jakarta tahun ke blog
Netral,2018,meeting staff gama school rencana buka ppdb siswa baru jalan alur laut rawabadak koja jakarta utara daerah khusus ibukota jakarta indonesia
Netral,2018,presentasi kah mts asy syukriyyah oleh tim ppdb smk telekomunikasi jakarta dan dan nsekolah yang keren dan nkami terap budaya redi ccp character content process bas r olah raga olah rasa olah rasio
Netral,2018,presentasi kah mts asy syukriyyah oleh tim ppdb smk telekomunikasi jakarta dan dan nsekolah yang keren dan nkami terap budaya redi ccp character content process bas r olah raga
Netral,2018,ppdb ta smk sint joseph jakarta dan dan dan
Netral,2018,uji saring masuk ppdb nsmk telekomunikasi jakarta tahap dan ndalam rangka jaga kualitas tahap uji liput tes akademis psikotes dan wawancara dan dan nsekolah yang keren dan nkami
Netral,2018,passing grade hasil ppdb smp daerah khusus ibukota jakarta tahun ke blog
Netral,2018,saya tambah video kah playlist motion graphic ppdb daerah khusus ibukota karya smk dan jakarta multimedia
Netral,2018,kabid smp disdikbud tangsel sebut kendala daftar ppdb tribun jakarta
Netral,2018,daftar gelombang telah buka mari gabung sama kami
Netral,2018,informasi ppdb sds regina pacis jakarta dan
Netral,2018,ppdb smk telekomunikasi jakarta dan npenerimaan serta didik baru nta telah buka dan ninfo lanjut dan smk telekomunikasi school jakarta
Netral,2018,ombudsman wakil jakarta raya temu bagai duga langgar dan maladministrasi dalam terima serta didik baru ppdb online di bogor depok dan bekas dan dan
Netral,2018,informasi daftar ppdb smk telekomunikasi jakarta ta dan nuntuk terang lebih lanjut silah hubung tugas ppdb kami di nomor atau nomor dan nprosedur
Positif,2018,puji tuhan dan nsi bontot tulis di wag keluarga dan dan guise dan sosyel all the way dan nhasil umum ppdb sama st ursula jakarta dan nanak sos is coming from the hartantos dan nadikmu alamat twtitter e opo sih
Positif,2018,radar bogor sleman apresiasi ppdb dengan sistem zonasi jakarta radar bogor meski sempat men
Positif,2018,semua layan denga baik di posko ppdb online daerah khusus ibukota jakarta nmimin pantau proses layan di posko
Positif,2018,admin pantau kunjung gubernur daerah khusus ibukota jakarta di posko ppdb online daerah khusus ibukota jakarta alhamdulillah ppdb daerah khusus ibukota jakarta tahun ini jalan lancar aman kendali dan
Positif,2018,ppdb online smpn kota bekas aktif update nya dong nterakhir jul wib nsampe sekarang belum update lagi njakarta bisa loh update tiap menit
Positif,2018,ppdb smp online kabupaten bekas seperti belum siap dan paksa tidak seperti tetangga kota bekas dan jakarta yang lancar informatif dan update selalu dengan
Positif,2018,iya untuk webnya sangat minim informasi jauh sekali ketika saya banding dengan web maupun
Positif,2018,ada kartu jakarta pintar kok turut aku kamu ngotot saja daftar ppdb sama online kalau sudah terima aku yakin kok gamungkin papa mama kamu ngalangin kamu buat sekolah dan kalau kamu benar ngotot kamu juga bisa kerja jual kue di sekolah bantu kantin atau kerja partime jadi waiter
Positif,2018,alhamdulillah ppdb sama negeri tahap pertama selesai dan yartika terima di sama negeri jakarta
Positif,2018,sore ini jam ppdb jakarta tahap jalur lokal sman sudah tutup dan nyata kandidat sudah di terima nkeren proses seleksi
Positif,2018,ppdb atau terima serta didik baru cara online adalah salah satu prestasi riil pak saat beliau masih jadi gubernur daerah khusus ibukota jakarta laksana ppdb online bagus tanpa pungli sayang ppdb online gratis belum laksana di seluruh daerah seperti di daerah khusus ibukota
Positif,2018,enak banget kamu ppdb jakarta apakabar saya sama negeri sini bisa diitung jari
Positif,2018,biasa karena overload servernya dan tenggang waktu akan panjang jakarta juga dahulu begitu tapi tahun ini seperti sudah bagus untuk ppdb
Positif,2018,dari jelas ini perintah daerah jakarta komitmen tiap anak dapat imunisasi tapi perintah daerah juga tidak mau anak gagal sekolah karena belum imunisasi dan noleh karena itu ppdb jadi macam screening riwayat calon murid dan njalan tengah yang baik
Negatif,2019,pak presiden baik umur hidup kenapa iya kok ppdb daerah khusus ibukota jakarta lain dengan seluruh provinsi lain se indonesia tidak pakai sistem zonasi pak kasihan akan yang tidak bisa sekolah dinegri karena tidak bisa dapat bijak dari pak jokowi yaitu sekolah gratis
Negatif,2019,kenapa iya kok ppdb daerah khusus ibukota jakarta lain dengan seluruh provinsi lain se indonesia tidak pakai sistem zonasi kasihan akan yang tidak bisa sekolah dinegri karena tidak bisa dapat bijak dari pak jokowi yaitus sekolah gratis
Negatif,2019,kok sama iya rekapin hasil ppdb jakarta sejak bocah kelas hahaha
Negatif,2019,ombudsman sesal daerah khusus ibukota jakarta tidak terap ppdb zonasi ada apa
Negatif,2019,ombudsman sesal daerah khusus ibukota jakarta tidak terap ppdb zonasi ada apa
Negatif,2019,ombudsman sesal daerah khusus ibukota jakarta tidak terap ppdb zonasi ada apa
Negatif,2019,anak yang ikut ppdb di sekolah negeri emak emaknya yang dag dig dug pantau gera hasil seleksi kayak gera harga saham di jakarta seleksi akhir tetap dasar nilai un beda dengan beberapa daerah yang utama jarak rumah
Negatif,2019,selain banyak celah zonasi asli tetapi palsu versi ppdb online pindah orang tua wali yang juga harus cermat misal kakak lama jakarta tapi sekolah asal semarang sudah jelas ini tidak masuk akal karena sudah tahun dia disemarang kecuali jika memang sekolah asal dari smp di jakarta
Negatif,2019,dear admin hari ini akan jadwal ppdb smp non zonasi tapi kenapa saya tidak bisa daftar anak saya iya ada error warning jalur ini untuk bagi cpd domisili dalam propinsi daerah khusus ibukota jakarta yang harus bisa juga untuk domisili luar daerah khusus ibukota akan mohon bantu
Negatif,2019,dewan wakil rakyat kritisi praktik manipulasi domisili demi zonasi ppdb jakarta edunews id laksana terima serta didik baru ppdb lalu mekanisme zonasi besar buka ruang praktik manipulasi domisili laksana ppdb harus awas dan evaluasi
Negatif,2019,timbul polemik sistem zonasi ppdb belum mampu redam kerisuhan teliti center for indonesian policy studies meski perintah hapus stigma sekolah favorit dan sekolah non favorit jakarta mediamerdeka co perintah perlu evaluasi
Negatif,2019,tahun ini banyak yang tidak suka sama sistem ppdb yang prioritas zonasi awal aku juga begitu ngerasa tidak adil karena aku sendiri kartu keluarga jakarta dan belum pindah kakak
Negatif,2019,ombudsman nilai perintah provinsi daerah khusus ibukota jakarta laku maladministrasi kait ppdb
Negatif,2019,tadi kah posko ppdb jakarta timur juga banyak terima kjp yang tidak bisa daftar zonasi afirmasi info data dari dukcapil sistem zonasi belum sinkron tolong admin jelas nya
Negatif,2019,dalam tunjuk teknis ppdb jakarta tahu jakarta tidak utama sistem zonasi bagaimana yang atur dalam permendikbud sebut mengapa
Negatif,2019,ombudsman daerah khusus ibukota jakarta laku maladministrasi di ppdb
Negatif,2019,posko ppdb jakarta selatan yang pusat di sman kebayoran ramai kunjung para orang tua murid orang tua murid keluh beda data seperti nik dan juga verifikasi data yang nanti guna untuk tahap pertama daftar ppdb online jalur zonasi
Negatif,2019,nilai bohong kadisdik daerah khusus ibukota ppdb sistem zonasi di jakarta paling adil
Negatif,2019,oohhh hari ini itu hari akhir daftar ppdb sama di jakarta goodluck iya kalian yang lagi proses daftar sekolah dan nbtw siapa yang seko kampus prestasi ranking menang lomba ipk nya mungkin huahaha dan dan ingin tahu dooong
Negatif,2019,oohhh hari ini itu hari akhir daftar ppdb sama di jakarta goodluck iya kalian yang lagi proses daftar sekolah dan nbtw siapa yang seko kampus prestasi ranking menang lomba ipk nya mungkin huahaha dan dan ingin tahu dooong
Negatif,2019,oohhh hari ini itu hari akhir daftar ppdb sama di jakarta goodluck iya kalian yang lagi proses daftar sekolah dan nbtw siapa yang seko kampus prestasi ranking menang lomba ipk nya mungkin huahaha dan dan ingin tahu dooong
Negatif,2019,oohhh hari ini itu hari akhir daftar ppdb sama di jakarta goodluck iya kalian yang lagi proses daftar sekolah dan nbtw siapa yang seko kampus prestasi ranking menang lomba ipk nya mungkin huahaha dan dan ingin tahu dooong
Negatif,2019,oohhh hari ini itu hari akhir daftar ppdb sama di jakarta goodluck iya kalian yang lagi proses daftar sekolah dan nbtw siapa yang seko kampus prestasi ranking menang lomba ipk nya mungkin huahaha dan dan ingin tahu dooong
Negatif,2019,oohhh hari ini itu hari akhir daftar ppdb sama di jakarta goodluck iya kalian yang lagi proses daftar sekolah dan nbtw siapa yang seko kampus prestasi ranking menang lomba ipk nya mungkin huahaha dan dan ingin tahu dooong
Negatif,2019,jarak yang pisah kita fergusooooo nkalo nikah harus sesuai zonasi nkamu masuk di zona lurah nmana di cimahi cimtizen dan dan
Negatif,2019,bicara soal ppdb hubung saya masih baru juga jadi jujur saja sih kurang erti bagaimana sistem ini dan ntapi sih sistem daerah khusus ibukota ini sedikit beda dengan sistem di daerah kalau di daerah benar zonasi tanpa peduli nem kalau jakarta masih main nem
Negatif,2019,bagaimana merengking di ppdb online daerah khusus ibukota jakarta kok seperti tidak penuh atur dan nketerangan gambar dan nnilai inisial siswa m dan nnilai inisial siswa a dan nseleksi tayang di online dan dan dan inisial m tayang di
Negatif,2019,pindah domisili agar lolos sistem zonasi ppdb di jakarta pasti sia sia
Negatif,2019,frustrasi sama ppdb jakarta
Negatif,2019,mohon pantau laksana ppdb di daerah khusus ibukota jakarta yang masih titik rat nilai un yang saya tahu langsung di sman saya kira hal ini rata jadi daerah khusus ibukota padahal sistem zonasi akan beri adil dan perata kwalitas didik
Negatif,2019,tau ini iya pas daftar adik sekolah zonasi di jakarta itu nem nya tetap laku tapi sekolah itu dipilihin sama orang ppdb nya misal rumah kamu di camat gambir iya paling sekolah bisa di daerah situ juga tidak bisa kah camat cawang gituu saing tetap pakai nem
Negatif,2019,pak ppdb daerah khusus ibukota jakarta saat ini sedang sangat kacau pak saya mau sekolah
Negatif,2019,to admin maaf mau tanya kena sistem zonasi khusus seleksi masuk ppdb sman jakarta barat itu dasar jarak dari rumah kah selo tuju dekat atau tetap grading seperti tahun belum by nilai tinggi soal saya rasa bagai orang tua murid sistem zonasi ttpby nilai
Negatif,2019,ppdb jalur zonasi sama jakarta warna keluh soal waktu layan
Negatif,2019,saya ingat betul saat ppdb online si sulung tahun di jakarta timur lancar sekali saat daftar ada jalur umum dan jalur camat selain prestasi antri sesuai nomor masuk input nilai verifikasi tinggal tunggu real time anak masuk mana kok sekarang jadi horror iya
Negatif,2019,orang tua keluh lama proses ppdb sistem zonasi di jakarta
Negatif,2019,case nanak istri sudah tinggal di semarang nanak sudah sekolah di sd semarang dan ncuma kakak masih ikut saya di jakarta dan nsama sekali tidak ada sempat daftar ppdb dan nmasih lebih baik di ikan sempat daftar tapi kalah sisih nilai itu lebih fair
Negatif,2019,pak notice besok ppdb jakarta buka dan saya mau zonasi sudah hapus kalau perlu ppdb ulang nilai saya bagus dan mati mati ajar dan keluarin banyak uang kalau hasil bodoh lebih baik saya tidak perlu sekolah pak biar didik indonesia makin bobrok
Negatif,2019,tiap tahun ganti model ppdb saya bingung dengan orang pandai yang ada di jakarta mengapa selalu dunia didik jadi uji coba sistem nayo kembali kah bimbing ki pukul dewantoro
Negatif,2019,orangtua murid nilai sistem zonasi ppdb tidak adil lewat
Netral,2019,antar prakerin jakarta dan sekitar dan nppdb telah buka dan npendfataran dan
Netral,2019,nm a nsmp muhammadiyah jakarta njl tebet timur ii nomor tebet jakarta selatan jakarta selatan dan ninformasi terima serta didik baru ppdb tahun ajar nsmp muh dan
Netral,2019,besok juni ppdb madrasah daerah khusus ibukota jakarta umum
Netral,2019,kamu punya prestasi simak cara daftar ppdb daerah khusus ibukota jakarta jalur prestasi
Netral,2019,kamu punya prestasi simak cara daftar ppdb daerah khusus ibukota jakarta jalur prestasi
Netral,2019,ini syarat lengkap ppdb online jenjang smp dan sama di daerah khusus ibukota jakarta
Netral,2019,besok juni ppdb madrasah daerah khusus ibukota jakarta umum
Netral,2019,nm a nsmp muhammadiyah jakarta njl tebet timur ii nomor tebet jakarta selatan jakarta selatan dan ninformasi terima serta didik baru ppdb tahun ajar dan nsmp muh
Netral,2019,daftar ppdb online sd provinsi daerah khusus ibukota jakarta
Netral,2019,simak tentu dan jadwal jalur zonasi ppdb sama daerah khusus ibukota jakarta
Netral,2019,hasil ppdb madrasah man daerah khusus ibukota jakarta umum cek di sini
Netral,2019,ppdb smk santa theresia jakarta dan
Netral,2019,passing grade hasil ppdb smp daerah khusus ibukota jakarta tahun
Netral,2019,sama dengan jurus bahasa di ppdb daerah khusus ibukota jakarta lalu
Netral,2019,kamu punya prestasi simak cara daftar ppdb daerah khusus ibukota jakarta jalur prestasi
Netral,2019,hasil ppdb madrasah man daerah khusus ibukota jakarta umum cek di sini
Netral,2019,besok juni ppdb madrasah daerah khusus ibukota jakarta umum
Netral,2019,ini syarat lengkap ppdb online jenjang smp dan sama di daerah khusus ibukota jakarta
Netral,2019,informasi dari traffic management center tmc polisi daerah metropolitan jaya pagi ini tidak catat telah lapor aksi antara lain aliansi parlemen jalan srmi lmnd fnpbi ppdb spartan seniman jakarta papernas dan iisip dan lain dan ndah tua mau disuapin saja ini
Netral,2019,ini syarat lengkap ppdb online jenjang smp dan sama di daerah khusus ibukota jakarta
Netral,2019,sudah dibilangin pada pindah saja kah jakarta apalagi mbak rinrin itu daripada riweuh melulu sama ppdb
Netral,2019,passing grade hasil ppdb sama daerah khusus ibukota jakarta tahun ke blog
Netral,2019,mari gabung sama generasi generasi qur ani
Netral,2019,bapak ibu dan teman teman sekolah charitas jakarta sudah di buka ppdb tahun ajar ayo segera daftar jangan sampai tinggal dan ninformasi sekolah nemail yayasan
Netral,2019,ppdb smk santa theresia jakarta tahun ajar
Netral,2019,jakarta kamis dan nkpai selenggara rapat koordinasi hasil awas terima serta didik baru ppdb tahun dan dan
Netral,2019,rencana umum ppdb sama dan smp daerah khusus ibukota jakarta hari ini pukul
Netral,2019,ppdb tahun ajar nsma katolik sang timur jakarta dan dan dan dan
Netral,2019,ppdb sd santa theresia jakarta dan
Netral,2019,ppdb kb tidak santa theresia jakarta dan
Netral,2019,bincang publik sama ombudsman ri wakil jakarta raya tentang sengkarut selenggara ppdb dan ninteraktif dan dan nb fm streaming
Netral,2019,muhadjir effendy sebut sekolah di daerah khusus ibukota jakarta penuh syarat terap terima serta didik baru ppdb bas zonasi cara penuh
Netral,2019,mendikbud jakarta penuh syarat terap ppdb zonasi penuh mendikbud muhadjir e
Netral,2019,mendikbud jakarta penuh syarat terap ppdb zonasi penuh mendikbud muhadjir e
Netral,2019,mendikbud jakarta penuh syarat terap ppdb zonasi penuh mendikbud muhadjir e
Netral,2019,mendikbud jakarta penuh syarat terap ppdb zonasi penuh mendikbud muhadjir e
Netral,2019,mendikbud jakarta penuh syarat terap ppdb zonasi penuh mendikbud muhadjir e
Netral,2019,mendikbud jakarta penuh syarat terap ppdb zonasi penuh mendikbud muhadjir e
Netral,2019,smk jakarta pusat ppdb nyimas
Netral,2019,umum hasil ppdb madrasah man daerah khusus ibukota jakarta laku hari ini
Positif,2019,sama banyakin sekolah mbak sekolah negeri banyak dan rata hanya di jakarta jawa barat untuk sama kurang sekali bisa di cek di ppdb online jawa barat tahun lalu aku pernah cek jadi bukan tidak mau sekolah kah negeri bahkan di depok lebih gampang cari mall banding sman
Positif,2019,ppdb daerah khusus ibukota jakarta tahun sudah akhir selamat bagi yang terima di sekolah negeri bagi yang belum terima jangan putus asa ini bukan akhir dari segala nseperti biasa admin akan hibernasi sampai jelang ppdb tahun depan sekali lagi selamat dan semangat
Positif,2019,alas tulis status tidak perlu pajang foto presiden karena kagum ppdb daerah khusus ibukota lewat
Positif,2019,tuju dan nkemarin sudah coba untuk advokasi bijak ppdb alhamdulillah untuk jakarta tidak ada kasus rupa daerah lain kemudian mulai coba diskusi sama buat baik paud dan nterkait konstruksi benar kalau disdik belum paham betul tentang konstruksi dan desain yang ramah anak
Positif,2019,moga bisa evaluasi tahun depan atur ppdb misal jadi jakarta bagai contoh beberapa tahun kalau sukses baru terap di daerah lain kalau tidak ada evaluasi mohon copot saja mendikbudnya
Positif,2019,yang pasti di jakarta yang pimpin pak terima siswa baru alias ppdb tidak ribet tidak pakai antri dari jam pagi syarat daftar sekolah pakai nilai un bukan pakai meter kami para wali murid ucap terima kasih pak anies
Positif,2019,sistem ppdb daerah khusus ibukota jakarta sudah cukup bijaksana dan cukup akomodatif dalam salur aspirasi warga untuk dapat didik yang adil layak dan perhati imbang lingkung kota dan duduk
Positif,2019,ppdb daerah khusus ibukota jakarta bisa jadi model
Positif,2019,dibantuin sama admin dengan fast respon masa hari akhir ppdb jakarta non daerah khusus ibukota arti banget jasa informasi masa genting ppdb begini aku bagai ibu yang h c jadi sangat bantu didoain berkah murah rezeki kalau belum ketemu jodoh temu yang baik terima kasihbanyak min
Positif,2019,khawatir yang sempat bayang para orangtua siswa kena zonasi pun sirna dengan tidak banyak keluh yang muncul telah proses ppdb akhir dan nbenarkan sistem zonasi sekolah negeri jakarta sudah cukup adil
Positif,2019,ppdb tingkat smp dan sama di daerah khusus ibukota jakarta lalu jalur non zonasi buka hari ini selasa hingga kamis besok turut warganet apa yang harus baik
Positif,2019,ppdb tingkat smp dan sama di daerah khusus ibukota jakarta lalu jalur non zonasi buka hari ini selasa hingga kamis besok turut warganet apa yang harus baik
Positif,2019,langsung lancar ppdb jakarta yang gagas anies bisa jadi rujuk swamedium
Positif,2019,langsung lancar ppdb jakarta yang gagas anies bisa jadi rujuk swamedium
Positif,2019,opini saya sejak tahun lalu hingga kini ppdb jakarta cukup fair dan transparan
Positif,2019,langsung lancar fahira idris ppdb jakarta bisa jadi rujuk kota lain
Positif,2019,langsung lancar ppdb jakarta bisa jadi rujuk kota lain dan
Positif,2019,lancar ppdb jakarta bisa jadi rujuk kota lain
Positif,2019,langsung lancar ppdb jakarta bisa jadi rujuk kota lain
Positif,2019,langsung lancar ppdb jakarta bisa jadi rujuk kota lain
Positif,2019,ppdb jakarta nilai bisa jadi rujuk baca
Positif,2019,kepala dinas didik kadisdik daerah khusus ibukota jakarta ratiyono nilai terap sistem zonasi sekolah pada terima serta didik baru ppdb di jakarta sudah cukup adil
Positif,2019,contoh soal unbk simulasi tes ppdb cbt mtsn jakarta
Positif,2019,kadisdik daerah khusus ibukota klaim terap zonasi ppdb di jakarta sangat adil
Positif,2019,kadisdik daerah khusus ibukota klaim terap zonasi ppdb di jakarta sangat adil
Positif,2019,kadisdik daerah khusus ibukota jakarta nilai terap sistem zonasi sekolah pada ppdb di jakarta sudah cukup adi
Positif,2019,kepala dinas didik kadisdik daerah khusus ibukota jakarta ratiyono nilai terap sistem zonasi sekolah pada terima serta didik baru ppdb di jakarta sudah cukup adil
