sentimen,tahun,teksbersih
Positif,2019,langsung lancar ppdb jakarta yang gagas anies bisa jadi rujuk
Positif,2019,sman di kabupaten tangerang harus sperti sman di jakarta sistem ppdb tetap zonasi tetapi tetap harus timbang nilai un untuk peringkat terima itu baru perata nama dan dan
Positif,2019,meski ular antre ppdb di sama jakarta kondusif
Positif,2019,dukung terap sistem zonasi ppdb wali murid peluang terima di sekolah unggul lebih besar lewat
Positif,2019,heboh ppdb online tapi jakarta masih anteng saja untung dari tahun sudah online meski tiap tahun ada ubah tapi makin baik seperti daerah lain harus buat jalur ppdb juga ini umum zonasi tapi nem tetap jadi patok
Positif,2019,kenapa jawa barat tidak seperti jakarta ppdb masih harga nilai un simpel dan jelas umum terima juga cuma hari sejak akhir daftar
Positif,2019,ppdb jawa barat jalur zonasi umum nya lama juga minggu daftar akhir juni umum juni sedang ppdb jakarta jalur zonasi umum langsung pas hari akhir daftar rentang waktu nya jam
Positif,2019,kalau sudah tidak terima jakarta buka ppdb mulai senin ko tahun lalu jakarta gamake point jarak kola dan aku salah satu yang terima sekolah di jakarta pakai jalur luar daerah
Positif,2019,tuju min kami dukung admin agar tetap seleksi pakai nilai un jangan dengar yang panas gara gara nemnya kecil wkwkw bagus job ppdb jakarta
Positif,2019,laksana terima serta didik baru ppdb tahun di daerah khusus ibukota jakarta jalan kondusif dan nmenurut fsgi kemendikbud perlu contoh perintah provinsi daerah khusus ibukota jakarta dalam terap sistem zonasi dalam ppdb dan nbagaimana alam teman teman yang urus tahun ini
Positif,2019,ooh yang jakarta masih kayak begitu iya bagus deh saya lihat klasmen ppdb jawa barat lucu saja dirankingin dasar jarak tapi ada juga sih yang pakai nilai cuma slot kursi dikit
Positif,2019,ppdb daerah khusus ibukota jakarta kuota besar tetap guna hasil un bagai metoda seleksi tangerang harus acu kah daerah khusus ibukota jakarta jangan bahkan ikut sistem serang lebak pandeglang yang memang hasil un masih bawah rata nasional
Positif,2019,ppdb daerah khusus ibukota jakarta lama ini anggap baik bisa contoh
Positif,2019,warga apresiasi laksana ppdb online jalur inklusi di jakarta dan
Positif,2019,warga lurah rawa badak selatan koja jakarta utara apresiasi jalur inklusi terima serta didik baru ppdb online bagi calon ajar tingkat sd hingga sama atau smk
Negatif,2020,maaf bos sudah dbl founder tidak ada uang surabaya tidak merdeka bos hahay sukarno lahir sini njakarta itu kota apa lahir umur si ppdb saja pakai umur niat sekolah tidak wkwkw
Negatif,2020,kadisdik daerah khusus ibukota jakarta ini buat blunder dan ramai saja nkemarin blunder soal ppdb sekarang soal uji nsuka banget iya buat blunder dan ndia sudah tidak bisa tidur nyenyak ini sudah viral begini dan nperlu telusur apa maksud dari soal uji sebut
Negatif,2020,fix nder kamu kalau ikut ppdb jakarta tahun ini pental melulu
Negatif,2020,ikan sempat yang sudah sepuh nad
Negatif,2020,ini akibat kalau tidak benar kerja yang patung di masker in lah yang atap rumah warga fly over tapal kuda di cat atau ganjil genap motor laku ppdb jakarta guna umur bagai acu
Negatif,2020,gubernur anies baswedan dan disdik daerah khusus ibukota jakarta gugat kah ptun daerah khusus ibukota soal ppdb ppdb daerah khusus ibukota dengan seleksi usia sebut langgar atur kemendikbud
Negatif,2020,para orang tua murid masuk gugat kepada perintah provinsi daerah khusus ibukota jakarta kah ptun jakarta karena terap syarat yang diskriminatif dalam ppdb online sehingga rugi langsung didik mutu bagi siswa murid joi dan
Negatif,2020,sosialisasi yang buruk
Negatif,2020,sosialisasi yang buruk
Negatif,2020,sosialisasi yang buruk
Negatif,2020,sosialisasi yang buruk
Negatif,2020,sosialisasi yang buruk
Negatif,2020,sosialisasi yang buruk
Negatif,2020,sosialisasi yang buruk
Negatif,2020,sosialisasi yang buruk
Negatif,2020,sosialisasi yang buruk
Negatif,2020,sosialisasi yang buruk
Negatif,2020,sosialisasi yang buruk
Negatif,2020,ppdb jakarta kemarin amburadul akan bahkan orang tua sampai demo masak daftarin sekolah yang pertama jadi timbang adalah umur dan nbukannya bahkan tidak koreksi diri bahkan ngomingin nadiem
Negatif,2020,anis hanya pandai retorika tapi minim kerja banyak bijak iya rugi rakyat jakarta yang nyata penyelengara ppdb online yang amburadul bahkan akan jadi macet akibat terap zonasi yang fake dan klubada polemik akibat bijak dia anis kabur entah mana
Negatif,2020,ada orang tua murid yang adu proses administrasi ppdb online daerah khusus ibukota jakarta
Negatif,2020,itu fakta makanya ppdb jakarta anarkis bahkan hampir batal
Negatif,2020,anak kemarin sore wkwkakak mengapa jadi lomba tua an sudah asa ppdb jakarta
Negatif,2020,sudah sudah itu bukan reklamasi tapi sebut anies itu luas dan nmassa dari bagai elemen unjuk rasa di depan balai kota jakarta mereka protes soal reklamasi ancol hingga ppdb daerah khusus ibukota dan dan
Negatif,2020,tidak nonton berita kalau ppdb di daerah khusus ibukota jakarta masalah iya
Negatif,2020,ada demo lagi iya nis kait ppdb daerah khusus ibukota jakarta bagaimana itu solusi nis jangan dokem baik anda
Negatif,2020,sadar atau tidak laksana terima serta didik baru ppdb tinggal soal baru di jakarta dan nsaya terima lapor ada ratus siswa yang hingga saat ini belum daftar di sekolah mana pun dan ancam putus sekolah
Negatif,2020,ajar raih ratus harga aristawidya maheswari oleh tawar lanjut didik sama di jumlah sekolah swasta di jakarta usai gagal lolos seleksi negeri kok bisa dan dan
Negatif,2020,kritik anies soal ppdb dan reklamasi presidium barometer jakarta gelar aksi demonstrasi
Negatif,2020,maksud jelas benar sangat kang kemarin ppdb jakarta jatah khusus anak nakes yang tangan covid cuma kasih buat satu siswa saja beda sangat sama jawa barat dan jateng
Negatif,2020,komisi lindung anak indonesia komisi lindung anak indonesia sebut ada siswa yang tidak lolos terima serta didik baru ppdb daerah khusus ibukota jakarta yang belakang jadi kisruh karena syarat usia dan nbaca lengkap di
Negatif,2020,kids belum lama ini heboh dengan berita orang siswi nama aristawdya maheswari siswi umur tahun yang hasil milik piala harga namun gagal terima di sama negeri di jakarta pada seleksi terima serta didik baru atau ppdb
Negatif,2020,ppdb zonasi hujan kritik kini ribu kursi kosong di sekolah jakarta tidak isi
Negatif,2020,harus belum terap sistem ppdb zonasi diknas daerah khusus ibukota harus hitung atau sosialisasi lebih dahulu sistem ini memang enak sekarang akhir banyak kursi kosong njgn smp nanti kursi kosong jual belikan loh iya apalg untuk sekolah favorit di jakarta dan dan
Negatif,2020,dinas didik daerah khusus ibukota jakarta belum buka ppdb daerah khusus ibukota tahun mereka memang kurang laku sosialisasi
Negatif,2020,lembaga swadaya masyarakat gmbi daerah khusus ibukota jakarta tuntut kepada gubernur daerah khusus ibukota jakarta agar ppdb segera cabut
Negatif,2020,swasta mana mungkin bisa campur bang makanya wali murid saya rebut cari sekolah negeri saat ppdb jakarta kemarin karena gratis spp dan lain masuk buku yang pinjam bahkan banyak yang dari sekolah swasta pindah kah negeri juga demi gratis tapi iya itu seleksi kacau
Negatif,2020,memang yang perlu kritisi sekarang itu sistem ppdb yang makin kacau tambah pula model zonasi yang tidak jelas lebih parah di jakarta pakai sistem umur semua sekolah belum bisa sama semua kasi anak yang memang pintar dan harus sekolah yang tidak dukung halo
Negatif,2020,mulai bijak normalisasi sungai di jakarta formula b di monas yang korban pohon mahoni tangan covid dan bantu untuk para korban dampak pandemi yang ambur adul masalah ppdb yang akhir korban anak prestasi tunjuk ketidakmampuanmu anies baswedan
Negatif,2020,benar aku orang tidak dendam atau kalau nyesel kecewa tidak lama cuma kadang masih kecewa sama ppdb zonasi pakai umur karena aku masih oktober nanti baru harap cuma di japres tapi rata anak negeri kalah sama swasta sejak masuk smp aku sudah netapin mau masuk sman jakarta sekolah
Negatif,2020,tidak habis fikir memang saya kenal orang model begini emak yang misuh anak tidak terima di sekolah negeri gara atur ppdb di jakarta tahu tidak yang disalahin siapa mendikbud
Negatif,2020,iyaa bapak aku akan pindah kerja kah sana dari januari lalu karena aku dsah malas ikut ppdb jakarta jadi aku ikut kah ambon saja huhu
Negatif,2020,saya akan lihat ppdb jakarta ada yang paling muda nya tahun bulan kalau tidak salah ini saya yang tahun masih lama nyoba di jakarta bagaimana anjing auto swasta
Negatif,2020,tidak tahu lelah banget sama ppdb jakarta
Negatif,2020,lah di jakarta ppdb ada yang umur tahun lebih yang daftar
Negatif,2020,gubernur covid konpres melulu ppdb jakarta diam akan kotor
Negatif,2020,kad didik daerah khusus ibukota jakarta buat bijak ppdb dengan batas usia akibat para orang tua tambah pusinggggggggggggg cari uang untuk daftar anak di sekolah swasta nkonyollllllllllllllll
Negatif,2020,apa rencana perintah daerah khusus ibukota jakarta untuk anak yang gagal terima ppdb kalau ortunya tidak sanggup daftar kah sekolah swasta karena mihil bagamana
Negatif,2020,moga ada orang yang mau biaya unt lanjut skolah iya adik dan ntak lolos ppdb jakarta ajar raih ratus harga akhir putus sekolah
Negatif,2020,kenapa iya dewan wakil rakyat daerah daerah khusus ibukota jakarta diam ribu bahasa ketika orang tua siswa rasa rugi susah dengan atur usia dalam ppdb di daerah khusus ibukota jakarta oleh kepala dinas didik dan nanehh nkatanya wakil rakyat dan waktu kampanye saudara laki aku aku juang untuk rakyat nkacian deh
Netral,2020,jakarta indonesia
Netral,2020,tambah anggar bos susul banyak siswa di daerah khusus ibukota jakarta yang dampak pandemi covid dan sistem ppdb
Netral,2020,
Netral,2020,mimpi besar dan berani gagal dan ninfo ppdb sama istiqlal jakarta
Netral,2020,harus dari total nilai semua matpel seko kamu bagi banyak matpel kamu nah kalau yang umur itu tau aku ada di sistem ppdb jakarta ada beberapa daerah yang lihat dari jarak sekolah rumah juga tahun ini adkel yang baru masuk paling tua umur sudah paling muda
Netral,2020,hmm cuma mau ngetik ft ppdb jakarta
Netral,2020,maba niat banget ngetimnya moga buah hasil adik
Netral,2020,apa kamu ppdb daerah khusus ibukota jakarta juga sama seperti aku
Netral,2020,kalau anak ppdb sama jakarta tahun ini bisa jawab dan kalah sama yang tahun kakak perempuan
Netral,2020,paling itu nadia yang ngirim menfessnya
Netral,2020,coba ppdb nya rambah dong kah depok jangan jakarta saja
Netral,2020,midnight sale niel
Netral,2020,wkwkwk siap bang liti
Netral,2020,mantap kasposnye sophia latjiba pt sayang pt beri harap palsu wkwkw
Netral,2020,kirain bakar karena stock gala
Netral,2020,tidak bisa sudah ada contoh ini
Netral,2020,akan kamu yang ngajarin gas
Netral,2020,silah update kah media sosial kami saudara laki situ lengkap rekam jejak fraksi psi jakarta saat polemik ppdb kmarin
Netral,2020,astaga lebih baik tidak punya pacar daripada harus sama nadia kasi cowonya
Netral,2020,kelompok wakil orangtua siswa aju gugat gubernur daerah khusus ibukota kadinas didik daerah khusus ibukota jakarta kah ptun daerah khusus ibukota jakarta gugat sebut kait bijak terima serta didik baru ppdb bas usia dan ntalk sama sekretaris kumpul koloni jumono
Netral,2020,orang tua gugat ppdb daerah khusus ibukota jakarta kah ptun
Netral,2020,tahun ajar baru sudah mulai walaupun harus sekolah online adik adik tetap semangat untuk ajar iya dan nkita kilas balik ayo apa saja jalur ppdb yang siap perintah provinsi daerah khusus ibukota dan kenapa sih ada banyak jalur dan dan
Netral,2020,mau tidak mau harus baca web nya ppdb jakarta just in case
Netral,2020,sejarah catat ppdb daerah khusus ibukota jakarta
Netral,2020,kisruh terima serta didik baru ppdb di daerah khusus ibukota jakarta hingga saat ini masih jadi bincang dan dan dan dan
Netral,2020,anies baswedan minta kaji salur bantu bagi seluruh siswa yang gagal dalam ppdb
Netral,2020,laksana sosperda nomor tahun tentang pemuda oleh ketua fraksi nasdem dewan wakil rakyat daerah daerah khusus ibukota jakarta wibi andrino dan npada sempat ini serap banyak aspirasi seperti masalah sehat ppdb daerah khusus ibukota hingga latih umkm online dan dan dan dan
Netral,2020,dinas didik daerah khusus ibukota jakarta tanggap kabar soal ada siswa prestasi nama aristawidya maheswari gadis yang kerap sapa arista itu gagal lolos ppdb daerah khusus ibukota meski milik banyak prestasi
Netral,2020,tahun ajar baru sudah mulai namun tidak ada kursi dalam kuota terima serta didik baru ppdb daerah khusus ibukota jakarta tahun yang kosong
Netral,2020,dapat nama yang adu nasib kah komisi lindung anak indonesia karena gagal lolos ppdb daerah khusus ibukota daftar itu telah serah kah disdik daerah khusus ibukota jakarta untuk ditindaklanjuti
Netral,2020,ppdb jakarta resmi akhir tahun ini ppdb jakarta tambah syarat usia untuk serta didik
Netral,2020,ppdb daerah khusus ibukota jakarta selesai ribu kursi masih kosong
Netral,2020,kursi kosong sekolah negeri usai ppdb jakarta paling banyak dapat pada jenjang sekolah dasar sd yakni persen atau kursi
Netral,2020,dinas didik daerah khusus ibukota jakarta sebut ada kursi sisa usai ppdb
Netral,2020,ppdb jakarta sisa kursi kosong dan
Netral,2020,ppdb akhir masih ada kursi kosong di jakarta sebab ada kursi kosong pada tutup ppdb zonasi adalah sekolah lokasi di dekat pusat kantor atau di pulau ribu
Netral,2020,ppdb daerah khusus ibukota jakarta polemik syarat usia dalam pbb dan nhalo sahabat fema dan npelaksanaan ppdb di daerah khusus ibukota jakarta tahun ini dapat beda yaitu guna usia bagai salah satu faktor timbang dalam terima calon serta didik baru
Netral,2020,sdn srengseng pagi kembang jakarta barat ada sosialisasi ajar jarak jauh pjj bagi para wali murid
Netral,2020,iluni universitas indonesia kembali ada bagai webinar di antara profesional kontra bijak ppdb daerah khusus ibukota jakarta dan webinar putar inovasi koperasi policy center iluni universitas indonesia juga kembali ada diskusi yang unggah kah spotify dan youtube iluni universitas indonesia serta diskusi dengan para aktivis alumni universitas indonesia
Netral,2020,ikut ppdb jakarta bang
Positif,2020,saya tadi mau ipa tetapi gara lempar melulu jadi paksa milih ips dan ntadinya mau linjur sih nyata ips enak juga xixixixix terima kasih ppdb jakarta
Positif,2020,sistem terima serta didik baru ppdb rupa sisa kisah haru bunda orang putri sopir angkot hasil lolos sama favorit di jakarta
Positif,2020,cerita ppdb di ncalon siswa dari keluarga miskin bisa masuk sekolah ini semangat didik di ibukota dan dan
Positif,2020,ketua komisi e apresiasi bantu untuk siswa tidak lolos ppdb berita jakarta
Positif,2020,telah anies kecam tentang ppdb nkini anies jawab ntanpa harus urus surat miskin lebih siswa di daerah khusus ibukota jakarta bakal oleh bantu uang pangkal untuk masuk kah sekolah swasta mereka adalah siswa yang gagal dalam jalur ppdb total anggar yang banyak m
Positif,2020,untung yaaa warga jakarta punya gubernur yang sangat peduli dan nselain uang pangkal perintah provinsi daerah khusus ibukota akan bantu spp siswa gagal ppdb yang masuk sekolah swasta
Positif,2020,perintah provinsi daerah khusus ibukota jakarta akan bantu banyak ribu siswa yang tidak lolos seleksi daftar ppdb dan paksa harus kenyam didik di sekolah negeri
Positif,2020,perintah provinsi daerah khusus ibukota jakarta bantu an siswa tidak lolos ppdb kah sekolah swasta
Positif,2020,perintah daerah khusus ibukota jakarta siap dana rupiah miliar untuk bantu siswa sekolah swasta
Positif,2020,dewan wakil rakyat daerah daerah khusus ibukota jakarta akan awal rencana kucur anggar nila rupiah miliar yang akan keluar perintah provinsi daerah khusus ibukota jakarta bagai insentif bagi siswa yang tidak lulus ppdb agar bisa masuk di sekolah swasta
Positif,2020,bantu dari perintah provinsi daerah khusus ibukota jakarta upa uang pangkal siswa yang sekolah kah swasta jika siswa sebut dampak pandemi virus corona
Positif,2020,anggar nila rupiah miliar telah siap perintah provinsi daerah khusus ibukota jakarta untuk bantu didik bagi siswa sekolah sd smp smu yang tidak lolos ppdb untuk masuk di sekolah swasta
Positif,2020,walaupun proses ppdb di daerah khusus ibukota jakarta tuai polemik tapi ketua komisi e dewan wakil rakyat daerah daerah khusus ibukota jakarta nilai seluruh proses sudah baik
Positif,2020,disdik serta kjp yang tidak lolos ppdb cicil uang pangkal swasta agar tidak berat dalam keluar biaya didik di sekolah swasta kepala dinas didik daerah khusus ibukota jakarta saran agar para siswa terima kjp cicil biaya didik
Positif,2020,teman teman saya sedang cari narasumber untuk artikel di apakah ada saudara atau kerabat yang bisa bagi alam di ppdb jakarta dan nmohon bantu
Positif,2020,kompas judul yang jelas bukan karena atur ppdb jakarta cuy jadi olah perintah provinsi daerah khusus ibukota yang salah semua daerah itu sama atur ppdb nya
Positif,2020,usai kisruh ppdb daerah khusus ibukota jakarta sekolah swasta kini usul agar biaya oleh apbn
Positif,2020,buzzerp bodoh sistem ppdb seperti begitu hampir semua daerah di indonesia ngelakuin yang serang cuma jakarta saja itu mau anjing media dan buzzerp sampah macam kamu coba tanya bos gojek lagi sudah nyet
Positif,2020,ppdb depok tidak kayak ppdb jakarta ppdb depok lama
Positif,2020,amat karang bunga ppdb daerah khusus ibukota jakarta itu ikut atur permendikbud nomor tentang ppdb yang laku tiap daerah jadi kalau ada yang kirim karang bunga kah kantor anies arti si kirim salah alamat harus kirim kah kantor mantan kang gojek
Positif,2020,saya kira banyak masalah di ppdb ini ndan bukan hanya di perintah provinsi daerah khusus ibukota saja nkhususnya itu jalur zonasi npernahkan anda tanya langsung kah menteri
Positif,2020,alhamdulillah kalau begitu saya nge share itu cuma mau kasih tahu kalau masalah ppdb bukan hanya di jakarta tapi juga di beberapa daerah lain perintah daerah juga pasti jalan sesuai atur kemendikbud karena yang jadi regulator iya si kemendikbud
Positif,2020,saya heran soal ppdb kenapa yang demo cuma daerah khusus ibukota jakarta dan padang saja dan npadahal yang bikin atur akan mendikbud
Positif,2020,mbak bukti kalau ppdb di jakarta itu memang bijak kemendikbud
Positif,2020,anda tahu masalah ppdb itu bukan cuma di jakarta saudara laki daerah lain juga sama hanya saja telanjur sakit hati iya susah kemarin anis paling awal antisipasi korona tidak ada itu kalian apresiasi memang hati kalau sudah hitam yang baik juga akan terlihatjahat
Positif,2020,ppdb itu masalah bukan cuma di jakarta loh tempat lain juga sama sistem zonasi yang di buat oleh perintah timbul dampak yang buruk untuk didik di utama daerah kok cuma anis saja yang salah aneh
Positif,2020,ppdb jakarta psi minta daerah khusus ibukota bantu anak masuk sekolah swasta
Positif,2020,kemendagri fasilitas upaya selesai masalah ppdb daerah khusus ibukota jakarta
Positif,2020,ini jelas kemendagri kait masalah ppdb daerah khusus ibukota laksana tugas plt sekretaris jenderal kemendagri muhammad hudori kata pihak sudah temu titik temu masalah kait terima serta didik baru ppdb daerah khusus ibukota jakarta
Positif,2020,wakil ketua dewan wakil rakyat daerah daerah khusus ibukota jakarta zita anjani janji awal bantu bagi siswa yang akhir harus sekolah di swasta telah gagal masuk sekolah negeri
Positif,2020,adduh yang saat ini di laku di daerah khusus ibukota adalah program nanda akan lihat bodoh ketika anda sabut gubernur jakarta yang di salah
Positif,2020,masalah ppdb kena yang sorot hanya daerah khusus ibukota jakarta iya bukan daerah lain alami hal yang sama
Positif,2020,kemendagri kemendikbud dan perintah provinsi daerah khusus ibukota sudah temu titik temu soal ppdb sementara itu plt irjen kemendikbud chatarina muliana girsang tutur pihak telah laku sinergi sama perintah provinsi daerah khusus ibukota jakarta utama kait jalur zona rw
Positif,2020,sahabats yang baik hati bila turut prihatin dengan fenomena ceroboh implementasi bijak ppdb daerah khusus ibukota jakarta tahun khusus seleksi lalu jalur zonasi mari sama upaya untuk ubah dan revisi lalu petisi pada link ini
Positif,2020,kalau anies baswedan tidak benar mari kita kritik sama ntapi kalau anies tatih tatih urus psbb jakarta karena bijak presiden jokowi ntapi kalau anies tatih tatih urus ppdb jakarta karena bijak mendikbud nmaka silah nalar anda dibenahidulu
Positif,2020,tvonenews menge tweet amat didik sebut jika laksana ppdb zonasi di daerah khusus ibukota jakarta justru beri rasa adil bagi masyarakat tengah kah bawah
Positif,2020,atur ppdb itu dari mendikbud iya laku semua sekolah di indonesia bukan cuma jakarta kok yang salah gubernur
Positif,2020,nadiem aku salah pembully anies diam dan
Positif,2020,yth bapak nadiem makarim terimakasih atas atensi besar harap kami bapak bisa lurus masalah ini kisruh ppdb daerah khusus ibukota mendikbud nadiem siap koordinasi kah mendagri tito
Positif,2020,alhamdulillah masuk ppdb jakarta bun
Positif,2020,sama seperti tahun belum mana akan terus ada sekolah favorite yang di dominasi oleh sekolah favorite jenjang belum dan dan mengapa ppdb daerah khusus ibukota pakai usia bukan jarak karena demografi jakarta beda dengan daerah lain mana di jakarta duduk sangat padat banyak mukim
Positif,2020,untuk adik yang rasa kecewa marah akibat tidak masuk di sekolah negeri karena sistem ppdb hanya ingat bahwa ini bukan akhir dari segala tetap semangat
Positif,2020,urus dan kader psi diri posko untuk bantu warga yang sulit daftar anak dalam program terima serta didik baru ppdb moga ruwet terima siswa baru di jakarta segera atas
Positif,2020,coba teman jateng dan jawa barat ada tidak faktor usia dalam ppdb kasihan wan anis kok senter daerah khusus ibukota jakarta saja yang sorot
Positif,2020,amat didik sebut jika laksana ppdb zonasi di daerah khusus ibukota jakarta justru beri rasa adil bagi masyarakat tengah kah bawah
Positif,2020,komisi lindung anak indonesia apresiasi solusi ppdb daerah khusus ibukota yang warna kisruh syarat usia dan dan dan dan
Positif,2020,update dan nternyata ada jalur baru untuk ppdb daerah khusus ibukota jakarta jalur zonasi baru kena dengan mereka yang rumah masih rw setidakny ada harap bagi adek yang belum dapat sekolah dan lokasi ada se rw dengan sekolah yang tuju dan dan
Positif,2020,opini saya sih ppdb daerah khusus ibukota jakarta jangan batal atau ulang bahkan tambah stress otm dan cpdb akan buat masalah baru nperbaiki saja beri solusi tanpa masalah baru untuk cpdb yang tidak lolos seleksi karena usia
Positif,2020,ada kabar baik dari kemendikbud soal ppdb daerah khusus ibukota jakarta moga selesai kisruh
Positif,2020,dailami firdaus kisruh ppdb jakarta harus cari solusi pasti bisa
Negatif,2021,heh yaampun nasib banget sudah beli tiket pesawat segala macam sampai panggil tukang buat benerin rumah jakarta buat inap eh pas masuk web tiket serasa lagi ppdb masuk sama
Negatif,2021,teman teman smp saya seperti pada bagus banget nasib di sama saya di sini masih renung ppdb jakarta
Negatif,2021,poko sudah kamu di osis atau ekskul jabat apa langsung ajuin saja biar dapat poin tapi saya entah tidak tahu bandung bagamana krna tiap daerah beda sistem ppdb prestasi cuma jakarta memang jelek banget anjr
Negatif,2021,aaaa queela keren naku juga angkat sama kamu jakarta ppdb nya pakai umur mau menang umur aku masih bahkan saat itu sudah pasrah banget tidak bisa masuk sama jadi aku smk tertawa tetapi i ll do my best
Negatif,2021,cerita di bulan juli seleksi ppdb daerah khusus ibukota jakarta yang kecewa
Negatif,2021,sampai sekarang masih tidak terima he tidak masuk negeri dan nmaap kawan yang dapat memang belum rela saja dan nppdb jakarta
Negatif,2021,paling anti lihat ppdb jakarta
Negatif,2021,what ppdb jakarta peluang besar nya yang umur lebih tua
Negatif,2021,iyaa betul banget pas kelas stress pikir gituan apa lagi tinggal di jakarta khawatir sama ppdb yang sgjslshal
Negatif,2021,jujurly saya baru tahu ginian pas kelas asli pas lagi ppdb gitu pernah disaranin masuk sama jakarta biar berangkat sama emak untung gajadi sudah
Negatif,2021,sama semangat iya ajar soal di dom aku jakarta sistem ppdb kacau banget tertawa kalau dom kamu bukan jakarta iya aman aku dahulu korban ppdb jakarta
Negatif,2021,iya swasta apalagi aku juga numpang kakak buat masuk smp dahulu pas biar bisa masuk smp negeri jakarta tapi ppdb jakarta ini ygsekarang aneh begitu lohh pakai zona prioritas pakai retweet rw gapake jarak dari sekolah kah rumah akan yaa adh aneh deh malas banget malas sama ppdb
Negatif,2021,tidak terima jalur mana pun zonasi semua per sekarang swasta kuota membludak anak kami juga tidak terima apa dapat anda pak ibu kepala apakah bersit bagaimana asa anak
Negatif,2021,anak yang sudah tahan dari awal kalau sampai geser karena mungkin ada tambah nilai baru yang tidak logis saya mohon di pantau apa terimakasih
Negatif,2021,kepada yth dan di bantu di cek nilai yang sedang langsung seleksi seperti nilai tidak normal semua karena kalau nilai segitu di atas knapa baru daftar sekarang padahal di akademi jalur pertama lolos sekarang seperti ada yang bisa update nilai oknum
Negatif,2021,capek iya sama aku juga saya korban ghosting ppdb jakarta bulan saya ikut semua jalur pental semua kemarin saja saya ikut tahap dua pental lagi mana kursi dikit banget saja daftar swasta tempat saya rata rata sudah tutup nasib sampai sekarang stress banget saya
Negatif,2021,ppdb jakarta tahun ini kenapa tidak jelas banget si iya allah mau minggat saja
Negatif,2021,saat didik tidak pihak pada anak anak yang kurang mampu njangan salah kaum vandal tumbuh subur di dan dan dan dan dan dan
Negatif,2021,ppdb jakarta kacau
Negatif,2021,rasany tidak lolos japres karena kalah osis sama ekstra nrasany tidak lolos afirmasi karena kjp nrasany tidak lolos zonasi karena umur nrasnay tidak lolos tahap dua karena persentil sidanira dan dikit banget bangku kosong dan nkena mental men dan nppdb tahap jakarta
Negatif,2021,ppdb jakarta bangsat
