klasifikasi,tahun,tweet
Positif,2021,baik anak ppdb daerah khusus ibukota masalah program sidanira gubernur daerah khusus ibukota jakarta pantau mantan mendikbud ri amp vital bibit sdm daerah khusus ibukota jakarta kah gercep amp monitor yang sangkut
Positif,2021,senjata pc intel atom memori gb modem flash telkomsel sulit ketidakcakapan akses inet kerap muncul untung warung internet jakarta buka jasa asistensi ppdb solidaritas bagus
Positif,2021,kendala perintah provinsi daerah khusus ibukota hasil baik sistem ppdbjakarta
Positif,2021,kendala teknis baik gubernur anies pasti proses ppdb jakarta landas tara berita jakarta
Positif,2021,kendala teknis baik gubernur anies pasti proses ppdb jakarta berlandaskankesetaraan
Positif,2021,kendala teknis baik gubernur anies pasti proses ppdb jakarta berlandaskankesetaraan
Positif,2021,gubernur daerah khusus ibukota jakarta anies baswedan gercep sulit aju akun ppdb ajar atas akses
Positif,2021,gercep banget ppdb daerah khusus ibukota jakarta masalah gubernur turun tangan pasti proses lancar bangga gubernur beliau
Positif,2021,baik di respon cepat aspirasi masyarakat
Positif,2021,alhamdulillah kendala kemarin muncul rasa siswa orangtua ikut ppdb jakarta tangan
Positif,2021,layan baik unti wali murid sulit akses ebsite terima serta didik ppdb gubernur daerah khusus ibukota jakarta anies baswedan layan titik
Positif,2021,posko ppdb psi jakarta hadir damping proses daftar terima serta didik ppdb daerah khusus ibukota jakarta hubung nomor sesuai domisili sebar henti
Positif,2021,juang apa upaya baik juang dpra partai adil sejahtera daerah khusus ibukota jakarta buka posko bantu mudah juang ppdb online bang mpok min
Positif,2021,portal ppdb online sulit akses catat nomor posko adu wilayah daerah khusus ibukota jakarta
Positif,2021,anies langsung gelar rapat dirut telekomunikasi atas akses ppdb jakarta
Positif,2021,posko ppdb psi jakarta selatan masyarakat butuh bantu proses daftar silah hubung kontak tera kah posko alamat tera postingan salam solidaritas
Positif,2021,selamat iya tipsnya guna daftar moga istirahat moga manfaat yaa
Positif,2021,terima serta didik ppdb ajar daerah khusus ibukota jakarta senin perintah provinsi daerah khusus ibukota jakarta komitmen wujud tara sempat didik warga jakarta latar tuk didik sumber
Positif,2021,kasih staff urus ppdb daerah khusus ibukota jakarta sekian daftar japres moga ajar sistem didik indonesia maju milik sdm unggul
Positif,2021,tips kode keamananny tidak perlu ganti pencet lanjut skarang daftar tinggal pantengin tendang moga tipsnya guna yah semangat tidur tenang
Positif,2021,halo warga jakarta timur nomor playanan ppdb sila iya nik anak nya tugas warga jakarta timur sarana informasi nahi layan dokumen duduk mudah cepat gratis
Positif,2021,orangtua anak daftar ppdb daerah khusus ibukota jakarta manfaat mohon dishare komen like subscribe iya
Positif,2021,ombudsman jakarta nilai baik perintah provinsi daerah khusus ibukota kait laksana ppdb baik aspek regulasi substansi atur
Positif,2021,ombudsman nilai baik kait ppdb jakarta aspek regulasi substansi atur
Positif,2021,ombudsman apresiasi baik ppdb daerah khusus ibukota jakarta
Positif,2021,ayo dukung ppdb jakarta daring selenggara ppdb tuju wujud tara sempat warga latar warga oleh didik kualitas daerah khusus ibukota jakarta
Positif,2021,ombudsman ri wakil jakarta raya apresiasi dinas didik daerah khusus ibukota jakarta sosialisasi laksana terima serta didik ppdb
Positif,2021,weekend konten chanel youtube retno listyarti weekend ngobrol ppdb bentuk ketua panitia ppdb provinsi daerah khusus ibukota jakarta nanti video iya insyaallah manfaat
Positif,2021,eh ppdb jakarta tahap anjing neng banget tahap
Positif,2021,ppdb warga oleh didik kualitas daerah khusus ibukota jakarta ppdb bentuk sekolah sekolah negeri variasi serta didik gotong royong maju
Positif,2021,ppdb warga oleh didik kualitas daerah khusus ibukota jakarta ppdb bentuk sekolah sekolah negeri variasi serta didik gotong royong maju
Positif,2021,dear teman teman putra putri masuk sekolah informasi ppdb daerah khusus ibukota jakarta moga manfaat
Positif,2021,capai nilai raport bagus instant nya proses ajar terus
Positif,2021,ppdb ikhtiar cipta didik tuntas kualitas mari lanjut banyak kolaborasi sama tara sempat didik anak anak daerah khusus ibukota jakarta
Positif,2021,didik tanggung dinas didik daerah khusus ibukota jakarta harga kolaborasi tahap susun bijak ppdb
Positif,2021,enak ppdb jakarta sah
Positif,2021,taat banget perintah allah pas ppdb jakarta tahajud doa solawat in sekolah takdir allah baik tendang daftar smk mungkinini baik
Positif,2021,misuh misuh ppdb jakarta syukur temu teman support support dripada teman smp yaa enjoy sklhku praktek nya banget iya nama smk sih tertawa
Positif,2021,berkas sekolah negeri kemarin dasar alam daftar keponakan sd negeri jakarta online system ppdb jakarta bagus tahap daftar ulang proses orang tua urus
Negatif,2022,bagus sich sayang perata biaya didik apbn apbd adil siswa aju sekolah ppdb perintah provinsi jakarta layan kuota negeri alih kah swasta subsidi kjp pip
Negatif,2022,perata biaya didik sumber apbn apbd adil siswa aju ppdb kah perintah provinsi jakarta layan kuota negeri alih kah sekolah swasta terima pembiayaansubsidi
Negatif,2022,gasihh pas ppdb orang tua demo gasih perintah ketawa peduli beneran pas unjuk diketawain dibodohin gitu demo ajar loh perintah jahat iya kalgasal pas demo kah dinas didik jakarta
Negatif,2022,kemendikbud angkat coba nntinya hahaha semangat iya jujur masuk smk coba tertawa orang jakarta iya kacau ppdb jakarta so iya ppdb kecewa sistem
Negatif,2022,highschool in jakarta highschool in jakarta tolak ppdb daerah khusus ibukota ancrit
Negatif,2022,bagamana ygy sman jakarta rangking mnrt segani sekolah negeri random gara sistem ppdb tidak jelas masuk top iya bagus nya berekspektasi takut nurun rank gitu anjing
Negatif,2022,tangerang oasu ppdb jakarta nolak tidak bisa trend high school in jakarta sakit asa men
Negatif,2022,negeri iya swasta siap anak tambah informasi jakarta ajar sistem ppdb sodaraku umur tendang daftar siswa umur masuk sd based rayon utama based umur cobaa
Negatif,2022,anda dana bantu anak masuk sekolah sedih iya tuhan anak bodoh umur muda sekolah negeri bodoh sekolah ppdb jakarta sakit hati orgtua tunggal moga perintah provinsi dkibisa solusi anak
Negatif,2022,gonta ganti bijak ppdb jakarta nilai timbulkanpersoalan
Negatif,2022,juang ppdb jakarta lolos menang tidak apa ngerasain adil sistem usaha maksimal semangat teman nilai tertawa
Negatif,2022,ppdb jakarta mohon tidak jelas banget
Negatif,2022,iyanih kayak error melulu web ppdb jakarta kemarin ngeselin
Negatif,2022,ppdb zonasi jakarta kemarin anjing nama pas pilih iseng lihat pilih tidak ada uang nama pas kah pilih tidak ada uang yah bolak scroll refresh tidak ada uang anjing panik main
Negatif,2022,terima ppdb kunyuk jakarta pakai nilai zonasi umur
Negatif,2022,ppdb jakarta bantai kesel banget
Negatif,2022,ppdb jakarta anjirr utg jawa barat
Negatif,2022,adil banget najis ppdb zonasi jakarta udaa tua masuk logiss banget anak masuk tendang tunggu masuk negeri gila kapa sistem nya
Negatif,2022,ombudsman jakarta raya disdik daerah khusus ibukota jakarta gagal tanggulang histeria publik ppdb berita
Negatif,2022,dilema ppdb sekolah negeri jakarta umur daftar negeri umur daftar smp negeri umur nya geser daftar nilai raport akademik kalah umur
Negatif,2022,dilema ppdb sekolah negeri jakarta rangking juara kelas juara sekolah terima periode ppdb kalah title juara lomba kartu kjp
Negatif,2022,ppdb jakarta hancur banget buset
Negatif,2022,minggu masuk sekolah adik terima sekolah negeri sistem ppdb jakarta masuk akal
Negatif,2022,ppdb zonasi jakarta knpsih teman masuk swasta gara halang umur nilai trmsuk marah banget
Negatif,2022,tolong gap year ppdb jakarta tolong be bagus to me
Negatif,2022,ppdb jakarta jalur zonasi tua tua nich
Negatif,2022,sistem ppdb jakarta resah
Negatif,2022,drama ppdb online daerah khusus ibukota jakarta part kaya neehh hiks hiks anak nilai kalah anak umur
Negatif,2022,ppdb jakarta tua tua banget anjing
Negatif,2022,jakarta kawin tidak perlu daftar
Negatif,2022,ade nin nyangkut skolah negeri ggra klah umur maraahh ppdb daerah khusus ibukota jakarta gajelaass fakultas
Negatif,2022,ppdb jakarta kotor
Negatif,2022,adil ppdb zonasi jakarta
Negatif,2022,ppdb jakarta error parah anjing
Negatif,2022,website ppdb jakarta cacat ngecrash melulu kaya perang tiket jam banget standby
Negatif,2022,web ppdb jakarta hancur ygy
Negatif,2022,pagi sulit akses web ppdb jakarta
Negatif,2022,ppdb jakarta gagal melulu iya jaring aman
Negatif,2022,ppdb jakarta lemah otak bgtt
Negatif,2022,web ppdb jakarta begini
Netral,2022,penuh butuh masyarakat layan paud dinas didik provinsi daerah khusus ibukota jakarta buka layan ppdb ajar satu paud negerivtersebar jakarta minat daftar kah satu paud negeri tingkat
Netral,2022,penuh butuh masyarakat layan paud dinas didik provinsi daerah khusus ibukota jakarta buka layan ppdb ajar satu paud negerivtersebar jakarta minat daftar kah satu paud negeri tingkat
Netral,2022,yaallah allahu akbar nyesel banget pas ppdb milih sman sman jakarta nyesel salah ampun banget
Netral,2022,terima serta didik ppdb online fons vitae marsudirini koja jakarta utara
Netral,2022,ehh akt afirmasi pakai umur iya ppdb jakarta akt pakai umur sih afirmasi liat prio zona
Netral,2022,lihat web ppdb jakarta pakai zonasi urut pakai nya nilai beda jawa barat timur zonasi banyak pakai jarak
Netral,2022,jakarta pas ppdb zonasi jalur non zonasi pakai nem atas masuk pakai umur kayak jakarta ubah sih
Netral,2022,sih pengaruh iya nder jakarta ppdb non un angkat iya turun angkat ppdb non un
Netral,2022,jakarta ppdb pakai zonasi
Netral,2022,daerah jakarta orang tua gagap teknologi antri token isi data ppdb kali orang tua melas kah tugas dibantuin input data gagap teknologi daerah area non signal mikir iya
Netral,2022,hallo sabtu agustus pkbm negeri tahap batas lapor ppdb lupa bagi informasi kah teman mu butuh iya
Netral,2022,catat link daftar ppdb pkbm tahap daerah khusus ibukota jakarta
Netral,2022,daftar ppdb pkbm tahap daerah khusus ibukota jakarta resmi buka simak jadwal
Netral,2022,kakak kakak kelas kemarin ppdb jakarta ngegunain urus ekstrakulikuler surat lantik surat si kaya urus osis
Netral,2022,hallo jadwal daftar ppdb pkbm negeri tahap lupa bagi informasi kah teman mu butuh iya
Netral,2022,hallo jadwal daftar ppdb pkbm negeri tahap lupa bagi informasi kah teman mu butuh iya
Netral,2022,hallo rabu agustus pkbm negeri tahap batas lapor ppdb lupa bagi informasi kah teman mu butuh iya
Netral,2022,hallo jadwal lapor ppdb pkbm negeri tahap lupa bagi informasi kah teman mu butuh iya
Netral,2022,jakarta kota kota tambah sistem ppdb
Netral,2022,giat asn pusat latih kerja daerah jakarta timur ikut podcast rabu ajar episode kah tema terima serta didik ppdb kanal youtube jakarta public policy center bpsdm daerah khusus ibukota jakarta selenggara bpsdmprovinsi daerah khusus ibukota jakarta
Netral,2022,diterapin jakarta ppdb sekolah negeri zonasi camat gitu iya sekolah vaham sih kayak tinggal jauuh
Netral,2022,orang tua wali sah siswa daftar anak jalur zonasi zonasi siswa ppdb daerah khusus ibukota jakarta smp harap acu
Netral,2022,deobitna proudly present ppdb jalur playlist resah jacob in jakarta ayo temennya diajakin daftar
Netral,2022,iyaa tangerang jakarta maksud tauu sistem ppdb tangerang gimanaa
Netral,2022,hahahaha haloo kakel mts ngomong-ngomong daftar kemarin ppdb jakarta nerima kakak tangerang
Netral,2022,hallo jumat juli batas lapor ppdb daring lupa bagi informasi kah teman mu butuh iya
Netral,2022,hallo jumat juli batas lapor ppdb daring lupa bagi informasi kah teman mu butuh iya
Netral,2022,sur sur liaatt sur tertawa ppdb jakarta
Netral,2022,lapor ppdb jakarta tinggal klik
Netral,2022,hallo jadwal lapor ppdb daring lupa bagi informasi kah teman mu butuh iya
Netral,2022,ppdb smk daerah khusus ibukota jakarta tahap lapor
Netral,2022,hallo jadwal lapor ppdb daring lupa bagi informasi kah teman mu butuh iya
Netral,2022,ppdb sd daerah khusus ibukota jakarta tahap tiga link umum lapor
Netral,2022,ppdb jakarta tutup tidak bisa daftar kann
Netral,2022,ppdb mtsn man daerah khusus ibukota jakarta tahap link umum lapor
Netral,2022,ppdb mtsn man daerah khusus ibukota jakarta tahap link umum lapor
Netral,2022,alam ikut ppdb online daerah khusus ibukota jakarta part
Netral,2022,ppdb depok kakak daerah khusus ibukota jakarta tinggal daerah cere mohon info syarat jalur diikiuti terima kasih
Netral,2022,cuma nyeritain tim coach siap igt si emak nyeletuk ikut kah jakarta busetdah kata join igt ppdb menang banget
Netral,2022,ppdb hang tuah jakarta tutup selamat gabung hang tuah jakarta
Positif,2022,bu pulau ribu nya fisik bagus liat ppdb daftar ulang usul kayak unggul pakai asrama calon siswa jakarta khawatir daftar sana
Positif,2022,baik sistem zonasi ppdb daerah khusus ibukota jakarta indikasi numpang kakak hapus lurah langsung camat sort pakai daftar pilih sekolah tambah nilai ipk umur hapus
Positif,2022,syukur cuma if could do this ppdb milih sekolah jakarta apa sekolah jakarta
Positif,2022,wakil gubernur daerah khusus ibukota sistem ppdb jakarta tingkat kualitas siswa sekolah
Positif,2022,wakil gubernur daerah khusus ibukota jakarta ahmad riza patria klaim sistem terima serta didik ppdb hasil tingkat kualitas murid sekolah
Positif,2022,ppdb ulang tahun telah ayah usaha keras sekolah negeri masuk kah favorite jakarta indonesia menang lompat sahabat sekolah
Positif,2022,kak min sori link lapor nya cari cari website ppdb jakarta ketemu mesti kasih kolom button khusus lapor kolom pantau hasil seleksi mudah tolong kasih link terima kasih
Positif,2022,buset ppdb tangerang japresnya liat hasil seleksi webnya curiga nyogok tertawa buset deh bang asa kemarin jakarta gitu banget jakarta berani tertawa kepseknya langsung panggil kali
Positif,2022,sistem ppdb online banten kayak daerah khusus ibukota jakarta iya serta tampil web terima gaknya clear nilai raport peluang suap susah tutup amp ujug umum fair
Positif,2022,prihatin adik gap year usul zonasi kah gubernur daerah khusus ibukota jakarta kah admin ppdb meta zonasi tetap atur gubernur nomor admin ppdb sih
Positif,2022,ppdb jakarta sekolah unggul nilai bagus
Positif,2022,usaha nder pindah kakak sekolah gara-gara keluarga uang sekolah cari sekolah gratis iya jakarta pindah ngomong-ngomong nder ngurusnya gratis bayar fc data pindah pas sistem ppdb zonasikok tertawa
Positif,2022,sandang disabilitas ppdb daerah khusus ibukota jakarta
Positif,2022,ppdb jakarta japres lolos seleksi lulus smp huhuhu puji tuhan syukur teman lolos seleksi ppdb japres moga jalur afirmasi amp zonasi terima aamiinn bagus luck teman semangat
Positif,2022,alhamdulillah terima ppdb jakarta jalur prestasi bayang terima kasih god
Positif,2022,ppdb daerah khusus ibukota jakarta jalan lancar
Positif,2022,komisi lindung anak indonesia ppdb jakarta jalan lancar lupa password akun dominasi masalah poskoppdb
Positif,2022,moga lolos ppdb gel jakarta moga kakak jauh sial lancar mudah urus aamiin rajin doa kak semangat nyerah jaga sehat iya makan minum istirahat bagus luck have bagus day
Positif,2022,salut sih bikin presentil akademik ppdb daerah khusus ibukota jakarta detail hitung presentil akademik nilai akademik nilai non akademik akreditasi peringkat angkat ramu nilai wakil jalur prestasi
Positif,2022,sulit ppdb daerah khusus ibukota jakarta japri yaa stand by laptop bantuin sodara
Positif,2022,ppdb jalur zonasi beda jalur afirmasi kjp dan kawan jalur aspirasi amp keluh warga sekolah sekolah jakarta kota jml sekolah jarak rapat daerah wil kabupaten
Positif,2022,mudah orang tua murid posko layan ppdb wilayah ii jakarta barat sedia laptop
Positif,2022,mudah orang tua murid posko layan ppdb wilayah ii jakarta barat sedia laptop
Positif,2022,ombudsman jakarta raya jaga integritas laksana ppdb alami laksana ppdb
Positif,2022,iya sih miin ppdb banten transparan kaya ppdb jakarta sekolah negeri siswa kelas sekolah negeri kelas orang siswa
Positif,2022,informasi ppdb jakarta cari purwosusilo sistem variatif tara masyarakat
Positif,2022,hindar salah suku dinas didik wilayah jakarta pusat gencar sosialisasi mekanisme daftar ppdb orang tua murid
Positif,2022,perintah provinsi daerah khusus ibukota jakarta terima serta didik ppdb daring variatif bentuk kualitas didik
Positif,2022,cari informasi saranin ppdb jakarta ppdb banten sistem nya ku transparan gantung hoki ppdb banten pas seleksi nya tidak bisa lihat ppdb jakarta pantau web
Positif,2022,wakil gubernur daerah khusus ibukota jakarta ahmad riza patria selenggara terima serta didik ppdb jalan
Positif,2022,ppdb jakarta pakai jalur kota alhamdulillah langsung terima pil nder geser umur nya muda tidak tahu si diitung
Positif,2022,didik tanggung dinas didik daerah khusus ibukota jakarta harga masuk tahap susun bijak ppdb ajar
