sentimen,tahun,tweet
Netral,2022,memenuhi kebutuhan masyarakat layanan paud dinas pendidikan provinsi dki jakarta membuka layanan ppdb ajaran satuan paud negerivtersebar jakarta peminat mendaftar satuan paud negeri meningkat
Netral,2022,yaallah allahu akbar nyesel banget pas ppdb tidak milih sman sman jakarta nyesel bersalahnya ampun banget
Netral,2022,penerimaan peserta didik ppdb online sma fons vitae marsudirini koja jakarta utara
Netral,2022,ppdb mtsn man dki jakarta tahap link pengumuman lapor
Netral,2022,pengalaman mengikuti ppdb online dki jakarta part
Netral,2022,ppdb depok kakak dki jakarta tinggalnya didaerah cinere mohon infonya persyaratannya jalur diikiuti terima kasih
Netral,2022,Cuma nyeritain tim coach persiapan igt si emak nyeletuk tidak ikutan jakarta busetdah dikata join igt ppdb sma menangis banget
Netral,2022,ppdb sma hang tuah jakarta tutup selamat bergabung sma hang tuah jakarta
Positif,2022,bu pulau seribu sma nya fisik bagus diliat ppdb tidak daftar ulang usul tidak kayak sma unggulan pakai asrama calon siswa jakarta tidak khawatir daftar disana
Positif,2022,disyukuri Cuma if could do this ppdb milih sekolah jakarta apapun sekolahnya jakarta
Positif,2022,ppdb jakarta sekolah unggulan nilainya bagus
Positif,2022,ppdb jakarta japres lolos seleksi lulus smp huhuhu puji tuhan bersyukur sangat teman belum lolos seleksi ppdb japres semoga jalur afirmasi amp zonasi keterima sma aamiinn bagus luck teman-teman semangat
Positif,2022,alhamdulillah keterima ppdb jakarta jalur prestasi sma bayangkan terima kasih god
Positif,2022,ppdb dki jakarta berjalan lancar
Positif,2022,komisi perlindungan anak indonesia ppdb jakarta berjalan lancar lupa password akun dominasi permasalahan posko ppdb
Positif,2022,semoga lolos ppdb gelombang jakarta semoga kakak dijauhkan kesialan dilancarkan dimudahkan urusannya aamiin rajin berdoa kak semangat jangan nyerah jaga kesehatan makan minum istirahat bagus luck have bagus day
Positif,2022,kagum sih bikin presentil akademik ppdb dki jakarta sedetail menghitung presentil akademik nilai akademik nilai non akademik akreditasi peringkat angkatan diramu nilai mewakili jalur prestasi
Positif,2022,pemerintah provinsi dki jakarta penerimaan peserta didik ppdb daring variatif demi membentuk kualitas pendidikan baik
Positif,2022,wakil gubernur dki jakarta ahmad riza patria penyelenggaraan penerimaan peserta didik ppdb berjalan baik
Positif,2022,ppdb jakarta pakai jalur luar kota alhamdulillah langsung diterima pilihan tidak geser umur nya muda tidak tahu si dihitung tidak
