klasifikasi,tahun,tweet
Negatif,2018,jakarta terap sistem zonasi sekolah terima serta didik ppdb buntut daerah orangtua daftar anak anak kah
Negatif,2018,jakarta dipikirin demo ppdb pakai sistem zona hubung svt coba
Negatif,2018,jalur afirmasi jakarta bukti rekening bank calon siswa terima kjp bawa sktm saing nilai terima kjp ndaftar singkir kah sekolah swasta terima siswa umum ppdb
Negatif,2018,umum bangku kosong tahap jalur domisili daerah khusus ibukota jakarta tingkat akses ppdb online min jadwal tanggal juli wib cari web ppdb
Negatif,2018,ppdb provinsi jateng ulas jalur afirmasi kjp jakarta tahap batas maksimal orang sekolah salah prosedur
Negatif,2018,ppdb online jakarta mas terima jalur afirmasi terima kjp nilai banget masuk favorit nem bawah masuk smtr anak jurus
Negatif,2018,protes kait rumit proses ppdb daerah khusus ibukota jakarta sosialisasi daftar
Negatif,2018,protes kait rumit proses ppdb daerah khusus ibukota jakarta sosialisasi daftar
Negatif,2018,protes kait rumit proses ppdb daerah khusus ibukota jakarta wali murid protes sosialisasi daftar keluh
Negatif,2018,juang nilai anak sulit tambah zonasi buka wilayah jatinegara nyata jakarta timur mana letak adil putra putri mohon ppdb online lokal tutup harap
Negatif,2018,alam ppdb daerah khusus ibukota iya konon daerah sehat praktek ukur jarak alamat sesuai kakak kah sekolah timbang daerah khusus ibukota angka usia ajar kah praktek ppdb jakarta
Negatif,2018,nilai un kali revisi ppdb online disii jakarta timur zona lokal jakarta selatan liput jakarta timur
Negatif,2018,smk jakarta daftar ppdb online beberapa jurus cantum syarat badan salah contoh jurus bisnis daring pasar sayang sempat masuk jurus kendala badan
Negatif,2018,mohon evaluasi sistem ppdb smp daerah khusus ibukota warga daerah khusus ibukota sekolah daerah khusus ibukota jakarta selatan fair kondisi daftar sekolah daerah khusus ibukota ikut seleksi kondisi hasil usbn daerah khusus ibukota nilai
Negatif,2018,mohon evaluasi sistem ppdb smp daerah khusus ibukota warga daerah khusus ibukota sekolah daerah khusus ibukota jakarta selatan fair kondisi daftar sekolah daerah khusus ibukota ikut seleksi kondisi hasil usbn daerah khusus ibukota nilai
Negatif,2018,mohon evaluasi sistem ppdb smp daerah khusus ibukota warga daerah khusus ibukota sekolah daerah khusus ibukota jakarta selatan fair kondisi daftar sekolah daerah khusus ibukota ikut seleksi kondisi hasil usbn daerah khusus ibukota nilai
Negatif,2018,daftar ppdb bikin bingung kepala sekolah sman jakarta
Negatif,2018,jarak komponen hitung ppdb daerah khusus ibukota siswa daerah khusus ibukota bondong daftar kah fav letak kota jakarta nilai tentu rumah papua
Negatif,2018,jalur kota ppdb daerah khusus ibukota sekolah batas kota tembus batas zonasi banget anak jakarta batas zonasi kasi anak jakartanya
Negatif,2018,permendikbud atur zonasi minimal ppdb jakarta terap lokal nilai un utama
Netral,2018,come and join us at ppdb smk telekomunikasi jakarta smk telekomunikasi jakarta sekolah keren terap budaya redi ccp character content process bas gitu olah raga
Netral,2018,come and join us ppdb smk telekomunikasi jakarta smk telekomunikasi jakarta sekolah keren terap budaya redi ccp character content process bas gitu olah raga
Netral,2018,promosi ppdb tiada henti silaturahmi promosi kah mts smpn sambut hangat kepala sekolah waka siswa siswi smp mts antusias smk telekomunikasi jakarta sekolah
Netral,2018,ngobrol lulus now what kah jakarta stay sana tdnya jakarta gajadi tertawa eh pas jakarta haris hubung kabar kembang ppdb
Netral,2018,daftar ppdb ajar buka gelombang ayo daftar ikut jalur hafizh qur an sd muhammadiyah jakarta tempat informasi
Netral,2018,passing grade hasil ppdb smk daerah khusus ibukota jakarta
Netral,2018,informasi ppdb hubung telepon hunting extension sd smp smk smk
Netral,2018,ppdb sdn daerah khusus ibukota jakarta serta kia
Netral,2018,ppdb sdn daerah khusus ibukota jakarta serta kia
Netral,2018,ppdb sd daerah khusus ibukota jakarta pakai kartu identitas anak
Netral,2018,selamat sore admin publik unduh database arsip ppdb daerah khusus ibukota jakarta
Netral,2018,team ppdb persentasi smpn antusias siswa siswi smpn smk telekomunikasi jakarta sekolah keren terap budaya redi ccp character content process bas gitu
Netral,2018,team ppdb persentasi smpn antusias siswa siswi smpn smk telekomunikasi jakarta sekolah keren terap budaya redi ccp character content
Netral,2018,kepala dinas didik budaya tangsel bantah korupsi kait ppdb simpetas
Netral,2018,kepala dinas didik budaya tangsel bantah korupsi kait ppdb simpetas
Netral,2018,passing grade hasil ppdb smk daerah khusus ibukota jakarta blog
Netral,2018,online jakarta mati calon siswa smp
Netral,2018,passing grade hasil ppdb daerah khusus ibukota jakarta blog
Netral,2018,meeting staff gama school rencana buka ppdb siswa jalan alur laut rawabadak koja jakarta utara daerah khusus ibukota jakarta indonesia
Netral,2018,presentasi kah mts asy syukriyyah tim ppdb smk telekomunikasi jakarta sekolah keren terap budaya redi ccp character content process bas gitu olah raga olah olah rasio
Netral,2018,presentasi kah mts asy syukriyyah tim ppdb smk telekomunikasi jakarta sekolah keren terap budaya redi ccp character content process bas gitu olah raga
Netral,2018,ppdb ta smk sint joseph jakarta
Netral,2018,uji saring masuk ppdb smk telekomunikasi jakarta tahap rangka jaga kualitas tahap uji liput tes akademis psikotes wawancara sekolah keren
Netral,2018,passing grade hasil ppdb smp daerah khusus ibukota jakarta blog
Netral,2018,video kah playlist motion graphic ppdb daerah khusus ibukota karya smk jakarta multimedia
Netral,2018,kabid smp disdikbud tangsel kendala daftar ppdb tribun jakarta
Netral,2018,daftar gelombang buka mari gabung
Netral,2018,informasi ppdb sds regina pacis jakarta
Netral,2018,ppdb smk telekomunikasi jakarta terima serta didik ta buka informasi smk telekomunikasi school jakarta
Netral,2018,ombudsman wakil jakarta raya temu duga langgar maladministrasi terima serta didik ppdb online bogor depok bekas
Netral,2018,informasi daftar ppdb smk telekomunikasi jakarta ta terang silah hubung tugas ppdb nomor nomor prosedur
Positif,2018,puji tuhan si bontot tulis wag keluarga guise sosyel all the way hasil umum ppdb st ursula jakarta anak sos is coming from the hartantos adik alamat twtitter opo sih
Positif,2018,radar bogor sleman apresiasi ppdb sistem zonasi jakarta radar bogor men
Positif,2018,layan denga posko ppdb online daerah khusus ibukota jakarta admin pantau proses layan posko
Positif,2018,admin pantau kunjung gubernur daerah khusus ibukota jakarta posko ppdb online daerah khusus ibukota jakarta alhamdulillah ppdb daerah khusus ibukota jakarta jalan lancar aman kendali
Positif,2018,ppdb online smpn kota bekas aktif update nya jul wib update jakarta loh update menit
Positif,2018,ppdb smp online kabupaten bekas paksa tetangga kota bekas jakarta lancar informatif update
Positif,2018,iya webnya minim informasi banding web
Positif,2018,kartu jakarta pintar ngotot daftar ppdb online terima gamungkin papa mama ngalangin sekolah ngotot kerja jual kue sekolah bantu kantin kerja partime waiter
Positif,2018,alhamdulillah ppdb negeri tahap selesai yartika terima negeri jakarta
Positif,2018,sore jam ppdb jakarta tahap jalur lokal sman tutup nyata kandidat terima keren proses seleksi
Positif,2018,ppdb terima serta didik online salah prestasi riil beliau gubernur daerah khusus ibukota jakarta laksana ppdb online bagus amp pungli sayang ppdb online gratis laksana daerah daerah khusus ibukota
Positif,2018,enak banget ppdb jakarta apakabar negeri diitung jari
Positif,2018,overload servernya tenggang panjang jakarta bagus ppdb
Positif,2018,jelas perintah daerah jakarta komitmen anak imunisasi perintah daerah anak gagal sekolah imunisasi ppdb screening riwayat calon murid jalan
Negatif,2019,presiden baik umur hidup iya ppdb daerah khusus ibukota jakarta provinsi indonesia pakai sistem zonasi kasihan sekolah dinegri bijak jokowi sekolah gratis
Negatif,2019,iya ppdb daerah khusus ibukota jakarta provinsi indonesia pakai sistem zonasi kasihan sekolah dinegri bijak jokowi yaitus sekolah gratis
Negatif,2019,iya rekapin hasil ppdb jakarta bocah kelas hahaha
Negatif,2019,ombudsman sesal daerah khusus ibukota jakarta terap ppdb zonasi
Negatif,2019,ombudsman sesal daerah khusus ibukota jakarta terap ppdb zonasi
Negatif,2019,ombudsman sesal daerah khusus ibukota jakarta terap ppdb zonasi
Negatif,2019,anak ikut ppdb sekolah negeri emak emaknya dag dig dug pantau gera hasil seleksi kayak gera harga saham jakarta seleksi dasar nilai un beda daerah utama jarak rumah
Negatif,2019,celah zonasi asli tetapi palsu versi ppdb online pindah orang tua wali cermat kakak jakarta sekolah semarang masuk akal disemarang kecuali sekolah smp jakarta
Negatif,2019,dear admin jadwal ppdb smp non zonasi daftar anak iya error warning jalur untuk cpd domisili propinsi daerah khusus ibukota jakarta domisili daerah khusus ibukota mohon bantu
Negatif,2019,dewan wakil rakyat kritisi praktik manipulasi domisili zonasi ppdb jakarta edunews id laksana terima serta didik ppdb mekanisme zonasi buka ruang praktik manipulasi domisili laksana ppdb awas evaluasi
Negatif,2019,timbul polemik sistem zonasi ppdb redam kerisuhan teliti center for indonesian policy studies perintah hapus stigma sekolah favorit sekolah non favorit jakarta mediamerdeka co perintah evaluasi
Negatif,2019,suka sistem ppdb prioritas zonasi ngerasa adil kartu keluarga jakarta pindah kakak
Negatif,2019,ombudsman nilai perintah provinsi daerah khusus ibukota jakarta maladministrasi kait ppdb
Negatif,2019,kah posko ppdb jakarta timur terima kjp daftar zonasi afirmasi info data dukcapil amp sistem zonasi sinkron tolong admin jelas nya
Negatif,2019,tunjuk teknis ppdb jakarta jakarta utama sistem zonasi atur permendikbud
Negatif,2019,ombudsman daerah khusus ibukota jakarta laku maladministrasi ppdb
Negatif,2019,posko ppdb jakarta selatan pusat sman kebayoran ramai kunjung orang tua murid orang tua murid keluh beda data nik verifikasi data tahap daftar ppdb online jalur zonasi
Negatif,2019,nilai bohong kadisdik daerah khusus ibukota ppdb sistem zonasi jakarta adil
Negatif,2019,oohh daftar ppdb jakarta goodluck iya proses daftar sekolah ngomong-ngomong seko kampus prestasi ranking menang lomba ipk nya huahaha doong
Negatif,2019,oohh daftar ppdb jakarta goodluck iya proses daftar sekolah ngomong-ngomong seko kampus prestasi ranking menang lomba ipk nya huahaha doong
Negatif,2019,oohh daftar ppdb jakarta goodluck iya proses daftar sekolah ngomong-ngomong seko kampus prestasi ranking menang lomba ipk nya huahaha doong
Negatif,2019,oohh daftar ppdb jakarta goodluck iya proses daftar sekolah ngomong-ngomong seko kampus prestasi ranking menang lomba ipk nya huahaha doong
Negatif,2019,oohh daftar ppdb jakarta goodluck iya proses daftar sekolah ngomong-ngomong seko kampus prestasi ranking menang lomba ipk nya huahaha doong
Negatif,2019,oohh daftar ppdb jakarta goodluck iya proses daftar sekolah ngomong-ngomong seko kampus prestasi ranking menang lomba ipk nya huahaha doong
Negatif,2019,jarak pisah fergusoo nikah sesuai zonasi zona lurah cimahi cimtizen
Negatif,2019,bicara ppdb hubung jujur sih erti sistem sih sistem daerah khusus ibukota beda sistem daerah daerah zonasi peduli nem jakarta main nem
Negatif,2019,merengking ppdb online daerah khusus ibukota jakarta penuh atur terang gambar nilai inisial siswa nilai inisial siswa seleksi tayang online inisial tayang
Negatif,2019,pindah domisili lolos sistem zonasi ppdb jakarta sia sia
Negatif,2019,frustrasi ppdb jakarta
Negatif,2019,mohon pantau laksana ppdb daerah khusus ibukota jakarta titik rat nilai un langsung sman kira rata daerah khusus ibukota sistem zonasi adil perata kwalitas didik
Negatif,2019,tau iya pas daftar adik sekolah zonasi jakarta nem nya laku sekolah dipilihin orang ppdb nya rumah camat gambir iya sekolah bisa daerah situ kah camat cawang gituu saing pakai nem
Negatif,2019,ppdb daerah khusus ibukota jakarta kacau sekolah
Negatif,2019,to admin maaf sistem zonasi seleksi masuk ppdb sman jakarta barat dasar jarak rumah kah selo tuju dekat grading by nilai tinggi orang tua murid sistem zonasi ttpby nilai
Negatif,2019,ppdb jalur zonasi jakarta warna keluh layan
Negatif,2019,ppdb online si sulung jakarta timur lancar daftar jalur jalur camat prestasi antri sesuai nomor masuk input nilai verifikasi tinggal tunggu real time anak masuk horror iya
Negatif,2019,orang tua keluh proses ppdb sistem zonasi jakarta
Negatif,2019,case anak istri tinggal semarang anak sekolah sd semarang kakak jakarta sempat daftar ppdb lebih baik sempat daftar kalah sisih nilai fair
Negatif,2019,notice besok ppdb jakarta buka zonasi hapus ppdb ulang nilai bagus mati mati ajar keluarin uang hasil bodoh lebih baik tidak perlu sekolah biar didik indonesia bobrok
Negatif,2019,ganti model ppdb bingung orang pandai jakarta dunia didik uji coba sistem ayo kah bimbing ki dewantoro
Negatif,2019,orangtua murid nilai sistem zonasi ppdb adil
Netral,2019,antar prakerin jakarta ppdb buka pendfataran
Netral,2019,smp muhammadiyah jakarta jalan tebet timur ii nomor tebet jakarta selatan jakarta selatan informasi terima serta didik ppdb ajar smp muh
Netral,2019,besok juni ppdb madrasah daerah khusus ibukota jakarta umum
Netral,2019,prestasi simak daftar ppdb daerah khusus ibukota jakarta jalur prestasi
Netral,2019,prestasi simak daftar ppdb daerah khusus ibukota jakarta jalur prestasi
Netral,2019,syarat lengkap ppdb online jenjang smp daerah khusus ibukota jakarta
Netral,2019,besok juni ppdb madrasah daerah khusus ibukota jakarta umum
Netral,2019,smp muhammadiyah jakarta jalan tebet timur ii nomor tebet jakarta selatan jakarta selatan informasi terima serta didik ppdb ajar smp muh
Netral,2019,daftar ppdb online sd provinsi daerah khusus ibukota jakarta
Netral,2019,simak tentu jadwal jalur zonasi ppdb daerah khusus ibukota jakarta
Netral,2019,hasil ppdb madrasah man daerah khusus ibukota jakarta umum cek
Netral,2019,ppdb smk santa theresia jakarta
Netral,2019,passing grade hasil ppdb smp daerah khusus ibukota jakarta
Netral,2019,jurus bahasa ppdb daerah khusus ibukota jakarta
Netral,2019,prestasi simak daftar ppdb daerah khusus ibukota jakarta jalur prestasi
Netral,2019,hasil ppdb madrasah man daerah khusus ibukota jakarta umum cek
Netral,2019,besok juni ppdb madrasah daerah khusus ibukota jakarta umum
Netral,2019,syarat lengkap ppdb online jenjang smp daerah khusus ibukota jakarta
Netral,2019,informasi traffic management center tmc polisi daerah metropolitan jaya pagi catat lapor aksi aliansi parlemen jalan srmi lmnd fnpbi ppdb spartan seniman jakarta papernas iisip dan lain tua mau disuapin
Netral,2019,syarat lengkap ppdb online jenjang smp daerah khusus ibukota jakarta
Netral,2019,dibilangin pindah kah jakarta mbak rinrin riweuh melulu ppdb
Netral,2019,passing grade hasil ppdb daerah khusus ibukota jakarta blog
Netral,2019,mari gabung generasi generasi qur ani
Netral,2019,teman teman sekolah charitas jakarta buka ppdb ajar ayo daftar tinggal informasi sekolah email yayasan
Netral,2019,ppdb smk santa theresia jakarta ajar
Netral,2019,jakarta kamis komisi lindung anak indonesia selenggara rapat koordinasi hasil awas terima serta didik ppdb
Netral,2019,rencana umum ppdb smp daerah khusus ibukota jakarta
Netral,2019,ppdb ajar katolik sang timur jakarta
Netral,2019,ppdb sd santa theresia jakarta
Netral,2019,ppdb kb santa theresia jakarta
Netral,2019,bincang publik ombudsman ri wakil jakarta raya sengkarut selenggara ppdb interaktif fm amp streaming
Netral,2019,muhadjir effendy sebut sekolah daerah khusus ibukota jakarta penuh syarat terap terima serta didik ppdb bas zonasi penuh
Netral,2019,mendikbud jakarta penuh syarat terap ppdb zonasi penuh mendikbud muhadjir
Netral,2019,mendikbud jakarta penuh syarat terap ppdb zonasi penuh mendikbud muhadjir
Netral,2019,mendikbud jakarta penuh syarat terap ppdb zonasi penuh mendikbud muhadjir
Netral,2019,mendikbud jakarta penuh syarat terap ppdb zonasi penuh mendikbud muhadjir
Netral,2019,mendikbud jakarta penuh syarat terap ppdb zonasi penuh mendikbud muhadjir
Netral,2019,mendikbud jakarta penuh syarat terap ppdb zonasi penuh mendikbud muhadjir
Netral,2019,smk jakarta pusat ppdb nyimas
Netral,2019,umum hasil ppdb madrasah man daerah khusus ibukota jakarta
Positif,2019,banyakin sekolah mbak sekolah negeri rata jakarta jawa barat cek ppdb online jawa barat cek sekolah kah negeri depok gampang cari mall banding sman
Positif,2019,ppdb daerah khusus ibukota jakarta selamat terima sekolah negeri terima putus asa admin hibernasi jelang ppdb selamat semangat
Positif,2019,alas tulis status pajang foto presiden kagum ppdb daerah khusus ibukota
Positif,2019,tuju kemarin coba advokasi bijak ppdb alhamdulillah jakarta daerah coba diskusi baik paud kait konstruksi disdik paham konstruksi desain ramah anak
Positif,2019,moga evaluasi atur ppdb jadi jakarta contoh sukses terap daerah evaluasi mohon copot mendikbudnya
Positif,2019,jakarta pimpin terima siswa alias ppdb ribet pakai antri jam pagi syarat daftar sekolah pakai nilai un pakai meter wali murid terima kasih anies
Positif,2019,sistem ppdb daerah khusus ibukota jakarta bijaksana akomodatif salur aspirasi warga didik adil layak perhati imbang lingkung kota duduk
Positif,2019,ppdb daerah khusus ibukota jakarta model
Positif,2019,dibantuin admin fast respon masa ppdb jakarta non daerah khusus ibukota banget jasa informasi masa genting ppdb bantu didoain berkah murah rezeki ketemu jodoh temu baik terima kasihbanyak min
Positif,2019,khawatir bayang orangtua siswa zonasi sirna banyak keluh muncul proses ppdb benar sistem zonasi sekolah negeri jakarta adil
Positif,2019,ppdb tingkat smp daerah khusus ibukota jakarta jalur non zonasi buka selasa kamis besok warganet baik
Positif,2019,ppdb tingkat smp daerah khusus ibukota jakarta jalur non zonasi buka selasa kamis besok warganet baik
Positif,2019,lancar ppdb jakarta gagas anies rujuk swamedium
Positif,2019,lancar ppdb jakarta gagas anies rujuk swamedium
Positif,2019,opini ppdb jakarta fair transparan
Positif,2019,lancar fahira idris ppdb jakarta rujuk kota
Positif,2019,lancar ppdb jakarta rujuk kota
Positif,2019,lancar ppdb jakarta rujuk kota
Positif,2019,lancar ppdb jakarta rujuk kota
Positif,2019,lancar ppdb jakarta rujuk kota
Positif,2019,ppdb jakarta nilai rujuk baca
Positif,2019,kepala dinas didik kadisdik daerah khusus ibukota jakarta ratiyono nilai terap sistem zonasi sekolah terima serta didik ppdb jakarta adil
Positif,2019,contoh unbk simulasi tes ppdb cbt mtsn jakarta
Positif,2019,kadisdik daerah khusus ibukota klaim terap zonasi ppdb jakarta adil
Positif,2019,kadisdik daerah khusus ibukota klaim terap zonasi ppdb jakarta adil
Positif,2019,kadisdik daerah khusus ibukota jakarta nilai terap sistem zonasi sekolah ppdb jakarta adi
Positif,2019,kepala dinas didik kadisdik daerah khusus ibukota jakarta ratiyono nilai terap sistem zonasi sekolah terima serta didik ppdb jakarta adil
Positif,2019,lancar ppdb jakarta gagas anies rujuk
Positif,2019,sman kabupaten tangerang sperti sman jakarta sistem ppdb zonasi timbang nilai un peringkat terima perata nama
Positif,2019,ular antre ppdb jakarta kondusif
Positif,2019,dukung terap sistem zonasi ppdb wali murid peluang terima sekolah unggul
Positif,2019,heboh ppdb online jakarta anteng untung online ubah daerah jalur ppdb amp zonasi nem patok
Positif,2019,jawa barat jakarta ppdb harga nilai un simpel umum terima hari daftar
Positif,2019,ppdb jawa barat jalur zonasi umum nya minggu daftar juni umum juni ppdb jakarta jalur zonasi umum langsung pas daftar rentang nya jam
Positif,2019,terima jakarta buka ppdb senin ko jakarta gamake point jarak kola salah terima sekolah jakarta pakai jalur daerah
Positif,2019,tuju min dukung admin seleksi pakai nilai un dengar panas gara gara nemnya tertawa bagus job ppdb jakarta
Positif,2019,laksana terima serta didik ppdb daerah khusus ibukota jakarta jalan kondusif fsgi kemendikbud contoh perintah provinsi daerah khusus ibukota jakarta terap sistem zonasi ppdb alam teman teman urus
Positif,2019,ooh jakarta kayak iya bagus deh lihat klasmen ppdb jawa barat lucu dirankingin dasar jarak sih pakai nilai slot kursi dikit
Positif,2019,ppdb daerah khusus ibukota jakarta kuota besar hasil un metoda seleksi tangerang acu kah daerah khusus ibukota jakarta sistem serang lebak pandeglang hasil un bawah nasional
Positif,2019,ppdb daerah khusus ibukota jakarta anggap contoh
Positif,2019,warga apresiasi laksana ppdb online jalur inklusi jakarta
Positif,2019,warga lurah rawa badak selatan koja jakarta utara apresiasi jalur inklusi terima serta didik ppdb online calon ajar tingkat sd smk
Negatif,2020,maaf bos dbl founder tidak ada uang surabaya merdeka bos hahay sukarno lahir jakarta kota lahir umur si ppdb pakai umur niat sekolah tertawa
Negatif,2020,kadisdik daerah khusus ibukota jakarta blunder ramai kemarin blunder ppdb uji suka banget iya blunder tidur nyenyak viral telusur maksud uji
Negatif,2020,fix nder ppdb jakarta pental melulu
Negatif,2020,sempat sepuh nad
Negatif,2020,akibat kerja patung masker in atap rumah warga fly over tapal kuda cat ganjil genap motor laku ppdb jakarta umur acu
Negatif,2020,gubernur anies baswedan disdik daerah khusus ibukota jakarta gugat kah ptun daerah khusus ibukota ppdb ppdb daerah khusus ibukota seleksi usia langgar atur kemendikbud
Negatif,2020,orang tua murid masuk gugat perintah provinsi daerah khusus ibukota jakarta kah ptun jakarta terap syarat diskriminatif ppdb online rugi langsung didik mutu siswa murid joi
Negatif,2020,sosialisasi buruk
Negatif,2020,sosialisasi buruk
Negatif,2020,sosialisasi buruk
Negatif,2020,sosialisasi buruk
Negatif,2020,sosialisasi buruk
Negatif,2020,sosialisasi buruk
Negatif,2020,sosialisasi buruk
Negatif,2020,sosialisasi buruk
Negatif,2020,sosialisasi buruk
Negatif,2020,sosialisasi buruk
Negatif,2020,sosialisasi buruk
Negatif,2020,ppdb jakarta kemarin amburadul orang tua demo masak daftarin sekolah timbang umur koreksi ngomingin nadiem
Negatif,2020,anis pandai retorika minim kerja bijak iya rugi rakyat jakarta nyata penyelengara ppdb online amburadul macet akibat terap zonasi fake klubada polemik akibat bijak anis kabur mana
Negatif,2020,orang tua murid adu proses administrasi ppdb online daerah khusus ibukota jakarta
Negatif,2020,fakta ppdb jakarta anarkis batal
Negatif,2020,anak kemarin sore wkwkakak lomba tua an asa ppdb jakarta
Negatif,2020,reklamasi anies luas massa elemen unjuk balai kota jakarta protes reklamasi ancol ppdb daerah khusus ibukota
Negatif,2020,nonton berita ppdb daerah khusus ibukota jakarta masalah iya
Negatif,2020,demo iya nis kait ppdb daerah khusus ibukota jakarta solusi nis dokem
Negatif,2020,sadar laksana terima serta didik ppdb tinggal jakarta terima lapor ratus siswa daftar sekolah ancam putus sekolah
Negatif,2020,ajar raih ratus harga aristawidya maheswari oleh tawar lanjut didik sekolah swasta jakarta gagal lolos seleksi negeri
Negatif,2020,kritik anies ppdb reklamasi presidium barometer jakarta gelar aksi demonstrasi
Negatif,2020,maksud kang kemarin ppdb jakarta jatah khusus anak nakes tangan covid kasih siswa beda jawa barat jateng
Negatif,2020,komisi lindung anak indonesia komisi lindung anak indonesia sebut siswa lolos terima serta didik ppdb daerah khusus ibukota jakarta kisruh syarat usia baca lengkap
Negatif,2020,kids heboh berita siswi nama aristawdya maheswari siswi umur hasil milik piala harga gagal terima negeri jakarta seleksi terima serta didik ppdb
Negatif,2020,ppdb zonasi hujan kritik ribu kursi kosong sekolah jakarta isi
Negatif,2020,terap sistem ppdb zonasi diknas daerah khusus ibukota hitung sosialisasi sistem enak kursi kosong smp kursi kosong jual belikan loh iya apalg sekolah favorit jakarta
Negatif,2020,dinas didik daerah khusus ibukota jakarta buka ppdb daerah khusus ibukota sosialisasi
Negatif,2020,lembaga swadaya masyarakat gmbi daerah khusus ibukota jakarta tuntut gubernur daerah khusus ibukota jakarta ppdb cabut
Negatif,2020,swasta campur bang wali murid rebut cari sekolah negeri ppdb jakarta kemarin gratis spp dan lain buku pinjam sekolah swasta pindah kah negeri gratis iya seleksi kacau
Negatif,2020,kritisi sistem ppdb kacau tambah model zonasi parah jakarta pakai sistem umur sekolah sama kasi anak pintar sekolah dukung halo
Negatif,2020,bijak normalisasi sungai jakarta formula monas korban pohon mahoni tangan covid bantu korban dampak pandemi ambur adul ppdb korban anak prestasi ketidakmampuanmu anies baswedan
Negatif,2020,orang dendam nyesel kecewa kadang kecewa ppdb zonasi pakai umur oktober harap japres anak negeri kalah swasta masuk smp netapin masuk sman jakarta sekolah
Negatif,2020,habis fikir kenal orang model emak misuh anak terima sekolah negeri gara atur ppdb jakarta disalahin mendikbud
Negatif,2020,iyaa pindah kerja kah januari dsah malas ppdb jakarta kah ambon huhu
Negatif,2020,lihat ppdb jakarta muda nya salah nyoba jakarta anjing auto swasta
Negatif,2020,tidak tahu lelah banget ppdb jakarta
Negatif,2020,jakarta ppdb umur daftar
Negatif,2020,gubernur covid konpres melulu ppdb jakarta diam kotor
Negatif,2020,kad didik daerah khusus ibukota jakarta bijak ppdb batas usia akibat orang tua pusingg cari uang daftar anak sekolah swasta konyoll
Negatif,2020,rencana perintah daerah khusus ibukota jakarta anak gagal terima ppdb ortunya sanggup daftar kah sekolah swasta mihil bagamana
Negatif,2020,moga orang biaya unt lanjut skolah iya adik lolos ppdb jakarta ajar raih ratus harga putus sekolah
Negatif,2020,iya dewan wakil rakyat daerah daerah khusus ibukota jakarta diam ribu bahasa orang tua siswa rugi susah atur usia ppdb daerah khusus ibukota jakarta kepala dinas didik anehh wakil rakyat kampanye saudara laki aku aku juang rakyat kasihan deh
Netral,2020,jakarta indonesia
Netral,2020,tambah anggar bos susul banyak siswa daerah khusus ibukota jakarta dampak pandemi covid sistem ppdb
Netral,2020,
