klasifikasi,tahun,Text_bersih
Negatif,2018,jakarta penerapan sistem zonasi sekolah penerimaan peserta didik ppdb berbuntut daerah orangtua mendaftarkan anak anaknya kah
Negatif,2018,jakarta dipikirin demo ppdb pakai sistem zona hubungannya svt coba
Negatif,2018,jalur afirmasi jakarta dibuktikan rekening bank calon siswa penerima kjp membawa sktm bersaing nilai penerima kjp ndaftar tersingkir kah sekolah swasta terima siswa pengumuman ppdb
Negatif,2018,pengumuman bangku kosong tahap jalur domisili daerah khusus ibukota jakarta tingkat diakses ppdb online min jadwal tanggal juli wib cari web ppdb
Negatif,2018,ppdb provinsi jateng diulas jalur afirmasi kjp jakarta tahap dibatasi maksimal orang sekolah kesalahan prosedur
Negatif,2018,ppdb online jakarta mas diterima jalur afirmasi penerima kjp nilainya banget masuk favorit nem dibawah masuk smtr anakku jurusan
Negatif,2018,protes terkait rumitnya proses ppdb daerah khusus ibukota jakarta sosialisasi pendaftaran
Negatif,2018,protes terkait rumitnya proses ppdb daerah khusus ibukota jakarta sosialisasi pendaftaran
Negatif,2018,protes terkait rumitnya proses ppdb daerah khusus ibukota jakarta wali murid memprotes sosialisasi pendaftaran keluhannya
Negatif,2018,memperjuangkan nilai anak kesulitan ditambah zonasi terbuka wilayah jatinegara nyata jakarta timur dimana letak keadilan putra putri mohon ppdb online lokal tertutup berharap
Negatif,2018,pengalaman ppdb daerah khusus ibukota iya konon daerah sehat prakteknya mengukur jarak alamat sesuai kakak kah sekolah pertimbangan daerah khusus ibukota angka usia belajar kah praktek ppdb jakarta
Negatif,2018,nilai un kali revisi ppdb online disii jakarta timur zona lokal jakarta selatan meliputi jakarta timur
Negatif,2018,smk jakarta terdaftar ppdb online dibeberapa jurusan tercantum syarat badan salah contohnya jurusan bisnis daring pemasaran sayang kesempatan masuk jurusan terkendala badan
Negatif,2018,mohon dievaluasi sistem ppdb smp daerah khusus ibukota warga daerah khusus ibukota sekolah daerah khusus ibukota jakarta selatan fair kondisi pendaftar sekolah daerah khusus ibukota mengikuti seleksi kondisi hasil usbn daerah khusus ibukota nilainya
Negatif,2018,mohon dievaluasi sistem ppdb smp daerah khusus ibukota warga daerah khusus ibukota sekolah daerah khusus ibukota jakarta selatan fair kondisi pendaftar sekolah daerah khusus ibukota mengikuti seleksi kondisi hasil usbn daerah khusus ibukota nilainya
Negatif,2018,mohon dievaluasi sistem ppdb smp daerah khusus ibukota warga daerah khusus ibukota sekolah daerah khusus ibukota jakarta selatan fair kondisi pendaftar sekolah daerah khusus ibukota mengikuti seleksi kondisi hasil usbn daerah khusus ibukota nilainya
Negatif,2018,pendaftaran ppdb bikin bingung kepala sekolah sman jakarta
Negatif,2018,jarak komponen dihitung ppdb daerah khusus ibukota siswa daerah khusus ibukota berbondong mendaftar kah fav letaknya kota jakarta nilai menentu rumah papua
Negatif,2018,jalur kota ppdb daerah khusus ibukota sekolah berbatasan kota menembus batas zonasi banget anak jakarta dibatasi zonasi kasian anak jakartanya
Negatif,2018,permendikbud mengatur zonasi minimal ppdb jakarta menerapkan lokal nilai un diutamakan
Netral,2018,come and join us at ppdb smk telekomunikasi jakarta smk telekomunikasi jakarta sekolah keren menerapkan budaya redi ccp character content process berbasis gitu olah raga
Netral,2018,come and join us ppdb smk telekomunikasi jakarta smk telekomunikasi jakarta sekolah keren menerapkan budaya redi ccp character content process berbasis gitu olah raga
Netral,2018,promosi ppdb tiada henti silaturahmi promosi kah mts smpn disambut hangat kepala sekolah waka siswa siswi smp mts antusias smk telekomunikasi jakarta sekolah
Netral,2018,ngobrol lulus now what kah jakarta stay disana tdnya jakarta gajadi tertawa eh pas jakarta haris menghubungi kabar perkembangan ppdb
Netral,2018,pendaftaran ppdb pelajaran dibuka gelombang ayo daftar ikuti jalurnya hafizh qur an sd muhammadiyah jakarta tempatnya informasi
Netral,2018,passing grade hasil ppdb smk daerah khusus ibukota jakarta
Netral,2018,informasi ppdb menghubungi telepon hunting extension sd smp smk smk
Netral,2018,ppdb sdn daerah khusus ibukota jakarta sertakan kia
Netral,2018,ppdb sdn daerah khusus ibukota jakarta sertakan kia
Netral,2018,ppdb sd daerah khusus ibukota jakarta pakai kartu identitas anak
Netral,2018,selamat sore admin publik mengunduh database arsip ppdb daerah khusus ibukota jakarta
Netral,2018,team ppdb persentasi smpn antusias siswa siswi smpn smk telekomunikasi jakarta sekolah keren menerapkan budaya redi ccp character content process berbasis gitu
Netral,2018,team ppdb persentasi smpn antusias siswa siswi smpn smk telekomunikasi jakarta sekolah keren menerapkan budaya redi ccp character content
Netral,2018,kepala dinas pendidikan kebudayaan tangsel bantah korupsi terkait ppdb simpetas
Netral,2018,kepala dinas pendidikan kebudayaan tangsel bantah korupsi terkait ppdb simpetas
Netral,2018,passing grade hasil ppdb smk daerah khusus ibukota jakarta blog
Netral,2018,online jakarta diminati calon siswa smp
Netral,2018,passing grade hasil ppdb daerah khusus ibukota jakarta blog
Netral,2018,meeting staff gama school perencanaan pembukaan ppdb siswa jalan alur laut rawabadak koja jakarta utara daerah khusus ibukota jakarta indonesia
Netral,2018,presentasi kah mts asy syukriyyah tim ppdb smk telekomunikasi jakarta sekolah keren menerapkan budaya redi ccp character content process berbasis gitu olah raga olah olah rasio
Netral,2018,presentasi kah mts asy syukriyyah tim ppdb smk telekomunikasi jakarta sekolah keren menerapkan budaya redi ccp character content process berbasis gitu olah raga
Netral,2018,ppdb ta smk sint joseph jakarta
Netral,2018,ujian saringan masuk ppdb smk telekomunikasi jakarta tahap rangka menjaga kualitas tahapan ujian meliputi tes akademis psikotes wawancara sekolah keren
Netral,2018,passing grade hasil ppdb smp daerah khusus ibukota jakarta blog
Netral,2018,video kah playlist motion graphic ppdb daerah khusus ibukota karya smk jakarta multimedia
Netral,2018,kabid smp disdikbud tangsel kendala pendaftaran ppdb tribun jakarta
Netral,2018,pendaftaran gelombang dibuka mari bergabung
Netral,2018,informasi ppdb sds regina pacis jakarta
Netral,2018,ppdb smk telekomunikasi jakarta penerimaan peserta didik ta dibuka informasi smk telekomunikasi school jakarta
Netral,2018,ombudsman perwakilan jakarta raya menemukan dugaan pelanggaran maladministrasi penerimaan peserta didik ppdb online bogor depok bekasi
Netral,2018,informasi pendaftaran ppdb smk telekomunikasi jakarta ta keterangan silahkan hubungi petugas ppdb nomor nomor prosedur
Positif,2018,puji tuhan si bontot tulis wag keluarga guise sosyel all the way hasil pengumuman ppdb st ursula jakarta anak sos is coming from the hartantos adikmu alamat twtitter opo sih
Positif,2018,radar bogor sleman apresiasi ppdb sistem zonasi jakarta radar bogor men
Positif,2018,dilayani denga posko ppdb online daerah khusus ibukota jakarta admin memantau proses pelayanan posko
Positif,2018,admin memantau kunjungan gubernur daerah khusus ibukota jakarta posko ppdb online daerah khusus ibukota jakarta alhamdulillah ppdb daerah khusus ibukota jakarta berjalan lancar aman terkendali
Positif,2018,ppdb online smpn kota bekasi aktif update nya jul wib update jakarta loh update menit
Positif,2018,ppdb smp online kabupaten bekasi dipaksakan tetangga kota bekasi jakarta lancar informatif update
Positif,2018,iya webnya minim informasi bandingkan web
Positif,2018,kartu jakarta pintar ngotot daftar ppdb online diterima gamungkin papa mama ngalangin sekolah ngotot kerja jualan kue sekolah bantu kantin kerja partime waiter
Positif,2018,alhamdulillah ppdb negeri tahap selesai yartika diterima negeri jakarta
Positif,2018,sore jam ppdb jakarta tahap jalur lokal sman ditutup dinyatakan kandidatnya terima keren proses seleksinya
Positif,2018,ppdb penerimaan peserta didik online salah prestasi riil beliau gubernur daerah khusus ibukota jakarta pelaksanaan ppdb online bagus amp pungli sayang ppdb online gratis terlaksana daerah daerah khusus ibukota
Positif,2018,enak banget ppdb jakarta apakabar negeri diitung jari
Positif,2018,overload servernya tenggang diperpanjang jakarta bagus ppdb
Positif,2018,penjelasan pemerintah daerah jakarta berkomitmen anak imunisasi pemerintah daerah anak gagal sekolah imunisasi ppdb screening riwayat calon murid jalan
Negatif,2019,presiden terbaik seumur hidupku iya ppdb daerah khusus ibukota jakarta provinsi indonesia pakai sistem zonasi kasihan sekolah dinegri kebijakan jokowi sekolah gratis
Negatif,2019,iya ppdb daerah khusus ibukota jakarta provinsi indonesia pakai sistem zonasi kasihan sekolah dinegri kebijakan jokowi yaitus sekolah gratis
Negatif,2019,iya rekapin hasil ppdb jakarta bocahnya kelas hahaha
Negatif,2019,ombudsman sesalkan daerah khusus ibukota jakarta terapkan ppdb zonasi
Negatif,2019,ombudsman sesalkan daerah khusus ibukota jakarta terapkan ppdb zonasi
Negatif,2019,ombudsman sesalkan daerah khusus ibukota jakarta terapkan ppdb zonasi
Negatif,2019,anaknya ikutan ppdb sekolah negeri emak emaknya dag dig dug memantau pergerakan hasil seleksi kayak pergerakan harga saham jakarta seleksi berdasar nilai un berbeda daerah mengutamakan jarak rumah
Negatif,2019,celah dizonasi asli tetapi palsu versi ppdb online perpindahan orang tua wali dicermati kakak jakarta sekolah semarang masuk akalkan disemarang kecuali sekolah smp jakarta
Negatif,2019,dear admin jadwalnya ppdb smp non zonasi daftarkan anak iya error warning jalur diperuntukkan cpd domisili propinsi daerah khusus ibukota jakarta domisili daerah khusus ibukota mohon bantuannya
Negatif,2019,dewan perwakilan rakyat kritisi praktik manipulasi domisili zonasi ppdb jakarta edunews id pelaksanaan penerimaan peserta didik ppdb mekanisme zonasi membuka ruang praktik manipulasi domisili pelaksanaan ppdb diawasi dievaluasi
Negatif,2019,timbulkan polemik sistem zonasi ppdb meredam kerisuhan peneliti center for indonesian policy studies pemerintah menghapuskan stigma sekolah favorit sekolah non favorit jakarta mediamerdeka co pemerintah mengevaluasi
Negatif,2019,suka sistem ppdb memprioritaskan zonasi ngerasa adil kartu keluarga jakarta pindah kakak
Negatif,2019,ombudsman menilai pemerintah provinsi daerah khusus ibukota jakarta maladministrasi terkait ppdb
Negatif,2019,kah posko ppdb jakarta timur penerima kjp daftar zonasi afirmasi infonya data dukcapil amp sistem zonasi sinkron tolong admin penjelasan nya
Negatif,2019,petunjuk teknis ppdb jakarta jakarta mengutamakan sistem zonasi diatur permendikbud
Negatif,2019,ombudsman daerah khusus ibukota jakarta lakukan maladministrasi ppdb
Negatif,2019,posko ppdb jakarta selatan berpusat sman kebayoran ramai dikunjungi orang tua murid orang tua murid mengeluhkan perbedaan data nik verifikasi data tahapan pendaftaran ppdb online jalur zonasi
Negatif,2019,dinilai bohongan kadisdik daerah khusus ibukota ppdb sistem zonasi jakarta adil
Negatif,2019,oohh pendaftaran ppdb jakarta goodluck iya proses pendaftaran sekolah ngomong-ngomong disekolah kampus berprestasi ranking menang lomba ipk nya huahaha doong
Negatif,2019,oohh pendaftaran ppdb jakarta goodluck iya proses pendaftaran sekolah ngomong-ngomong disekolah kampus berprestasi ranking menang lomba ipk nya huahaha doong
Negatif,2019,oohh pendaftaran ppdb jakarta goodluck iya proses pendaftaran sekolah ngomong-ngomong disekolah kampus berprestasi ranking menang lomba ipk nya huahaha doong
Negatif,2019,oohh pendaftaran ppdb jakarta goodluck iya proses pendaftaran sekolah ngomong-ngomong disekolah kampus berprestasi ranking menang lomba ipk nya huahaha doong
Negatif,2019,oohh pendaftaran ppdb jakarta goodluck iya proses pendaftaran sekolah ngomong-ngomong disekolah kampus berprestasi ranking menang lomba ipk nya huahaha doong
Negatif,2019,oohh pendaftaran ppdb jakarta goodluck iya proses pendaftaran sekolah ngomong-ngomong disekolah kampus berprestasi ranking menang lomba ipk nya huahaha doong
Negatif,2019,jarak memisahkan fergusoo nikah sesuai zonasi zona kelurahan cimahi cimtizen
Negatif,2019,membicarakan ppdb berhubung jujur sih mengerti sistemnya sih sistem daerah khusus ibukota berbeda sistem daerah daerah zonasi mempedulikan nem jakarta main nem
Negatif,2019,merengking ppdb online daerah khusus ibukota jakarta memenuhi aturan keterangan gambar nilai inisial siswa nilai inisial siswa seleksi tayang online inisial tayang
Negatif,2019,pindah domisili lolos sistem zonasi ppdb jakarta sia sia
Negatif,2019,frustrasi ppdb jakarta
Negatif,2019,mohon dipantau pelaksanaan ppdb daerah khusus ibukota jakarta menitik beratkan nilai un langsung sman perkirakan merata daerah khusus ibukota sistem zonasi keadilan pemerataan kwalitas pendidikan
Negatif,2019,setauku iya pas daftar adik sekolah zonasi jakarta nem nya berlaku sekolahnya dipilihin orang ppdb nya rumah kecamatan gambir iya sekolahnya bisanya daerah situ kah kecamatan cawang gituu saingannya pakai nem
Negatif,2019,ppdb daerah khusus ibukota jakarta kacau sekolah
Negatif,2019,to admin maaf sistem zonasi seleksi masuk ppdb sman jakarta barat berdasarkan jarak rumah kah selokah tujuan terdekat grading by nilai tertinggi orang tua murid sistem zonasi ttpby nilai
Negatif,2019,ppdb jalur zonasi jakarta diwarnai keluhan pelayanan
Negatif,2019,ppdb online si sulung jakarta timur lancar pendaftaran jalur jalur sekecamatan prestasi antri sesuai nomor masuk input nilai verifikasi tinggal tunggu real time anak masuk horror iya
Negatif,2019,orang tua keluhkan proses ppdb sistem zonasi jakarta
Negatif,2019,case anak istri tinggal semarang anak sekolah sd semarang kakak jakarta kesempatan daftar ppdb lebih baik kesempatan daftar kalah dipenyisihan nilainya fair
Negatif,2019,notice besok ppdb jakarta dibuka zonasi dihapus ppdb ulang nilai bagus mati matian belajar keluarin uang hasilnya bodoh lebih baik tidak perlu sekolah biar pendidikan indonesia bobrok
Negatif,2019,ganti model ppdb bingung orang pandai jakarta dunia pendidikan uji coba sistem ayo kah bimbingan ki dewantoro
Negatif,2019,orangtua murid nilai sistem zonasi ppdb adil
Netral,2019,pengantaran prakerin jakarta ppdb dibuka pendfataran
Netral,2019,smp muhammadiyah jakarta jalan tebet timur ii nomor tebet jakarta selatan jakarta selatan informasi penerimaan peserta didik ppdb pelajaran smp muh
Netral,2019,besok juni ppdb madrasah daerah khusus ibukota jakarta diumumkan
Netral,2019,prestasi simak mendaftar ppdb daerah khusus ibukota jakarta jalur prestasi
Netral,2019,prestasi simak mendaftar ppdb daerah khusus ibukota jakarta jalur prestasi
Netral,2019,syarat lengkap ppdb online jenjang smp daerah khusus ibukota jakarta
Netral,2019,besok juni ppdb madrasah daerah khusus ibukota jakarta diumumkan
Netral,2019,smp muhammadiyah jakarta jalan tebet timur ii nomor tebet jakarta selatan jakarta selatan informasi penerimaan peserta didik ppdb pelajaran smp muh
Netral,2019,pendaftaran ppdb online sd provinsi daerah khusus ibukota jakarta
Netral,2019,simak ketentuan jadwal jalur zonasi ppdb daerah khusus ibukota jakarta
Netral,2019,hasil ppdb madrasah man daerah khusus ibukota jakarta diumumkan cek
Netral,2019,ppdb smk santa theresia jakarta
Netral,2019,passing grade hasil ppdb smp daerah khusus ibukota jakarta
Netral,2019,jurusan bahasa ppdb daerah khusus ibukota jakarta
Netral,2019,prestasi simak mendaftar ppdb daerah khusus ibukota jakarta jalur prestasi
Netral,2019,hasil ppdb madrasah man daerah khusus ibukota jakarta diumumkan cek
Netral,2019,besok juni ppdb madrasah daerah khusus ibukota jakarta diumumkan
Netral,2019,syarat lengkap ppdb online jenjang smp daerah khusus ibukota jakarta
Netral,2019,informasi traffic management center tmc kepolisian daerah metropolitan jaya pagi tercatat melaporkan aksinya aliansi parlemen jalanan srmi lmnd fnpbi ppdb spartan seniman jakarta papernas iisip dan lain-lain tua maunya disuapin
Netral,2019,syarat lengkap ppdb online jenjang smp daerah khusus ibukota jakarta
Netral,2019,dibilangin pindah kah jakarta mbak rinrin riweuh melulu ppdb
Netral,2019,passing grade hasil ppdb daerah khusus ibukota jakarta blog
Netral,2019,mari bergabung generasi generasi qur ani
Netral,2019,teman teman sekolah charitas jakarta buka ppdb pemelajaran ayo mendaftar ketinggalan informasi sekolah email yayasan
Netral,2019,ppdb smk santa theresia jakarta pelajaran
Netral,2019,jakarta kamis komisi perlindungan anak indonesia menyelenggarakan rapat koordinasi hasil pengawasan penerimaan peserta didik ppdb
Netral,2019,rencana pengumuman ppdb smp daerah khusus ibukota jakarta
Netral,2019,ppdb pelajaran katolik sang timur jakarta
Netral,2019,ppdb sd santa theresia jakarta
Netral,2019,ppdb kb santa theresia jakarta
Netral,2019,bincang publik ombudsman ri perwakilan jakarta raya sengkarut penyelenggaraan ppdb interaktif fm amp streaming
Netral,2019,muhadjir effendy menyebut sekolah daerah khusus ibukota jakarta memenuhi syarat menerapkan penerimaan peserta didik ppdb berbasis zonasi penuh
Netral,2019,mendikbud jakarta penuhi syarat terapkan ppdb zonasi penuh mendikbud muhadjir
Netral,2019,mendikbud jakarta penuhi syarat terapkan ppdb zonasi penuh mendikbud muhadjir
Netral,2019,mendikbud jakarta penuhi syarat terapkan ppdb zonasi penuh mendikbud muhadjir
Netral,2019,mendikbud jakarta penuhi syarat terapkan ppdb zonasi penuh mendikbud muhadjir
Netral,2019,mendikbud jakarta penuhi syarat terapkan ppdb zonasi penuh mendikbud muhadjir
Netral,2019,mendikbud jakarta penuhi syarat terapkan ppdb zonasi penuh mendikbud muhadjir
Netral,2019,smk jakarta pusat ppdb nyimas
Netral,2019,pengumuman hasil ppdb madrasah man daerah khusus ibukota jakarta
Positif,2019,banyakin sekolahnya mbak sekolah negeri merata jakarta jawa barat cek ppdb online jawa barat cek menyekolahkan kah negeri depok gampang mencari mall dibanding sman
Positif,2019,ppdb daerah khusus ibukota jakarta selamat diterima sekolah negeri diterima putus asa admin hibernasi menjelang ppdb selamat semangat
Positif,2019,alasan penulis status pajang foto presiden kagum ppdb daerah khusus ibukota
Positif,2019,setuju kemarin coba advokasi kebijakan ppdb alhamdulillah jakarta daerah coba diskusi perbaikan paud terkait konstruksi disdik paham konstruksi desain ramah anak
Positif,2019,semoga mengevaluasi aturan ppdb jadikan jakarta percontohan sukses terapkan daerah evaluasi mohon copot mendikbudnya
Positif,2019,jakarta dipimpin penerimaan siswa alias ppdb ribet pakai antri jam pagi syarat daftar sekolah pakai nilai un pakai meteran wali murid terima kasih anies
Positif,2019,sistem ppdb daerah khusus ibukota jakarta bijaksana akomodatif menyalurkan aspirasi warganya pendidikan adil layak memperhatikan keseimbangan lingkungan kota penduduk
Positif,2019,ppdb daerah khusus ibukota jakarta model
Positif,2019,dibantuin admin fast respon dimasa ppdb jakarta non daerah khusus ibukota banget jasa informasinya dimasa genting ppdb terbantu didoain berkah murah rezeki ketemu jodoh dipertemukan terbaik terima kasihbanyak min
Positif,2019,kekhawatiran membayangi orangtua siswa zonasi sirna banyaknya keluhan muncul proses ppdb benarkan sistem zonasi sekolah negeri jakarta adil
Positif,2019,ppdb tingkat smp daerah khusus ibukota jakarta jalur non zonasi dibuka selasa kamis besok warganet diperbaiki
Positif,2019,ppdb tingkat smp daerah khusus ibukota jakarta jalur non zonasi dibuka selasa kamis besok warganet diperbaiki
Positif,2019,lancar ppdb jakarta digagas anies rujukan swamedium
Positif,2019,lancar ppdb jakarta digagas anies rujukan swamedium
Positif,2019,opini ppdb jakarta fair transparan
Positif,2019,lancar fahira idris ppdb jakarta rujukan kota
Positif,2019,lancar ppdb jakarta rujukan kota
Positif,2019,lancar ppdb jakarta rujukan kota
Positif,2019,lancar ppdb jakarta rujukan kota
Positif,2019,lancar ppdb jakarta rujukan kota
Positif,2019,ppdb jakarta dinilai rujukan baca
Positif,2019,kepala dinas pendidikan kadisdik daerah khusus ibukota jakarta ratiyono menilai penerapan sistem zonasi sekolah penerimaan peserta didik ppdb jakarta adil
Positif,2019,contoh unbk simulasi tes ppdb cbt mtsn jakarta
Positif,2019,kadisdik daerah khusus ibukota klaim penerapan zonasi ppdb jakarta adil
Positif,2019,kadisdik daerah khusus ibukota klaim penerapan zonasi ppdb jakarta adil
Positif,2019,kadisdik daerah khusus ibukota jakarta menilai penerapan sistem zonasi sekolah ppdb jakarta adi
Positif,2019,kepala dinas pendidikan kadisdik daerah khusus ibukota jakarta ratiyono menilai penerapan sistem zonasi sekolah penerimaan peserta didik ppdb jakarta adil
Positif,2019,lancar ppdb jakarta digagas anies rujukan
Positif,2019,sman kabupaten tangerang sperti sman jakarta sistem ppdb zonasi mempertimbangkan nilai un peringkat penerimaan pemerataan namanya
Positif,2019,mengular antrean ppdb jakarta kondusif
Positif,2019,dukung penerapan sistem zonasi ppdb wali murid peluang diterima sekolah unggulan
Positif,2019,heboh ppdb online jakarta anteng untungnya online perubahan daerah jalur ppdb amp zonasi nem patokannya
Positif,2019,jawa barat jakarta ppdb menghargai nilai un simpel pengumuman penerimaan sehari pendaftaran
Positif,2019,ppdb jawa barat jalur zonasi pengumuman nya semingguan pendaftaran juni pengumuman juni ppdb jakarta jalur zonasi pengumuman langsung pas pendaftaran rentang nya jam
Positif,2019,keterima jakarta buka ppdb senin ko jakarta gamake point jarak sekola salah keterima sekolah jakarta pakai jalur daerah
Positif,2019,setuju min dukung admin menyeleksi pakai nilai un dengarkan kepanasan gara gara nemnya tertawa bagus job ppdb jakarta
Positif,2019,pelaksanaan penerimaan peserta didik ppdb daerah khusus ibukota jakarta berjalan kondusif fsgi kemendikbud mencontoh pemerintah provinsi daerah khusus ibukota jakarta penerapan sistem zonasi ppdb pengalaman teman teman mengurus
Positif,2019,ooh jakarta kayak iya bagus deh lihat klasmen ppdb jawa barat lucu dirankingin berdasarkan jarak sih pakai nilai slot kursinya dikit
Positif,2019,ppdb daerah khusus ibukota jakarta kuota terbesar hasil un metoda seleksinya tangerang mengacu kah daerah khusus ibukota jakarta sistem serang lebak pandeglang hasil un dibawah nasional
Positif,2019,ppdb daerah khusus ibukota jakarta dianggap dicontoh
Positif,2019,warga apresiasi pelaksanaan ppdb online jalur inklusi jakarta
Positif,2019,warga kelurahan rawa badak selatan koja jakarta utara mengapresiasi jalur inklusi penerimaan peserta didik ppdb online calon pelajar tingkat sd smk
Negatif,2020,maaf bos dbl founder tidak ada uang surabaya merdeka bos hahay sukarno lahir jakarta kota kelahiran umur si ppdb pakai umur niat sekolah tertawa
Negatif,2020,kadisdik daerah khusus ibukota jakarta blunder ramai kemarin blunder ppdb ujian suka banget iya blunder tidur nyenyak viral ditelusuri maksud ujian
Negatif,2020,fix nder ppdb jakarta kepental melulu
Negatif,2020,kesempatan sepuh nad
Negatif,2020,akibatnya kerja patung masker in atap rumah warga fly over tapal kuda cat ganjil genap motor diberlakukan ppdb jakarta umur acuan
Negatif,2020,gubernur anies baswedan disdik daerah khusus ibukota jakarta digugat kah ptun daerah khusus ibukota ppdb ppdb daerah khusus ibukota seleksi usia melanggar aturan kemendikbud
Negatif,2020,orang tua murid memasukkan gugatan pemerintah provinsi daerah khusus ibukota jakarta kah ptun jakarta menerapkan syarat diskriminatif ppdb online merugikan keberlangsungan pendidikan bermutu siswa murid joi
Negatif,2020,sosialisasi buruk
Negatif,2020,sosialisasi buruk
Negatif,2020,sosialisasi buruk
Negatif,2020,sosialisasi buruk
Negatif,2020,sosialisasi buruk
Negatif,2020,sosialisasi buruk
Negatif,2020,sosialisasi buruk
Negatif,2020,sosialisasi buruk
Negatif,2020,sosialisasi buruk
Negatif,2020,sosialisasi buruk
Negatif,2020,sosialisasi buruk
Negatif,2020,ppdb jakarta kemarin amburadul orang tua demo masak daftarin sekolah pertimbangan umur koreksi ngomingin nadiem
Negatif,2020,anis pandai retorika minim kinerja kebijakan iya merugikan rakyat jakarta nyata penyelengara ppdb online amburadul kemacetan akibat terapan zonasi fake klubada polemik akibat kebijakan anis kabur kemana
Negatif,2020,orang tua murid mengadukan proses administrasi ppdb online daerah khusus ibukota jakarta
Negatif,2020,fakta ppdb jakarta anarkis dibatalkan
Negatif,2020,anak kemarin sore wkwkakak lomba tua an berasa ppdb jakarta
Negatif,2020,reklamasi anies perluasan massa elemen berunjuk balai kota jakarta memprotes reklamasi ancol ppdb daerah khusus ibukota
Negatif,2020,nonton berita ppdb daerah khusus ibukota jakarta bermasalah iya
Negatif,2020,demo iya nis terkait ppdb daerah khusus ibukota jakarta solusinya nis dokem
Negatif,2020,sadar pelaksanaan penerimaan peserta didik ppdb meninggalkan jakarta menerima laporan ratusan siswa terdaftar sekolah terancam putus sekolah
Negatif,2020,pelajar peraih ratusan penghargaan aristawidya maheswari memperoleh tawaran melanjutkan pendidikan sekolah swasta jakarta gagal lolos seleksi negeri
Negatif,2020,kritik anies ppdb reklamasi presidium barometer jakarta gelar aksi demonstrasi
Negatif,2020,maksudnya kang kemarin ppdb jakarta jatah khusus anak nakes menangani covid dikasih siswa beda jawa barat jateng
Negatif,2020,komisi perlindungan anak indonesia komisi perlindungan anak indonesia menyebut siswa lolos penerimaan peserta didik ppdb daerah khusus ibukota jakarta kisruh syarat usia baca selengkapnya
Negatif,2020,kids heboh berita siswi bernama aristawdya maheswari siswi umur berhasil mememiliki piala perhargaan gagal diterima negeri jakarta seleksi penerimaan peserta didik ppdb
Negatif,2020,ppdb zonasi dihujani kritik ribuan kursi kosong sekolah jakarta terisi
Negatif,2020,menerapkan sistem ppdb zonasi diknas daerah khusus ibukota memperhitungkan mensosialisasikan sistem enak kursi kosong smp kursi kosong diperjual belikan loh iya apalg sekolah favorit jakarta
Negatif,2020,dinas pendidikan daerah khusus ibukota jakarta membuka ppdb daerah khusus ibukota sosialisasi
