klasifikasi,tahun,Text_bersih
Positif,2021,kjp lebih baik daftar tahap swasta biar kebagian sekolah swasta kosong ppdb jakarta
Positif,2021,orang tua saran ppdb jaminan masuk sekolah dituju beli rumah retweet rw sekolah dituju anaknya gapyear main sd smp bagus main
Positif,2021,kemarin sore mengunjungi posko ppdb penerimaan peserta didik sekolah sman jakarta penerimaan siswa berjalan lancar catatan aspirasi terima tindak kah dinas terkait
Positif,2021,jalur zonasi serumit sih makannya pas japres hantem an sekolah sekolah impian sekolah swasta sakit hati terima nilai masuk sekolah
Positif,2021,ppdb jakarta bagus kepantau calon peserta didiknya kudet sistem
Positif,2021,semangat ppdb jakarta seminggu kemarin ngurusin ppdb tidur alhamdulillah selesai
Positif,2021,diterima jakarta namanya daftar seleksi login ulang daftar pilihan sman zona nya muncul status diterima diterima diterima daftar semangat
Positif,2021,mbak jakarta usul jogja nemu kendala daftar sekolah langsung kah dinas pendidikan konsul disana diarahkan beres kecuali melanggar peraturan ppdb
Positif,2021,hai sekolah jakarta coba hubungi bberapa orang menolong anak kawan terancam sekolah tergusur ppdb daerah khusus ibukota merespon terimakasih iya
Positif,2021,memenuhi permintaan masyarakat psi jakarta membuka posko pelayanan ppdb titik daerah khusus ibukota jakarta
Positif,2021,ppdb jawa barat hasil seleksinya tidak bisa pantau ppdb jakarta iya
Positif,2021,hallo sahabatdisdik pemerintah provinsi daerah khusus ibukota jakarta program ppdb program dinas pendidikan provinsi daerah khusus ibukota jakarta berkolaborasi sekolah swasta meningkatkan daya tampung peserta didik meningkatkan kesetaraan mutu pendidikan
Positif,2021,hebat posko ppdb jakarta professional amp melayani masyarakat sungguh salut pindah kah jakarta pindah kknya genap setahun takut bingung daftar skolah
Positif,2021,ppdb jakarta bagus
Positif,2021,siang mengecek jalannya ppdb sman kemanggisan jakarta barat proses teratur dibanding catatan dioptimalkan kedepannya
Positif,2021,terima kasih kepercayaan warga memanfaatkan layanan posko ppdb psi jakarta ayo maanfaatkan layanan pendampingan pendaftaran ppdb online gratis cek thread informasi kontak lokasi layanan
Positif,2021,menemukan proses ppdb jakarta loh melaporkan kah kanal pengaduan milik pemerintah provinsi daerah khusus ibukota jakarta melapor permasalahan ppdb baca artikel iya
Positif,2021,deh kecewa sistemnya sumpah yaa doain iya kakak nyoba jalur zonasi keterima semangat menyerahh jalur okee always berdoa yaa love love
Positif,2021,kemarin mempersilakan cpdb meng update data sidanira membuka peluang siswa menginput data tambahan kepengurusan siswa osis ekskul siswa orang tua buru menghadap sekolah bawa bukti tambahan kepengurusan osis ekskul
Positif,2021,pemerintah daerah khusus ibukota jakarta menggandeng sekolah swasta menambah daya tampung calon siswa jalur afirmasi penerimaan peserta didik ppdb kerja diutamakan kelurahan memiliki sekolah
Positif,2021,keren anies beres menteri pendaftaran ppdb
Positif,2021,keren anies beres menteri pendaftaran ppdb
Positif,2021,jakarta update posko ppdb partai keadilan sejahtera pasar rebo bantu masyarakat
Positif,2021,keren anies beres menteri pendaftaran ppdb
Positif,2021,kriteria penilaian seleksi jalur prestasi ppdb daerah khusus ibukota jakarta silakan adik anggota keluarga sekolah dimotivasi
Positif,2021,komisi perlindungan anak indonesia ppdb daerah khusus ibukota jakarta libatkan sekolah swasta patut ditiru
Positif,2021,ppdb daerah khusus ibukota jakarta melibatkan sekolah swasta pilihan pendidikan calon siswa biaya spp siswa diterima digratiskan detikedu
Positif,2021,wakil gubernur daerah khusus ibukota ppdb online jakarta
Positif,2021,ppdb jakarta utara berjalan
Positif,2021,pemerintah kota administrasi jakarta utara pelaksanaan pendaftaran peserta didik ppdb terkendali
Positif,2021,ppdb dinas pendidikan menghilangkan stigma sekolah negeri favorit sekolah negeri jakarta memiliki mutu membentuk sekolah sekolah negeri variasi peserta didik gotong royong maju
Positif,2021,apresiasi disdik provinsi daerah khusus ibukota jakarta melayani masyarakat ppdb
Positif,2021,gubernur daerah khusus ibukota jakartaanies baswedanmemastikan permasalahan situsppdbdki jakarta beres tertangani
Positif,2021,perbaikan anak ppdb daerah khusus ibukota bermasalah program sidanira gubernur daerah khusus ibukota jakarta memantau mantan mendikbud ri amp vital bibit sdm daerah khusus ibukota jakarta kah gercep amp monitor yang bersangkutan
Positif,2021,senjata pc intel atom memori gb modem flash telkomsel kesulitan ketidakcakapan mengakses inet kerap muncul untungnya warung internet jakarta membuka jasa asistensi ppdb solidaritas bagus
Positif,2021,terkendala pemerintah provinsi daerah khusus ibukota berhasil perbaiki sistem ppdbjakarta
Positif,2021,kendala teknis diperbaiki gubernur anies pastikan proses ppdb jakarta berlandaskan kesetaraan berita jakarta
Positif,2021,kendala teknis diperbaiki gubernur anies pastikan proses ppdb jakarta berlandaskankesetaraan
Positif,2021,kendala teknis diperbaiki gubernur anies pastikan proses ppdb jakarta berlandaskankesetaraan
Positif,2021,gubernur daerah khusus ibukota jakarta anies baswedan gercep kesulitan pengajuan akun ppdb ajaran teratasi diakses
Positif,2021,gercep banget ppdb daerah khusus ibukota jakarta bermasalah gubernur turun tangan pastikan proses lancar bangga gubernur beliau
Positif,2021,perbaikan di respon cepat aspirasi masyarakat
Positif,2021,alhamdulillah kendala kemarin muncul dirasakan siswa orangtua mengikuti ppdb jakarta tertangani
Positif,2021,pelayanan terbaik unti wali murid kesulitan mengakses ebsite penerimaan peserta didik ppdb gubernur daerah khusus ibukota jakarta anies baswedan pelayanan titik
Positif,2021,posko ppdb psi jakarta hadir mendampingi proses pendaftaran penerimaan peserta didik ppdb daerah khusus ibukota jakarta hubungi nomor sesuai domisili sebarkan berhenti
Positif,2021,pejuang apapun upaya kebaikan diperjuangkan dpra partai keadilan sejahtera daerah khusus ibukota jakarta membuka posko membantu kemudahan pejuang ppdb online bang mpok min
Positif,2021,portal ppdb online sulit diakses catat nomor posko pengaduan wilayah daerah khusus ibukota jakarta
Positif,2021,anies langsung menggelar rapat dirut telekomunikasi mengatasi akses ppdb jakarta
Positif,2021,posko ppdb psi jakarta selatan masyarakat membutuhkan bantuan proses pendaftaran silahkan menghubungi kontak tertera kah posko alamat tertera postingan salam solidaritas
Positif,2021,selamat iya tipsnya berguna daftar semoga istirahat semoga bermanfaat yaa
Positif,2021,penerimaan peserta didik ppdb pelajaran daerah khusus ibukota jakarta senin pemerintah provinsi daerah khusus ibukota jakarta berkomitmen mewujudkan kesetaraan kesempatan pendidikan warga jakarta latar tuk pendidikan sumber
Positif,2021,kasih staff pengurus ppdb daerah khusus ibukota jakarta sekian daftar japres semoga pelajaran sistem pendidikan indonesia maju memiliki sdm unggul
Positif,2021,tips kode keamananny tidak perlu diganti pencet lanjutkan skarang daftar tinggal pantengin ketendang semoga tipsnya berguna yah semangat tidur tenang
Positif,2021,halo warga jakarta timur nomor playanan ppdb silakan iya nik anak nya petugas warga jakarta timur sarana informasi mengenahi pelayanan dokumen kependudukan mudah cepat gratis
Positif,2021,orangtua anaknya mendaftar ppdb daerah khusus ibukota jakarta bermanfaat mohon dishare komen like subscribe iya
Positif,2021,ombudsman jakarta menilai perbaikan pemerintah provinsi daerah khusus ibukota terkait pelaksanaan ppdb perbaikan aspek regulasi substansi peraturan
Positif,2021,ombudsman nilai perbaikan terkait ppdb jakarta aspek regulasi substansi peraturan
Positif,2021,ombudsman apresiasi perbaikan ppdb daerah khusus ibukota jakarta
Positif,2021,ayo dukung ppdb jakarta daring penyelenggaraan ppdb bertujuan mewujudkan kesetaraan kesempatan warga latar warga memperoleh pendidikan berkualitas daerah khusus ibukota jakarta
Positif,2021,ombudsman ri perwakilan jakarta raya mengapresiasi dinas pendidikan daerah khusus ibukota jakarta sosialisasi pelaksanaan penerimaan peserta didik ppdb
Positif,2021,weekend konten chanel youtube retno listyarti weekend ngobrol ppdb bentuk ketua panitia ppdb provinsi daerah khusus ibukota jakarta nantikan videonya iya insyaallah bermanfaat
Positif,2021,eh ppdb jakarta tahap anjing seneng banget tahap
Positif,2021,ppdb warga memperoleh pendidikan berkualitas daerah khusus ibukota jakarta ppdb membentuk sekolah sekolah negeri variasi peserta didik gotong royong maju
Positif,2021,ppdb warga memperoleh pendidikan berkualitas daerah khusus ibukota jakarta ppdb membentuk sekolah sekolah negeri variasi peserta didik gotong royong maju
Positif,2021,dear teman teman putra putri masuk sekolah informasi ppdb daerah khusus ibukota jakarta semoga bermanfaat
Positif,2021,mencapai nilai raport bagus instant nya proses belajar menerus
Positif,2021,ppdb ikhtiar menciptakan pendidikan tuntas berkualitas mari lanjutkan perbanyak kolaborasi kebersamaan kesetaraan kesempatan pendidikan anak anak daerah khusus ibukota jakarta
Positif,2021,pendidikan tanggung dinas pendidikan daerah khusus ibukota jakarta menghargai kolaborasi tahap penyusunan kebijakan ppdb
Positif,2021,enak ppdb jakarta sah
Positif,2021,taat banget perintah allah pas ppdb jakarta tahajud doa solawat in sekolah takdir allah terbaik ketendang daftar smk mungkinini terbaik
Positif,2021,misuh misuh ppdb jakarta bersyukur menemukan teman support support dripada teman smp yaa enjoy sklhku praktek nya banget iya namanya smk sih tertawa
Positif,2021,pemberkasan sekolah negeri kemarin berdasar pengalaman mendaftarkan keponakan sd negeri jakarta online system ppdb jakarta bagus tahap daftar ulang prosesnya orang tuanya mengurus
Negatif,2022,bagus sich sayang pemerataan pembiayaan pendidikan apbn apbd adil siswa mengajukan sekolah ppdb pemerintah provinsi jakarta dilayani kuota negeri dialihkan kah swasta subsidi kjp pip
Negatif,2022,pemerataan pembiayaan pendidikan bersumber apbn apbd adil siswa mengajukan ppdb kah pemerintah provinsi jakarta dilayani kuota negeri dialihkan kah sekolah swasta menerima pembiayaansubsidi
Negatif,2022,gasihh pas ppdb orang tua demo gasih pemerintahnya ketawa peduli beneran pas unjuk diketawain dibodohin gitu pendemo pelajar loh pemerintah sejahat iya kalgasal pas demo kah dinas pendidikan jakarta
Negatif,2022,kemendikbud angkatan percobaan nntinya hahaha semangat iya jujur masuk smk percobaan tertawa orang jakarta iya kacaunya ppdb jakarta so iya ppdb kecewa sistem
Negatif,2022,highschool in jakarta highschool in jakarta ditolak ppdb daerah khusus ibukota ancrit
Negatif,2022,bagamana ygy sman jakarta rangking mnrt disegani sekolah negeri random gara sistem ppdb tidak jelas masuk top iya bagus nya berekspektasi takut nurun rank gitu anjing
Negatif,2022,tangerang oasu ppdb jakarta nolak tidak bisa trend high school in jakarta sakitnya berasa men
Negatif,2022,negeri iya swasta sesiapnya anak tambahan informasi jakarta ajaran sistem ppdb sodaraku umur ketendang daftar siswa umur masuk sd based rayon utamanya based umur cobaa
Negatif,2022,seandainya dana bantu anak masuk sekolah sedihnya iya tuhan anak bodoh umur muda sekolah negeri bodoh sekolahkan ppdb jakarta menyakitkan hati orgtua tunggal semoga pemerintah provinsi dkibisa solusi anak
Negatif,2022,gonta ganti kebijakan ppdb jakarta dinilai timbulkanpersoalan
Negatif,2022,pejuang ppdb jakarta lolos menangis tidak apa-apa ngerasain adilnya sistem usaha semaksimal semangat teman-teman nilai tertawa
Negatif,2022,ppdb jakarta mohon tidak jelas banget
Negatif,2022,iyanih kayaknya error melulu web ppdb jakarta kemarin ngeselin
Negatif,2022,ppdb zonasi jakarta kemarin anjing nama pas pilihan iseng lihat pilihan tidak ada uang nama pas kah pilihan tidak ada uang yah bolak scroll refresh tidak ada uang anjing panik main
Negatif,2022,terima ppdb kunyuk jakarta pakai nilai zonasi umur
Negatif,2022,ppdb jakarta bantai kesel banget
Negatif,2022,ppdb jakarta anjirr utg jawa barat
Negatif,2022,adil banget najis ppdb zonasi jakarta udaa tua masuk logiss banget anak masuk ketendang menunggu masuk negeri gila kapaan sistem nya
Negatif,2022,ombudsman jakarta raya disdik daerah khusus ibukota jakarta gagal menanggulangi histeria publik ppdb berita
Negatif,2022,dilema ppdb sekolah negeri jakarta umur daftar negeri umur daftar smp negeri umur nya kegeser daftar nilai raport akademik kalah umur
Negatif,2022,dilema ppdb sekolah negeri jakarta rangking juara kelas juara sekolah keterima periode ppdb kalah title juara lomba kartu kjp
Negatif,2022,ppdb jakarta hancur banget buset
Negatif,2022,minggu masuk sekolah adik diterima sekolah negeri sistem ppdb jakarta masuk akal
Negatif,2022,ppdb zonasi jakarta knpsih teman masuk swasta gara kehalang umur nilai trmsuk marah banget
Negatif,2022,tolong gap year ppdb jakarta tolong be bagus to me
Negatif,2022,ppdb jakarta jalur zonasi tua tua nich
Negatif,2022,sistem ppdb jakarta meresahkan
Negatif,2022,drama ppdb online daerah khusus ibukota jakarta part kayanya neehh hiks hiks anak nilai kalah anak umur
Negatif,2022,ppdb jakarta tua tua banget anjing
Negatif,2022,jakarta kawin tidak perlu daftar
Negatif,2022,ade nin nyangkut skolah negeri ggra klah umur maraahh ppdb daerah khusus ibukota jakarta gajelaass fakultas
Negatif,2022,ppdb jakarta kotoran
Negatif,2022,adil ppdb zonasi jakarta
Negatif,2022,ppdb jakarta error parah anjing
Negatif,2022,website ppdb jakarta cacat ngecrash melulu kaya perang tiket jam banget standby
Negatif,2022,web ppdb jakarta hancur ygy
Negatif,2022,pagi sulit mengakses web ppdb jakarta
Negatif,2022,ppdb jakarta gagal melulu iya jaringan aman
Negatif,2022,ppdb jakarta lemah otak bgtt
Negatif,2022,web ppdb jakarta beginii
Netral,2022,memenuhi kebutuhan masyarakat layanan paud dinas pendidikan provinsi daerah khusus ibukota jakarta membuka layanan ppdb ajaran satuan paud negerivtersebar jakarta peminat mendaftar kah satuan paud negeri meningkat
Netral,2022,memenuhi kebutuhan masyarakat layanan paud dinas pendidikan provinsi daerah khusus ibukota jakarta membuka layanan ppdb ajaran satuan paud negerivtersebar jakarta peminat mendaftar kah satuan paud negeri meningkat
Netral,2022,yaallah allahu akbar nyesel banget pas ppdb milih sman sman jakarta nyesel bersalahnya ampun banget
Netral,2022,penerimaan peserta didik ppdb online fons vitae marsudirini koja jakarta utara
Netral,2022,ehh akt afirmasi pakai umur iya ppdb jakarta akt pakai umur sih afirmasi diliat prio zona
Netral,2022,lihat web ppdb jakarta pakai zonasi urutannya pakai nya nilai berbeda jawa barat timur zonasinya kebanyakan pakai jarak
Netral,2022,jakarta pas ppdb zonasi jalur non zonasi pakai nem keatas masuknya pakai umur kayaknya jakarta perubahannya sih
Netral,2022,sih berpengaruh iya nder jakarta ppdb non un angkatan iya penurunan angkatan ppdb non un
Netral,2022,jakarta ppdb pakai zonasi
Netral,2022,daerah jakarta orang tua gagap teknologi antri token isi data ppdb kali orang tua melas kah petugas dibantuin input data gagap teknologi daerah area non signal mikir iya
Netral,2022,hallo sabtu agustus pkbm negeri tahap batas lapor ppdb lupa bagikan informasi kah teman mu membutuhkan iya
Netral,2022,catat link pendaftaran ppdb pkbm tahap daerah khusus ibukota jakarta
Netral,2022,pendaftaran ppdb pkbm tahap daerah khusus ibukota jakarta resmi dibuka simak jadwalnya
Netral,2022,kakak kakak kelas kemarin ppdb jakarta ngegunain kepengurusan ekstrakulikuler surat lantik surat si kaya kepengurusan osis
Netral,2022,hallo jadwal pendaftaran ppdb pkbm negeri tahap lupa bagikan informasi kah teman mu membutuhkan iya
Netral,2022,hallo jadwal pendaftaran ppdb pkbm negeri tahap lupa bagikan informasi kah teman mu membutuhkan iya
Netral,2022,hallo rabu agustus pkbm negeri tahap batas lapor ppdb lupa bagikan informasi kah teman mu membutuhkan iya
Netral,2022,hallo jadwal lapor ppdb pkbm negeri tahap lupa bagikan informasi kah teman mu membutuhkan iya
Netral,2022,jakarta kota kota ditambah sistem ppdb
Netral,2022,giat asn pusat pelatihan kerja daerah jakarta timur mengikuti podcast rabu belajar episode kah tema penerimaan peserta didik ppdb kanal youtube jakarta public policy center bpsdm daerah khusus ibukota jakarta diselenggarakan bpsdmprovinsi daerah khusus ibukota jakarta
Netral,2022,diterapin jakarta ppdb sekolah negeri zonasi kecamatan gitu iya sekolahnya vaham sih kayaknya tinggalnya jauuh
Netral,2022,orang tua wali sah siswa mendaftarkan anaknya jalur zonasi zonasi siswa ppdb daerah khusus ibukota jakarta smp harap mengacu
Netral,2022,deobitna proudly present ppdb jalur playlist resah jacob in jakarta ayo temennya diajakin daftar
Netral,2022,iyaa tangerang jakarta maksudku tauu sistem ppdb tangerang gimanaa
Netral,2022,hahahaha haloo kakel mts ngomong-ngomong daftar kemarin ppdb jakarta nerima kakak tangerang
Netral,2022,hallo jumat juli batas lapor ppdb daring lupa bagikan informasi kah teman mu membutuhkan iya
Netral,2022,hallo jumat juli batas lapor ppdb daring lupa bagikan informasi kah teman mu membutuhkan iya
Netral,2022,sur sur liaatt sur tertawa ppdb jakarta
Netral,2022,lapor ppdb jakarta tinggal klik
Netral,2022,hallo jadwal lapor ppdb daring lupa bagikan informasi kah teman mu membutuhkan iya
Netral,2022,ppdb smk daerah khusus ibukota jakarta tahap lapor
Netral,2022,hallo jadwal lapor ppdb daring lupa bagikan informasi kah teman mu membutuhkan iya
Netral,2022,ppdb sd daerah khusus ibukota jakarta tahap ketiga link pengumuman lapor
Netral,2022,ppdb jakarta tutup tidak bisa daftar kann
Netral,2022,ppdb mtsn man daerah khusus ibukota jakarta tahap link pengumuman lapor
Netral,2022,ppdb mtsn man daerah khusus ibukota jakarta tahap link pengumuman lapor
Netral,2022,pengalaman mengikuti ppdb online daerah khusus ibukota jakarta part
Netral,2022,ppdb depok kakak daerah khusus ibukota jakarta tinggalnya didaerah cinere mohon infonya persyaratannya jalur diikiuti terima kasih
Netral,2022,Cuma nyeritain tim coach persiapan igt si emak nyeletuk ikutan kah jakarta busetdah dikata join igt ppdb menangis banget
Netral,2022,ppdb hang tuah jakarta tutup selamat bergabung hang tuah jakarta
Positif,2022,bu pulau seribu nya fisik bagus diliat ppdb daftar ulang usul kayak unggulan pakai asrama calon siswa jakarta khawatir daftar disana
Positif,2022,perbaiki sistem zonasi ppdb daerah khusus ibukota jakarta indikasi numpang kakak hapuskan kelurahan langsung kecamatan sort pakai mendaftar pilihan sekolah tambahkan nilai ipk umur hapus
Positif,2022,disyukuri Cuma if could do this ppdb milih sekolah jakarta apapun sekolahnya jakarta
Positif,2022,wakil gubernur daerah khusus ibukota sistem ppdb jakarta tingkatkan kualitas siswa sekolah
Positif,2022,wakil gubernur daerah khusus ibukota jakarta ahmad riza patria mengeklaim sistem penerimaan peserta didik ppdb berhasil meningkatkan kualitas murid sekolah
Positif,2022,ppdb ulang ditahun setelahnya ayahku berusaha keras sekolah negeri masuk kah favorite jakarta indonesia menangis melompat sahabatku bersekolah
Positif,2022,kak min sori link lapor nya cari cari website ppdb jakarta ketemu mestinya dikasih kolom button khusus lapor kolom memantau hasil seleksi mudah tolong kasih link terima kasih
Positif,2022,buset ppdb tangerang japresnya diliat hasil seleksinya webnya curiga nyogok tertawa buset deh bang perasaan kemarin jakarta gitu banget jakarta berani tertawa kepseknya langsung dipanggil kali
Positif,2022,sistem ppdb online banten kayak daerah khusus ibukota jakarta iya peserta tampil web terima gaknya clear nilai raport peluang suap susah tertutup amp ujug pengumuman fair
Positif,2022,prihatin adik gap year usulan zonasi kah gubernur daerah khusus ibukota jakarta kah admin ppdb pemetaan zonasi ditetapkan peraturan gubernur nomornya admin ppdb sih
Positif,2022,ppdb jakarta sekolah unggulan nilainya bagus
Positif,2022,usaha nder pindah kakak sekolah gara-gara keluarga uang sekolah mencari sekolah gratis iya jakarta pindah ngomong-ngomong nder ngurusnya gratis bayar fc data pindah pas sistem ppdb zonasikok tertawa
Positif,2022,penyandang disabilitas ppdb daerah khusus ibukota jakarta
Positif,2022,ppdb jakarta japres lolos seleksi lulus smp huhuhu puji tuhan bersyukur teman lolos seleksi ppdb japres semoga jalur afirmasi amp zonasi keterima aamiinn bagus luck teman-teman semangat
Positif,2022,alhamdulillah keterima ppdb jakarta jalur prestasi bayangkan terima kasih god
Positif,2022,ppdb daerah khusus ibukota jakarta berjalan lancar
Positif,2022,komisi perlindungan anak indonesia ppdb jakarta berjalan lancar lupa password akun dominasi permasalahan poskoppdb
Positif,2022,semoga lolos ppdb gel jakarta semoga kakak dijauhkan kesialan dilancarkan dimudahkan urusannya aamiin rajin berdoa kak semangat nyerah jaga kesehatan iya makan minum istirahat bagus luck have bagus day
Positif,2022,salut sih bikin presentil akademik ppdb daerah khusus ibukota jakarta sedetail menghitung presentil akademik nilai akademik nilai non akademik akreditasi peringkat angkatan diramu nilai mewakili jalur prestasi
Positif,2022,kesulitan ppdb daerah khusus ibukota jakarta japri yaa stand by laptop bantuin sodara
Positif,2022,ppdb jalur zonasi beda jalur afirmasi kjp dan kawan-kawan jalur aspirasi amp keluhan warga sekolah sekolah jakarta kota jml sekolah jarak rapat daerah wil kabupaten
Positif,2022,kemudahan orang tua murid posko pelayanan ppdb wilayah ii jakarta barat sediakan laptop
Positif,2022,kemudahan orang tua murid posko pelayanan ppdb wilayah ii jakarta barat sediakan laptop
Positif,2022,ombudsman jakarta raya menjaga integritas pelaksanaan ppdb alami pelaksanaan ppdb
Positif,2022,iya sih miin ppdb banten transparan kaya ppdb jakarta sekolah negeri siswa perkelas sekolah negeri kelas orang siswa
Positif,2022,informasi ppdb jakarta dicari purwosusilo sistem variatif kesetaraan masyarakat
Positif,2022,menghindari kesalahan suku dinas pendidikan wilayah jakarta pusat gencar mensosialisasikan mekanisme pendaftaran ppdb orang tua murid
Positif,2022,pemerintah provinsi daerah khusus ibukota jakarta penerimaan peserta didik ppdb daring variatif membentuk kualitas pendidikan
Positif,2022,cari informasi saranin ppdb jakarta ppdb banten sistem nya ku transparan tergantung hoki ppdb banten pas seleksi nya tidak bisa lihat ppdb jakarta pantau web
Positif,2022,wakil gubernur daerah khusus ibukota jakarta ahmad riza patria penyelenggaraan penerimaan peserta didik ppdb berjalan
Positif,2022,ppdb jakarta pakai jalur kota alhamdulillah langsung diterima pil nder geser umur nya muda tidak tahu si diitung
Positif,2022,pendidikan tanggung dinas pendidikan daerah khusus ibukota jakarta menghargai masukan tahap penyusunan kebijakan ppdb pelajaran
