klasifikasi,tahun,Text_bersih
Negatif,2020,lembaga swadaya masyarakat gmbi daerah khusus ibukota jakarta menuntut gubernur daerah khusus ibukota jakarta ppdb dicabut
Negatif,2020,swasta dicampuri bang wali murid rebutan cari sekolah negeri ppdb jakarta kemarin gratis spp dan lain-lain buku dipinjamkan sekolah swasta pindah kah negeri gratis iya seleksi kacau
Negatif,2020,dikritisi sistem ppdb kacau ditambah model zonasi parah jakarta pakai sistem umur sekolah disamakan kasian anak pintar sekolah mendukung halo
Negatif,2020,kebijakan normalisasi sungai jakarta formula monas mengorbankan pohon mahoni penanganan covid bantuan korban dampak pandemi ambur adul ppdb mengorbankan anak berprestasi ketidakmampuanmu anies baswedan
Negatif,2020,orangnya dendam nyesel kecewa kadang kecewa ppdb zonasi pakai umur oktober harapan japres anak negeri kalah swasta masuk smp netapin masuk sman jakarta sekolah
Negatif,2020,habis fikir kenal orang model emak misuh anaknya keterima sekolah negeri gara aturan ppdb jakarta disalahin mendikbud
Negatif,2020,iyaa dipindah kerjanya kah januari dsah malas ppdb jakarta kah ambon huhu
Negatif,2020,lihat ppdb jakarta muda nya salah nyoba jakarta anjing auto swasta
Negatif,2020,tidak tahu lelah banget ppdb jakarta
Negatif,2020,jakarta ppdb umur daftar
Negatif,2020,gubernur covid konpres melulu ppdb jakarta diam kotoran
Negatif,2020,kadis pendidikan daerah khusus ibukota jakarta kebijakan ppdb batas usia akibatnya orang tua pusingg mencari uang daftar anak sekolah swasta konyoll
Negatif,2020,rencana pemerintah daerah khusus ibukota jakarta anak gagal diterima ppdb ortunya sanggup daftarkan kah sekolah swasta mihil bagamana
Negatif,2020,semoga orang membiayai unt melanjutkan skolah iya adik lolos ppdb jakarta pelajar peraih ratusan penghargaan putus sekolah
Negatif,2020,iya dewan perwakilan rakyat daerah daerah khusus ibukota jakarta diam seribu bahasa orang tua siswa dirugikan disusahkan aturan usia ppdb daerah khusus ibukota jakarta kepala dinas pendidikan anehh perwakilan rakyat kampanye saudara laki-laki mengaku mengaku berjuang rakyat kasihan deh
Netral,2020,jakarta indonesia
Netral,2020,penambahan anggaran bos menyusul banyaknya siswa daerah khusus ibukota jakarta terdampak pandemi covid sistem ppdb
Netral,2020,
Netral,2020,bermimpilah berani gagal informasi ppdb istiqlal jakarta
Netral,2020,total nilai matpel disekolah dibagi banyaknya matpel umur setau sistem ppdb jakarta daerah lihat jarak sekolah kerumah adkel masuk tua umurnya muda
Netral,2020,hmm ngetik ft ppdb jakarta
Netral,2020,maba niat banget ngetimnya semoga membuahkan hasil adik
Netral,2020,ppdb daerah khusus ibukota jakarta
Netral,2020,anak ppdb jakarta kalah kakak perempuan
Netral,2020,nadia ngirim menfessnya
Netral,2020,coba ppdb nya merambah kah depok jakarta
Netral,2020,midnight sale niel
Netral,2020,tertawa bang liti
Netral,2020,mantap kasposnye sophia latjiba pt sayang pt pemberi harapan palsu tertawa
Netral,2020,kirain dibakar stock galaku
Netral,2020,tidak bisa contohnya
Netral,2020,ngajarin gas
Netral,2020,silahkan update kah media sosial saudara laki-laki disitu lengkap rekam jejak fraksi psi jakarta polemik ppdb kemarin
Netral,2020,astaga lebih baik tidak punya pacar nadia kasian cowonya
Netral,2020,kelompok perwakilan orangtua siswa mengajukan gugatan gubernur daerah khusus ibukota amp kadinas pendidikan daerah khusus ibukota jakarta kah ptun daerah khusus ibukota jakarta gugatan terkait kebijakan penerimaan peserta didik ppdb berbasis usia talk sekretaris perkumpulan koloni jumono
Netral,2020,orang tua gugat ppdb daerah khusus ibukota jakarta kah ptun
Netral,2020,pelajaran sekolah online adik adik semangat belajar iya kilas ayo jalur ppdb disiapkan pemerintah provinsi daerah khusus ibukota sih jalur
Netral,2020,baca web nya ppdb jakarta just in case
Netral,2020,sejarah mencatat ppdb daerah khusus ibukota jakarta
Netral,2020,kisruh penerimaan peserta didik ppdb daerah khusus ibukota jakarta perbincangan
Netral,2020,anies baswedan kajian penyaluran bantuan siswa gagal ppdb
Netral,2020,pelaksanaan sosperda nomor kepemudaan ketua fraksi nasdem dewan perwakilan rakyat daerah daerah khusus ibukota jakarta wibi andrino kesempatan menyerap aspirasi kesehatan ppdb daerah khusus ibukota pelatihan umkm online
Netral,2020,dinas pendidikan daerah khusus ibukota jakarta menanggapi kabar siswa berprestasi bernama aristawidya maheswari gadis kerap disapa arista gagal lolos ppdb daerah khusus ibukota memiliki prestasi
Netral,2020,ajaran kursi kuota penerimaan peserta didik ppdb daerah khusus ibukota jakarta kosong
Netral,2020,nama mengadukan nasibnya kah komisi perlindungan anak indonesia gagal lolos ppdb daerah khusus ibukota daftar diserahkan kah disdik daerah khusus ibukota jakarta ditindaklanjuti
Netral,2020,ppdb jakarta resmi ppdb jakarta menambah syarat usia peserta didik
Netral,2020,ppdb daerah khusus ibukota jakarta selesai ribuan kursi kosong
Netral,2020,kursi kosong sekolah negeri ppdb jakarta jenjang sekolah dasar sd persen kursi
Netral,2020,dinas pendidikan daerah khusus ibukota jakarta kursi tersisa ppdb
Netral,2020,ppdb jakarta sisakan kursi kosong
Netral,2020,ppdb kursi kosong jakarta penyebab kursi kosong penutupan ppdb zonasi sekolah berlokasi pusat perkantoran kepulauan seribu
Netral,2020,ppdb daerah khusus ibukota jakarta polemik persyaratan usia pbb halo sahabat fema pelaksanaan ppdb daerah khusus ibukota jakarta perbedaan penggunaan usia salah faktor pertimbangan penerimaan calon peserta didik
Netral,2020,sdn srengseng pagi kembangan jakarta barat mengadakan sosialisasi pembelajaran jarak pjj wali murid
Netral,2020,iluni universitas indonesia mengadakan webinar profesional kontra kebijakan ppdb daerah khusus ibukota jakarta webinar seputar inovasi koperasi policy center iluni universitas indonesia mengadakan diskusi diunggah kah spotify youtube iluni universitas indonesia diskusi aktivis alumni universitas indonesia
Netral,2020,ppdb jakarta bang
Positif,2020,ipa gara kelempar melulu terpaksa milih ips linjur sih ips enak xixixixix terima kasih ppdb jakarta
Positif,2020,sistem penerimaan peserta didik ppdb menyisakan kisah haru bunda putri sopir angkot berhasil lolos favorit jakarta
Positif,2020,cerita ppdb calon siswa keluarga miskin masuk sekolah semangat pendidikan ibukota
Positif,2020,ketua komisi apresiasi bantuan siswa lolos ppdb berita jakarta
Positif,2020,anies dikecam ppdb anies mengurus surat miskin siswa daerah khusus ibukota jakarta memperoleh bantuan uang pangkal masuk kah sekolah swasta siswa gagal jalur ppdb total anggaran
Positif,2020,beruntung yaa warga jakarta gubernur peduli uang pangkal pemerintah provinsi daerah khusus ibukota bantu spp siswa gagal ppdb masuk sekolah swasta
Positif,2020,pemerintah provinsi daerah khusus ibukota jakarta membantu ribu siswa lolos seleksi pendaftaran ppdb terpaksa mengenyam pendidikan sekolah negeri
Positif,2020,pemerintah provinsi daerah khusus ibukota jakarta bantu an siswa lolos ppdb kah sekolah swasta
Positif,2020,pemerintah daerah khusus ibukota jakarta siapkan dana rupiah miliar bantu siswa sekolah swasta
Positif,2020,dewan perwakilan rakyat daerah daerah khusus ibukota jakarta mengawal rencana kucuran anggaran senilai rupiah miliar dikeluarkan pemerintah provinsi daerah khusus ibukota jakarta insentif siswa lulus ppdb masuk sekolah swasta
Positif,2020,bantuan pemerintah provinsi daerah khusus ibukota jakarta uang pangkal siswa bersekolah kah swasta siswa terdampak pandemi virus corona
Positif,2020,anggaran senilai rupiah miliar disiapkan pemerintah provinsi daerah khusus ibukota jakarta bantuan pendidikan siswa sekolah sd smp smu lolos ppdb masuk sekolah swasta
Positif,2020,proses ppdb daerah khusus ibukota jakarta menuai polemik ketua komisi dewan perwakilan rakyat daerah daerah khusus ibukota jakarta menilai proses
Positif,2020,disdik peserta kjp lolos ppdb cicil uang pangkal swasta berat mengeluarkan biaya pendidikan sekolah swasta kepala dinas pendidikan daerah khusus ibukota jakarta menyarankan siswa penerima kjp mencicil biaya pendidikannya
Positif,2020,teman teman mencari narasumber artikel saudara kerabat berbagi pengalaman ppdb jakarta mohon bantuannya
Positif,2020,kompas judulnya aturan ppdb jakarta cuy pemerintah provinsi daerah khusus ibukota salah daerah aturan ppdb nya
Positif,2020,kisruh ppdb daerah khusus ibukota jakarta sekolah swasta diusulkan dibiayai apbn
Positif,2020,buzzerp bodoh sistem ppdb daerah indonesia ngelakuin diserang jakarta kemauan anjing media buzzerp sampah coba bos gojek nyet
Positif,2020,ppdb depok kayak ppdb jakarta ppdb depok
Positif,2020,pengamat karangan bunga ppdb daerah khusus ibukota jakarta mengikuti aturan permendikbud nomor ppdb diberlakukan disetiap daerah kirim karangan bunga kah kantor anies si pengirim salah alamat dikirim kah kantor mantan kang gojek
Positif,2020,ppdb pemerintah provinsi daerah khusus ibukota jalur zonasi pernahkan langsung kah menterinya
Positif,2020,alhamdulillah nge share kasih ppdb jakarta daerah pemerintah daerah pastinya menjalankan sesuai peraturan kemendikbud regulator iya si kemendikbud
Positif,2020,heran ppdb didemo Cuma daerah khusus ibukota jakarta padang bikin aturan mendikbud
Positif,2020,mbak bukti ppdb jakarta kebijakan kemendikbud
Positif,2020,ppdb jakarta saudara laki-laki daerah telanjur sakit hati iya susah kemarin anis antisipasi korona mengapresiasi hati hitam terlihatjahat
Positif,2020,ppdb jakarta loh sistem zonasi pemerintah menimbulkan dampak buruk pendidikan daerah anis disalahkan aneh
Positif,2020,ppdb jakarta psi daerah khusus ibukota bantu anak masuk sekolah swasta
Positif,2020,kemendagri fasilitasi upaya penyelesaian permasalahan ppdb daerah khusus ibukota jakarta
Positif,2020,penjelasan kemendagri terkait permasalahan ppdb daerah khusus ibukota pelaksana tugas plt sekretaris jenderal kemendagri muhammad hudori menemukan titik temu permasalahan terkait penerimaan peserta didik ppdb daerah khusus ibukota jakarta
Positif,2020,wakil ketua dewan perwakilan rakyat daerah daerah khusus ibukota jakarta zita anjani berjanji mengawal bantuan siswa bersekolah swasta gagal masuk sekolah negeri
Positif,2020,adduh lakukan daerah khusus ibukota program bodoh menyabut gubernur jakarta salahkan
Positif,2020,ppdb kena disorot daerah khusus ibukota jakarta iya daerah mengalami
Positif,2020,kemendagri kemendikbud pemerintah provinsi daerah khusus ibukota temukan titik temu ppdb plt irjen kemendikbud chatarina muliana girsang sinergi pemerintah provinsi daerah khusus ibukota jakarta terkait jalur zona rw
Positif,2020,sahabats hati prihatin fenomena kecerobohan implementasi kebijakan ppdb daerah khusus ibukota jakarta seleksi jalur zonasi mari berupaya mengubah merevisinya petisi link
Positif,2020,anies baswedan mari kritik anies tertatih tatih urusan psbb jakarta kebijakan presiden jokowi anies tertatih tatih urusan ppdb jakarta kebijakan mendikbud silahkan nalar dibenahidulu
Positif,2020,tvonenews menge tweet pengamat pendidikan pelaksanaan ppdb zonasi daerah khusus ibukota jakarta keadilan masyarakat menengah kah
Positif,2020,aturan ppdb mendikbud iya berlaku disemua sekolah indonesia jakarta disalahkan gubernur
Positif,2020,nadiem mengaku salah pembully anies terdiam
Positif,2020,yth nadiem makarim terimakasih atensinya harapan meluruskan kisruh ppdb daerah khusus ibukota mendikbud nadiem koordinasi kah mendagri tito
Positif,2020,alhamdulillah masuk ppdb jakarta bun
Positif,2020,dimana sekolah favorite dominasi sekolah favorite jenjang ppdb daerah khusus ibukota pakai usia jarak demografi jakarta berbeda daerah dimana jakarta penduduknya padat pemukiman
Positif,2020,adik kecewa marah akibat masuknya sekolah negeri sistem ppdb semangat
Positif,2020,pengurus kader psi dirikan posko bantu warga kesulitan daftarkan anaknya program penerimaan peserta didik ppdb semoga keruwetan penerimaan siswa jakarta teratasi
Positif,2020,coba teman jateng jawa barat faktor usia ppdb kasihan wan anis senter daerah khusus ibukota jakarta disorot
Positif,2020,pengamat pendidikan pelaksanaan ppdb zonasi daerah khusus ibukota jakarta keadilan masyarakat menengah kah
Positif,2020,komisi perlindungan anak indonesia apresiasi solusi ppdb daerah khusus ibukota diwarnai kisruh syarat usia
Positif,2020,update jalur ppdb daerah khusus ibukota jakarta jalur zonasi rumahnya rw setidakny harapan adek sekolah lokasinya rw sekolah dituju
Positif,2020,opini sih ppdb daerah khusus ibukota jakarta dibatalkan diulang menambah stress otm cpdb perbaiki solusi cpdb lolos seleksi usia
Positif,2020,kabar kemendikbud ppdb daerah khusus ibukota jakarta semoga menyelesaikan kekisruhan
Positif,2020,dailami firdaus kisruh ppdb jakarta dicarikan solusinya
Negatif,2021,heh yaampun senasib banget beli tiket pesawat panggil tukang benerin rumah jakarta menginap eh pas masuk web tiket serasa ppdb masuk
Negatif,2021,teman teman smp bagus banget nasibnya merenungi ppdb jakarta
Negatif,2021,pokonya osis ekskul jabatannya langsung ajuin biar poin tidak tahu bandung bagamana krna daerah beda sistem ppdb prestasinya jakarta jelek banget anjr
Negatif,2021,aa queela keren seangkatan jakarta ppdb nya pakai umur menangis umur pasrah banget tidak bisa masuk smk tertawa ll do my best
Negatif,2021,cerita juli seleksi ppdb daerah khusus ibukota jakarta mengecewakan
Negatif,2021,terima he masuk negeri maaf kawan rela ppdb jakarta
Negatif,2021,anti lihat ppdb jakarta
Negatif,2021,what ppdb jakarta peluang nya umur tua
Negatif,2021,iyaa banget pas kelas stress memikirkan gituan tinggalnya jakarta khawatir ppdb sgjslshal
Negatif,2021,jujurly ginian pas kelas asli pas ppdb gitu disaranin masuk jakarta biar berangkat emak untung gajadi
Negatif,2021,semangat iya belajarnya dom jakarta sistem ppdb kacau banget tertawa dom jakarta iya aman korbannya ppdb jakarta
Negatif,2021,iya swasta numpang kakak masuk smp pas biar masuk smp negeri jakarta ppdb jakarta ygsekarang aneh lohh pakai zona prioritas pakai retweet rw gapake jarak sekolah kah rumah yaa adh aneh deh malas banget malas ppdb
Negatif,2021,diterima jalur zonasi swasta kuota membludak anak diterima pendapat kepala tebersit perasaan anak
Negatif,2021,anak bertahan tergeser tambahan nilai logis mohon pantau terimakasih
Negatif,2021,yth bantu cek nilai seleksi nilainya normal nilai segitu knapa daftar akademi jalur lolos update nilai oknum
Negatif,2021,capek iya korban ghosting ppdb jakarta sebulan jalur kepental kemarin tahap dipental kursinya dikit banget pendaftaran swasta tutup nasib stress banget
Negatif,2021,ppdb jakarta banget si iya allah minggat
Negatif,2021,disaat pendidikan berpihak anak anak salahkan kaum vandal tumbuh subur
Negatif,2021,ppdb jakarta kacau
Negatif,2021,rasany lolos japres kalah osis ekstra rasany lolos afirmasi kjp rasany lolos zonasi umur rasnay lolos tahap persentil sidanira dikit banget bangku kosongnya kena mental men ppdb tahap jakarta
Negatif,2021,ppdb jakarta bangsat
Negatif,2021,please sekolah dimana cobaa tolak sekolah ppdb tahap jakarta pliss kalah japres persentil zonasi kalah umur tahap persentil sii woii
Negatif,2021,capek ppdb jakarta gajelas
Negatif,2021,sekian jam dibuka tampilannya masuk
Negatif,2021,serius pemerintah sistem ppdb jakarta jalur zonasi pakai umur jarak nilai stress umur kemudaan
Negatif,2021,sebulan stress ppdb jakarta aneh
Negatif,2021,web ppdb jakarta eror huhu
Negatif,2021,ppdb jakarta makan gaji buta gajelas peraturannya kasian anak
Negatif,2021,ppdb jakarta tolong pecat pegawai pegawai tidak bisa kerja kebijakan gamasuk akal gila peraturannya sekola iya pakai nilai umur
Negatif,2021,ppdb jakarta gajelas
Negatif,2021,oalah jakarta offline iya jakarta ppdb online lupa online servernya heran berubah bertahun
Negatif,2021,kasihan banget lihat pasrah menunggu sisa kursi sekolah ppdb menguras emosii
Negatif,2021,ppdb jakarta kacau banget sistem prestasi pakai umur amppersentil sistem zonasi pakai umur deh umur muda pintar kalah umurnya
Negatif,2021,ppdb jakarta ngaretnya kelebihan ih sia sia bangun pagi anjing
Negatif,2021,ppdb jakarta sistemnya ngeselin
Negatif,2021,ppdb jakarta tahap pilih skolah jam
Negatif,2021,ppdb jakarta bagamana sii daftarin sepupu biar cepat milih skolah
Negatif,2021,ppdb jakarta pilihan sekolah nya
Negatif,2021,tahap tulisan pilihan sekolah sumpaahh takut bnget
Negatif,2021,welcome to jakarta dimana ppdb jalur prestasi nilai akademik nilai non akademik welcome to jakarta dimana ppdb jalur zonasi keterima umurnya tua
Negatif,2021,heh iya sih kaget ppdb jakarta untung ku sistem umur nilai
Negatif,2021,lihat ppdb negeri daerah khusus ibukota salah berkualitas jakarta barat siswa diterima diatas berusia dibawahnya diterima keberpihakan keadilan carut marut kebijakan
Negatif,2021,orangtua protes ppdb zonasi jakarta jarak meter lolos gara gara kalah umur klik baca terpaksa mengalah sistemnya terpaksa sekolah bersaing tua kasian dd
Negatif,2021,sistem ppdb jakarta hancur hancur
Negatif,2021,ppdb jakarta anjing
Negatif,2021,umur kartu tanda penduduk kerja umur kartu tanda penduduk kerja calon siswa masuk swasta
Negatif,2021,ngeselin pakai umur zonasinya lebih baik kemarin jalur prestasinya pakai rapot masuk anj nilai
Negatif,2021,ditunggu action nya orang tua pusing covid beban ppdb
Negatif,2021,semangat yaa dom jakarta pusing banget masuk ppdb sistemnya gajelas kemarin zonasi kalah umur semangat kamuu fighting jalan keluarr
Negatif,2021,gajelas banget bolol orang kualitas negeri jakarta jelek gede rasa ppdb saudara laki-laki main kah jakarta biar keras nya bagamana pendidikan ngerasain kgk
Negatif,2021,bubarkaan bikin rusak generasi penerus pembodohan sistem
Negatif,2021,aduh kasian deh cilandak barat tidak punya negerii
Negatif,2021,pusing banget ppdb jakarta umur menit langsung kah gepak kereta cepat
Negatif,2021,ppdb jakarta stress anjing
Negatif,2021,hah ppdb jakarta pakai umur
Negatif,2021,iya salah banget ppdb jakarta iya masuk jdnya swasta sedih banget
Negatif,2021,ppdb daerah khusus ibukota bermasalah pendidikan berkualitas umur berkualitas keluarga jakarta sekolah swasta pilihan gap year timbulkan gunung es kah depannya tolong terhormat dipertimbangkan ulang
Negatif,2021,orang jakarta kesel ppdb zonasii keterima jing duhh gni gaush memikirkan nilai umur tua
Negatif,2021,plss depresot banget ppdb jakarta sistem zonasinya adil
Negatif,2021,tua sekolah muda hancurr
Negatif,2021,jalur umur mah jalur zonasi badut banget ppdb jakarta
Negatif,2021,ppdb jakarta masuk deh
Negatif,2021,lelah sistem ppdb jakarta
Negatif,2021,bohong banget ppdb jakarta
Negatif,2021,gimanasi ppdb jakarta katamya zonasi pakai umur aneh
Negatif,2021,rebutan booking vaksin jakarta bikin sakit perut berasa ppdb
Negatif,2021,tolong iya mah tua keterima jarak nya mksdny gman iya lahir nya dimana umur anak keterima mengerti jalan fikir pemerintah nerapin sistem ppdb jakarta orang sekolah
Netral,2021,dom jakarta pengaruh nder kemarin ppdb dipakai rapot smstr
Netral,2021,nder coba search ppdb sebentar muncul nilai murni ppdb jakarta bidang prestasi sekedar informasi kuat nilai lomba lomba pengurus ekskul
Netral,2021,lombanyaa kapann soalya ppdb jakarta gasalaa lombanya maksimal pendaftaran ppdb gituu
Netral,2021,daerah jakarta pakai zona zona nder ppdb kemarin kalopun jarak kah sekolah gamasuk zona utamanya jakarta deh
Netral,2021,mengikuti tes seleksi ppdb madrasah istiqlal jakarta terlewat iya sabtu desember
Netral,2021,presentasi ppdb smp jakarta
Netral,2021,presentasi ppdb smp jakarta
Netral,2021,tim ppdb pelajaran berkunjung kah smp jakarta
Netral,2021,indonesia
Netral,2021,indonesia
Netral,2021,kemarin ngecek ppdb jakarta sd negeri inceran masuk usia mudah an nadim lolos deh smp negeri mbak meth sd swasta smp nya negeri
Netral,2021,iya semacem sertif pengurus osis iya sekolah dilampirin gituu kayak nilai plus ngomong-ngomong ppdb jakarta
Netral,2021,yahh ppdb tidak bisa iya jakarta deh
Netral,2021,ppdb daerah khusus ibukota jakarta daftar swasta terlibat beserta kuotanya
Netral,2021,ppdb daerah khusus ibukota jakarta daftar swasta terlibat beserta kuotanya
Netral,2021,ppdb daerah khusus ibukota jakarta daftar swasta terlibat beserta kuotanya
Netral,2021,ppdb daerah khusus ibukota jakarta daftar swasta terlibat beserta kuotanya
Netral,2021,ppdb daerah khusus ibukota jakarta daftar swasta terlibat beserta kuotanya
Netral,2021,ppdb daerah khusus ibukota jakarta daftar swasta terlibat beserta kuotanya
Netral,2021,ppdb daerah khusus ibukota jakarta daftar swasta terlibat beserta kuotanya
Netral,2021,ppdb daerah khusus ibukota jakarta daftar swasta terlibat beserta kuotanya
Netral,2021,ppdb daerah khusus ibukota jakarta daftar swasta terlibat beserta kuotanya
Netral,2021,ppdb daerah khusus ibukota jakarta daftar swasta terlibat beserta kuotanya
Netral,2021,ppdb daerah khusus ibukota jakarta daftar swasta terlibat beserta kuotanya
Netral,2021,smk jakarta timur ppdb jakarta selatan
Netral,2021,deh jakarta timur ppdb jakarta selatan
Netral,2021,ppdb daerah khusus ibukota jakarta daftar swasta terlibat beserta kuotanya
Netral,2021,ppdb daerah khusus ibukota jakarta daftar swasta terlibat beserta kuotanya
Netral,2021,ppdb daerah khusus ibukota jakarta daftar swasta terlibat beserta kuotanya
Netral,2021,ppdb daerah khusus ibukota jakarta daftar swasta terlibat beserta kuotanya
Netral,2021,sd kartika jaya jakarta kepala sekolah pamuji sukses terbaik daerah khusus ibukota jakarta tips beliau guru anak orang tua belajar ppdb pandemi ayo kepoin teman-teman
Netral,2021,ngomong-ngomong ppdb jakarta iya coba ppdb kotamu
Netral,2021,catat alur ppdb sd jalur zonasi jakarta
Netral,2021,adik lulus smp kah ikutlah ppdb daerah khusus ibukota jakarta beuh iya ampun deg degan
Netral,2021,dibuka besok tata pendaftaran ppdb sekolah negeri swasta jakarta
Netral,2021,catat alur ppdb sd jalur zonasi jakarta
Netral,2021,total calon peserta didik cpd diadvokasi tanggal juni juli posko ppdb psi jakarta berhasil diterima sekolah dipilih
Netral,2021,ppdb daerah khusus ibukota jakarta daftar swasta terlibat beserta kuotanya
Netral,2021,catat alur ppdb sd jalur zonasi jakarta
Netral,2021,stud teman-teman sistem ppdb jakarta japres terima kasih
Netral,2021,simak jadwal lengkap ppdb madrasah daerah khusus ibukota jakarta jenjang mi mts
Netral,2021,anies baswedan batalkan sistem zonasi ppdb daerah khusus ibukota jakarta tandatangani petisi
Netral,2021,ombudsman jakarta raya panggil kadisdik provinsi jawa barat terkait ppdb jenjang smk wilayah bogor depok bekasi
Netral,2021,ombudsman jakarta raya layangkan panggilan kadisdik jawa barat terkait ppdb smk bodebek
Netral,2021,dalami laporan terkait ppdb smk bodebek ombudsman panggil kadisdik jawa barat permasalahan dilaporkan ombudsman jakarta raya dugaan tindakan malaadministrasi pengusulan kuota siswa proses penilaian
Netral,2021,jakarta ri depok ribet ppdb yak
Netral,2021,ppdb jakarta jalur zonasi umur lolos kayaknya
Netral,2021,kamis komisioner komisi perlindungan anak indonesia retno listyarti amp tim pengawasan ptm ppdb sman jakarta komisi perlindungan anak indonesia penjelasan terkait pelaksanaan vaksin anak usia dimasifkan melibatkan pihaksekolah puskemas terdekat
Netral,2021,beda ppdb daerah khusus ibukota jakarta ombudsman temuan dugaan maladministrasi ppdb bodebek
Netral,2021,ppdb jakarta yogyakarta so junghwan one tweet angkatan udara gionashe
Netral,2021,ombudsman memeriksa kadisdik provinsi jawa barat provinsi banten ihwal dugaan pelanggaran pelaksanaan ppdb ajaran ppdb daerah khusus ibukota jakarta catatan minor
Netral,2021,simak jadwal lengkap ppdb madrasah daerah khusus ibukota jakarta jenjang mi mts
Netral,2021,anies baswedan batalkan sistem zonasi ppdb daerah khusus ibukota jakarta tandatangani petisi
Netral,2021,ombudsman memeriksa kepala dinas pendidikan provinsi jawa barat provinsi banten ihwal dugaan pelanggaran pelaksanaan penerimaan peserta didik ppdb ajaran pelaksanaan ppdb daerah khusus ibukota jakarta
Netral,2021,assalamualaikum warahmatullahi wabarakatuh informasi ppdb smk gita kirtti jakarta barangkali bingung mencari sekolah putra putrinya smk gita kirtti menerima pendaftaran siswa terima kasih perhatian wassalamualaikum wr wb
Netral,2021,pelaksanaan ppdb pelajaran jakarta
Netral,2021,penutupan ppdb tanggal juli homeschooling talenta jakarta timur
Netral,2021,ppdb daerah khusus ibukota jakarta daftar swasta terlibat beserta kuotanya
Netral,2021,ppdb smk gita kirtti jakarta dibuka pendaftaran terjangkau daftarkan anak saudara tetangga kah sekolah bidang managemen bisnis maju
Netral,2021,ngetweet ppdb jakarta
Netral,2021,
Netral,2021,
Netral,2021,informasi ppdb daerah khusus ibukota jakarta silakan menghubungi call center jam kerja telepon hotline telepon posko dinas terima kasih
Netral,2021,assalamu alaikum wr wb putra ayah bunda pilihan sekolahnya mendaftarkannya terbatas
Netral,2021,informasi mengikuti instagram
Netral,2021,ombudsman perwakilan jakarta raya menemukan dugaan malaadministrasi ppdb tingkat smk bodebek
Positif,2021,si nder aktif ppdb ppdb jakarta masuk kah organisasi pengurus ekskul berperan nderr coba lakuin kah negeri
Positif,2021,daerah khusus ibukota bagus ppkm salurkan bansos juta kakak berhak program vaksin belajar tatap muka ppdb lancar dead rate covid tertinggi turun jakarta pintar jakarta linko warga daerah iri daerah khusus ibukota
Positif,2021,mas goldy memaparkan dampak positif ppdb daerah khusus ibukota jakarta menuai profesional kontra rapat kesesuaian data latar ekonomi keluarga siswa data tingkat ekonomi kelompok masyarakat daerah khusus ibukota jakarta
Positif,2021,kemarin ppdb jakarta osis jabatan osisnya lumayan banget tambahan nilainya
Positif,2021,ppdb alhamdulillah nya keterima salah negeri jakarta pusat poin utamanya angkatan smp ppdb alias gapyear langsung kah
Positif,2021,komisi perlindungan anak indonesia ppdb daerah khusus ibukota jakarta libatkan sekolah swasta patut ditiru
Positif,2021,korban ppdb jakarta usaha maximal ips rezeki jjr sedih banget aslinya kacau banget pas keterima ips swasta ekonomi bagus yaudahlah ipa intinya semangat linjur
