klasifikasi,tahun,tweet
Netral,2020,mimpi berani gagal informasi ppdb istiqlal jakarta
Netral,2020,total nilai matpel seko bagi banyak matpel umur tau sistem ppdb jakarta daerah lihat jarak sekolah rumah adkel masuk tua umur muda
Netral,2020,hmm ngetik ft ppdb jakarta
Netral,2020,maba niat banget ngetimnya moga buah hasil adik
Netral,2020,ppdb daerah khusus ibukota jakarta
Netral,2020,anak ppdb jakarta kalah kakak perempuan
Netral,2020,nadia ngirim menfessnya
Netral,2020,coba ppdb nya rambah kah depok jakarta
Netral,2020,midnight sale niel
Netral,2020,tertawa bang liti
Netral,2020,mantap kasposnye sophia latjiba pt sayang pt beri harap palsu tertawa
Netral,2020,kirain bakar stock gala
Netral,2020,tidak bisa contoh
Netral,2020,ngajarin gas
Netral,2020,silah update kah media sosial saudara laki situ lengkap rekam jejak fraksi psi jakarta polemik ppdb kemarin
Netral,2020,astaga lebih baik tidak punya pacar nadia kasi cowonya
Netral,2020,kelompok wakil orangtua siswa aju gugat gubernur daerah khusus ibukota amp kadinas didik daerah khusus ibukota jakarta kah ptun daerah khusus ibukota jakarta gugat kait bijak terima serta didik ppdb bas usia talk sekretaris kumpul koloni jumono
Netral,2020,orang tua gugat ppdb daerah khusus ibukota jakarta kah ptun
Netral,2020,ajar sekolah online adik adik semangat ajar iya kilas ayo jalur ppdb siap perintah provinsi daerah khusus ibukota sih jalur
Netral,2020,baca web nya ppdb jakarta just in case
Netral,2020,sejarah catat ppdb daerah khusus ibukota jakarta
Netral,2020,kisruh terima serta didik ppdb daerah khusus ibukota jakarta bincang
Netral,2020,anies baswedan kaji salur bantu siswa gagal ppdb
Netral,2020,laksana sosperda nomor pemuda ketua fraksi nasdem dewan wakil rakyat daerah daerah khusus ibukota jakarta wibi andrino sempat serap aspirasi sehat ppdb daerah khusus ibukota latih umkm online
Netral,2020,dinas didik daerah khusus ibukota jakarta tanggap kabar siswa prestasi nama aristawidya maheswari gadis kerap sapa arista gagal lolos ppdb daerah khusus ibukota milik prestasi
Netral,2020,ajar kursi kuota terima serta didik ppdb daerah khusus ibukota jakarta kosong
Netral,2020,nama adu nasib kah komisi lindung anak indonesia gagal lolos ppdb daerah khusus ibukota daftar serah kah disdik daerah khusus ibukota jakarta ditindaklanjuti
Netral,2020,ppdb jakarta resmi ppdb jakarta tambah syarat usia serta didik
Netral,2020,ppdb daerah khusus ibukota jakarta selesai ribu kursi kosong
Netral,2020,kursi kosong sekolah negeri ppdb jakarta jenjang sekolah dasar sd persen kursi
Netral,2020,dinas didik daerah khusus ibukota jakarta kursi sisa ppdb
Netral,2020,ppdb jakarta sisa kursi kosong
Netral,2020,ppdb kursi kosong jakarta sebab kursi kosong tutup ppdb zonasi sekolah lokasi pusat kantor pulau ribu
Netral,2020,ppdb daerah khusus ibukota jakarta polemik syarat usia pbb halo sahabat fema laksana ppdb daerah khusus ibukota jakarta beda guna usia salah faktor timbang terima calon serta didik
Netral,2020,sdn srengseng pagi kembang jakarta barat ada sosialisasi ajar jarak pjj wali murid
Netral,2020,iluni universitas indonesia ada webinar profesional kontra bijak ppdb daerah khusus ibukota jakarta webinar putar inovasi koperasi policy center iluni universitas indonesia ada diskusi unggah kah spotify youtube iluni universitas indonesia diskusi aktivis alumni universitas indonesia
Netral,2020,ppdb jakarta bang
Positif,2020,ipa gara lempar melulu paksa milih ips linjur sih ips enak xixixixix terima kasih ppdb jakarta
Positif,2020,sistem terima serta didik ppdb sisa kisah haru bunda putri sopir angkot hasil lolos favorit jakarta
Positif,2020,cerita ppdb calon siswa keluarga miskin masuk sekolah semangat didik ibukota
Positif,2020,ketua komisi apresiasi bantu siswa lolos ppdb berita jakarta
Positif,2020,anies kecam ppdb anies urus surat miskin siswa daerah khusus ibukota jakarta oleh bantu uang pangkal masuk kah sekolah swasta siswa gagal jalur ppdb total anggar
Positif,2020,untung yaa warga jakarta gubernur peduli uang pangkal perintah provinsi daerah khusus ibukota bantu spp siswa gagal ppdb masuk sekolah swasta
Positif,2020,perintah provinsi daerah khusus ibukota jakarta bantu ribu siswa lolos seleksi daftar ppdb paksa kenyam didik sekolah negeri
Positif,2020,perintah provinsi daerah khusus ibukota jakarta bantu an siswa lolos ppdb kah sekolah swasta
Positif,2020,perintah daerah khusus ibukota jakarta siap dana rupiah miliar bantu siswa sekolah swasta
Positif,2020,dewan wakil rakyat daerah daerah khusus ibukota jakarta awal rencana kucur anggar nila rupiah miliar keluar perintah provinsi daerah khusus ibukota jakarta insentif siswa lulus ppdb masuk sekolah swasta
Positif,2020,bantu perintah provinsi daerah khusus ibukota jakarta uang pangkal siswa sekolah kah swasta siswa dampak pandemi virus corona
Positif,2020,anggar nila rupiah miliar siap perintah provinsi daerah khusus ibukota jakarta bantu didik siswa sekolah sd smp smu lolos ppdb masuk sekolah swasta
Positif,2020,proses ppdb daerah khusus ibukota jakarta tuai polemik ketua komisi dewan wakil rakyat daerah daerah khusus ibukota jakarta nilai proses
Positif,2020,disdik serta kjp lolos ppdb cicil uang pangkal swasta berat keluar biaya didik sekolah swasta kepala dinas didik daerah khusus ibukota jakarta saran siswa terima kjp cicil biaya didik
Positif,2020,teman teman cari narasumber artikel saudara kerabat bagi alam ppdb jakarta mohon bantu
Positif,2020,kompas judul atur ppdb jakarta cuy perintah provinsi daerah khusus ibukota salah daerah atur ppdb nya
Positif,2020,kisruh ppdb daerah khusus ibukota jakarta sekolah swasta usul biaya apbn
Positif,2020,buzzerp bodoh sistem ppdb daerah indonesia ngelakuin serang jakarta mau anjing media buzzerp sampah coba bos gojek nyet
Positif,2020,ppdb depok kayak ppdb jakarta ppdb depok
Positif,2020,amat karang bunga ppdb daerah khusus ibukota jakarta ikut atur permendikbud nomor ppdb laku tiap daerah kirim karang bunga kah kantor anies si kirim salah alamat kirim kah kantor mantan kang gojek
Positif,2020,ppdb perintah provinsi daerah khusus ibukota jalur zonasi pernah langsung kah menteri
Positif,2020,alhamdulillah nge share kasih ppdb jakarta daerah perintah daerah pasti jalan sesuai atur kemendikbud regulator iya si kemendikbud
Positif,2020,heran ppdb demo cuma daerah khusus ibukota jakarta padang bikin atur mendikbud
Positif,2020,mbak bukti ppdb jakarta bijak kemendikbud
Positif,2020,ppdb jakarta saudara laki daerah telanjur sakit hati iya susah kemarin anis antisipasi korona apresiasi hati hitam terlihatjahat
Positif,2020,ppdb jakarta loh sistem zonasi perintah timbul dampak buruk didik daerah anis salah aneh
Positif,2020,ppdb jakarta psi daerah khusus ibukota bantu anak masuk sekolah swasta
Positif,2020,kemendagri fasilitas upaya selesai masalah ppdb daerah khusus ibukota jakarta
Positif,2020,jelas kemendagri kait masalah ppdb daerah khusus ibukota laksana tugas plt sekretaris jenderal kemendagri muhammad hudori temu titik temu masalah kait terima serta didik ppdb daerah khusus ibukota jakarta
Positif,2020,wakil ketua dewan wakil rakyat daerah daerah khusus ibukota jakarta zita anjani janji awal bantu siswa sekolah swasta gagal masuk sekolah negeri
Positif,2020,adduh laku daerah khusus ibukota program bodoh sabut gubernur jakarta salah
Positif,2020,ppdb kena sorot daerah khusus ibukota jakarta iya daerah alami
Positif,2020,kemendagri kemendikbud perintah provinsi daerah khusus ibukota temu titik temu ppdb plt irjen kemendikbud chatarina muliana girsang sinergi perintah provinsi daerah khusus ibukota jakarta kait jalur zona rw
Positif,2020,sahabats hati prihatin fenomena ceroboh implementasi bijak ppdb daerah khusus ibukota jakarta seleksi jalur zonasi mari upaya ubah revisi petisi link
Positif,2020,anies baswedan mari kritik anies tatih tatih urus psbb jakarta bijak presiden jokowi anies tatih tatih urus ppdb jakarta bijak mendikbud silah nalar dibenahidulu
Positif,2020,tvonenews menge tweet amat didik laksana ppdb zonasi daerah khusus ibukota jakarta adil masyarakat tengah kah
Positif,2020,atur ppdb mendikbud iya laku semua sekolah indonesia jakarta salah gubernur
Positif,2020,nadiem aku salah pembully anies diam
Positif,2020,yth nadiem makarim terimakasih atensi harap lurus kisruh ppdb daerah khusus ibukota mendikbud nadiem koordinasi kah mendagri tito
Positif,2020,alhamdulillah masuk ppdb jakarta bun
Positif,2020,mana sekolah favorite dominasi sekolah favorite jenjang ppdb daerah khusus ibukota pakai usia jarak demografi jakarta beda daerah mana jakarta duduk padat mukim
Positif,2020,adik kecewa marah akibat masuk sekolah negeri sistem ppdb semangat
Positif,2020,urus kader psi diri posko bantu warga sulit daftar anak program terima serta didik ppdb moga ruwet terima siswa jakarta atas
Positif,2020,coba teman jateng jawa barat faktor usia ppdb kasihan wan anis senter daerah khusus ibukota jakarta sorot
Positif,2020,amat didik laksana ppdb zonasi daerah khusus ibukota jakarta adil masyarakat tengah kah
Positif,2020,komisi lindung anak indonesia apresiasi solusi ppdb daerah khusus ibukota warna kisruh syarat usia
Positif,2020,update jalur ppdb daerah khusus ibukota jakarta jalur zonasi rumah rw setidakny harap adek sekolah lokasi rw sekolah tuju
Positif,2020,opini sih ppdb daerah khusus ibukota jakarta batal ulang tambah stress otm cpdb baik solusi cpdb lolos seleksi usia
Positif,2020,kabar kemendikbud ppdb daerah khusus ibukota jakarta moga selesai kisruh
Positif,2020,dailami firdaus kisruh ppdb jakarta cari solusi
Negatif,2021,heh yaampun nasib banget beli tiket pesawat panggil tukang benerin rumah jakarta inap eh pas masuk web tiket serasa ppdb masuk
Negatif,2021,teman teman smp bagus banget nasib renung ppdb jakarta
Negatif,2021,poko osis ekskul jabat langsung ajuin biar poin tidak tahu bandung bagamana krna daerah beda sistem ppdb prestasi jakarta jelek banget anjr
Negatif,2021,aa queela keren angkat jakarta ppdb nya pakai umur menang umur pasrah banget tidak bisa masuk smk tertawa ll do my best
Negatif,2021,cerita juli seleksi ppdb daerah khusus ibukota jakarta kecewa
Negatif,2021,terima he masuk negeri maaf kawan rela ppdb jakarta
Negatif,2021,anti lihat ppdb jakarta
Negatif,2021,what ppdb jakarta peluang nya umur tua
Negatif,2021,iyaa banget pas kelas stress pikir gituan tinggal jakarta khawatir ppdb sgjslshal
Negatif,2021,jujurly ginian pas kelas asli pas ppdb gitu disaranin masuk jakarta biar berangkat emak untung gajadi
Negatif,2021,semangat iya ajar dom jakarta sistem ppdb kacau banget tertawa dom jakarta iya aman korban ppdb jakarta
Negatif,2021,iya swasta numpang kakak masuk smp pas biar masuk smp negeri jakarta ppdb jakarta ygsekarang aneh lohh pakai zona prioritas pakai retweet rw gapake jarak sekolah kah rumah yaa adh aneh deh malas banget malas ppdb
Negatif,2021,terima jalur zonasi swasta kuota membludak anak terima dapat kepala bersit asa anak
Negatif,2021,anak tahan geser tambah nilai logis mohon pantau terimakasih
Negatif,2021,yth bantu cek nilai seleksi nilai normal nilai segitu knapa daftar akademi jalur lolos update nilai oknum
Negatif,2021,capek iya korban ghosting ppdb jakarta bulan jalur pental kemarin tahap pental kursi dikit banget daftar swasta tutup nasib stress banget
Negatif,2021,ppdb jakarta banget si iya allah minggat
Negatif,2021,saat didik pihak anak anak salah kaum vandal tumbuh subur
Negatif,2021,ppdb jakarta kacau
Negatif,2021,rasany lolos japres kalah osis ekstra rasany lolos afirmasi kjp rasany lolos zonasi umur rasnay lolos tahap persentil sidanira dikit banget bangku kosong kena mental men ppdb tahap jakarta
Negatif,2021,ppdb jakarta bangsat
Negatif,2021,please sekolah mana cobaa tolak sekolah ppdb tahap jakarta pliss kalah japres persentil zonasi kalah umur tahap persentil sii woii
Negatif,2021,capek ppdb jakarta gajelas
Negatif,2021,sekian jam buka tampil masuk
Negatif,2021,serius perintah sistem ppdb jakarta jalur zonasi pakai umur jarak nilai stress umur muda
Negatif,2021,bulan stress ppdb jakarta aneh
Negatif,2021,web ppdb jakarta eror huhu
Negatif,2021,ppdb jakarta makan gaji buta gajelas atur kasi anak
Negatif,2021,ppdb jakarta tolong pecat pegawai pegawai tidak bisa kerja bijak gamasuk akal gila atur kola iya pakai nilai umur
Negatif,2021,ppdb jakarta gajelas
Negatif,2021,oalah jakarta offline iya jakarta ppdb online lupa online servernya heran ubah tahun
Negatif,2021,kasihan banget lihat pasrah tunggu sisa kursi sekolah ppdb uras emosi
Negatif,2021,ppdb jakarta kacau banget sistem prestasi pakai umur amppersentil sistem zonasi pakai umur deh umur muda pintar kalah umur
Negatif,2021,ppdb jakarta ngaretnya lebih ih sia sia bangun pagi anjing
Negatif,2021,ppdb jakarta sistem ngeselin
Negatif,2021,ppdb jakarta tahap pilih skolah jam
Negatif,2021,ppdb jakarta bagamana sii daftarin sepupu biar cepat milih skolah
Negatif,2021,ppdb jakarta pilih sekolah nya
Negatif,2021,tahap tulis pilih sekolah sumpaahh takut bnget
Negatif,2021,welcome to jakarta mana ppdb jalur prestasi nilai akademik nilai non akademik welcome to jakarta mana ppdb jalur zonasi terima umur tua
Negatif,2021,heh iya sih kaget ppdb jakarta untung ku sistem umur nilai
Negatif,2021,lihat ppdb negeri daerah khusus ibukota salah kualitas jakarta barat siswa terima atas usia bawah terima pihak adil carut marut bijak
Negatif,2021,orangtua protes ppdb zonasi jakarta jarak meter lolos gara gara kalah umur klik baca paksa kalah sistem paksa sekolah saing tua kasi dd
Negatif,2021,sistem ppdb jakarta hancur hancur
Negatif,2021,ppdb jakarta anjing
Negatif,2021,umur kartu tanda duduk kerja umur kartu tanda duduk kerja calon siswa masuk swasta
Negatif,2021,ngeselin pakai umur zonasi lebih baik kemarin jalur prestasi pakai rapot masuk anj nilai
Negatif,2021,tunggu action nya orang tua pusing covid beban ppdb
Negatif,2021,semangat yaa dom jakarta pusing banget masuk ppdb sistem gajelas kemarin zonasi kalah umur semangat kamuu fighting jalan keluarr
Negatif,2021,gajelas banget bolol orang kualitas negeri jakarta jelek gede rasa ppdb saudara laki main kah jakarta biar keras nya bagamana didik ngerasain kgk
Negatif,2021,bubarkaan bikin rusak generasi terus bodoh sistem
Negatif,2021,aduh kasi deh cilandak barat tidak punya negeri
Negatif,2021,pusing banget ppdb jakarta umur menit langsung kah gepak kereta cepat
Negatif,2021,ppdb jakarta stress anjing
Negatif,2021,hah ppdb jakarta pakai umur
Negatif,2021,iya salah banget ppdb jakarta iya masuk jdnya swasta sedih banget
Negatif,2021,ppdb daerah khusus ibukota masalah didik kualitas umur kualitas keluarga jakarta sekolah swasta pilih gap year timbul gunung es kah depan tolong hormat timbang ulang
Negatif,2021,orang jakarta kesel ppdb zonasi terima jing duhh gni gaush pikir nilai umur tua
Negatif,2021,plss depresot banget ppdb jakarta sistem zonasi adil
Negatif,2021,tua sekolah muda hancurr
Negatif,2021,jalur umur mah jalur zonasi badut banget ppdb jakarta
Negatif,2021,ppdb jakarta masuk deh
Negatif,2021,lelah sistem ppdb jakarta
Negatif,2021,bohong banget ppdb jakarta
Negatif,2021,gimanasi ppdb jakarta katamya zonasi pakai umur aneh
Negatif,2021,rebut booking vaksin jakarta bikin sakit perut asa ppdb
Negatif,2021,tolong iya mah tua terima jarak nya mksdny gman iya lahir nya mana umur anak terima erti jalan fikir perintah nerapin sistem ppdb jakarta orang sekolah
Netral,2021,dom jakarta pengaruh nder kemarin ppdb pakai rapot smstr
Netral,2021,nder coba search ppdb sebentar muncul nilai murni ppdb jakarta bidang prestasi dar informasi kuat nilai lomba lomba urus ekskul
Netral,2021,lombanyaa kapann soalya ppdb jakarta gasalaa lomba maksimal daftar ppdb gituu
Netral,2021,daerah jakarta pakai zona zona nder ppdb kemarin kalo jarak kah sekolah gamasuk zona utama jakarta deh
Netral,2021,ikut tes seleksi ppdb madrasah istiqlal jakarta lewat iya sabtu desember
Netral,2021,presentasi ppdb smp jakarta
Netral,2021,presentasi ppdb smp jakarta
Netral,2021,tim ppdb ajar kunjung kah smp jakarta
Netral,2021,indonesia
Netral,2021,indonesia
Netral,2021,kemarin ngecek ppdb jakarta sd negeri inceran masuk usia mudah an nadim lolos deh smp negeri mbak meth sd swasta smp nya negeri
Netral,2021,iya semacem sertif urus osis iya sekolah dilampirin gituu kayak nilai plus ngomong-ngomong ppdb jakarta
Netral,2021,yahh ppdb tidak bisa iya jakarta deh
Netral,2021,ppdb daerah khusus ibukota jakarta daftar swasta libat serta kuota
Netral,2021,ppdb daerah khusus ibukota jakarta daftar swasta libat serta kuota
Netral,2021,ppdb daerah khusus ibukota jakarta daftar swasta libat serta kuota
Netral,2021,ppdb daerah khusus ibukota jakarta daftar swasta libat serta kuota
Netral,2021,ppdb daerah khusus ibukota jakarta daftar swasta libat serta kuota
Netral,2021,ppdb daerah khusus ibukota jakarta daftar swasta libat serta kuota
Netral,2021,ppdb daerah khusus ibukota jakarta daftar swasta libat serta kuota
Netral,2021,ppdb daerah khusus ibukota jakarta daftar swasta libat serta kuota
Netral,2021,ppdb daerah khusus ibukota jakarta daftar swasta libat serta kuota
Netral,2021,ppdb daerah khusus ibukota jakarta daftar swasta libat serta kuota
Netral,2021,ppdb daerah khusus ibukota jakarta daftar swasta libat serta kuota
Netral,2021,smk jakarta timur ppdb jakarta selatan
Netral,2021,deh jakarta timur ppdb jakarta selatan
Netral,2021,ppdb daerah khusus ibukota jakarta daftar swasta libat serta kuota
Netral,2021,ppdb daerah khusus ibukota jakarta daftar swasta libat serta kuota
Netral,2021,ppdb daerah khusus ibukota jakarta daftar swasta libat serta kuota
Netral,2021,ppdb daerah khusus ibukota jakarta daftar swasta libat serta kuota
Netral,2021,sd kartika jaya jakarta kepala sekolah pamuji sukses baik daerah khusus ibukota jakarta tips beliau guru anak orang tua ajar ppdb pandemi ayo poin teman
Netral,2021,ngomong-ngomong ppdb jakarta iya coba ppdb kota
Netral,2021,catat alur ppdb sd jalur zonasi jakarta
Netral,2021,adik lulus smp kah ikut ppdb daerah khusus ibukota jakarta beuh iya ampun deg degan
Netral,2021,buka besok tata daftar ppdb sekolah negeri swasta jakarta
Netral,2021,catat alur ppdb sd jalur zonasi jakarta
Netral,2021,total calon serta didik cpd advokasi tanggal juni juli posko ppdb psi jakarta hasil terima sekolah pilih
Netral,2021,ppdb daerah khusus ibukota jakarta daftar swasta libat serta kuota
Netral,2021,catat alur ppdb sd jalur zonasi jakarta
Netral,2021,stud teman sistem ppdb jakarta japres terima kasih
Netral,2021,simak jadwal lengkap ppdb madrasah daerah khusus ibukota jakarta jenjang mi mts
Netral,2021,anies baswedan batal sistem zonasi ppdb daerah khusus ibukota jakarta tandatangani petisi
Netral,2021,ombudsman jakarta raya panggil kadisdik provinsi jawa barat kait ppdb jenjang smk wilayah bogor depok bekas
Netral,2021,ombudsman jakarta raya layang panggil kadisdik jawa barat kait ppdb smk bodebek
Netral,2021,dalam lapor kait ppdb smk bodebek ombudsman panggil kadisdik jawa barat masalah lapor ombudsman jakarta raya duga tindak malaadministrasi usul kuota siswa proses nilai
Netral,2021,jakarta ri depok ribet ppdb yak
Netral,2021,ppdb jakarta jalur zonasi umur lolos kayak
Netral,2021,kamis komisioner komisi lindung anak indonesia retno listyarti amp tim awas ptm ppdb sman jakarta komisi lindung anak indonesia jelas kait laksana vaksin anak usia masif libat pihaksekolah puskemas dekat
Netral,2021,beda ppdb daerah khusus ibukota jakarta ombudsman temu duga maladministrasi ppdb bodebek
Netral,2021,ppdb jakarta yogyakarta so junghwan one tweet angkat udara gionashe
Netral,2021,ombudsman periksa kadisdik provinsi jawa barat provinsi banten ihwal duga langgar laksana ppdb ajar ppdb daerah khusus ibukota jakarta catat minor
Netral,2021,simak jadwal lengkap ppdb madrasah daerah khusus ibukota jakarta jenjang mi mts
Netral,2021,anies baswedan batal sistem zonasi ppdb daerah khusus ibukota jakarta tandatangani petisi
Netral,2021,ombudsman periksa kepala dinas didik provinsi jawa barat provinsi banten ihwal duga langgar laksana terima serta didik ppdb ajar laksana ppdb daerah khusus ibukota jakarta
Netral,2021,assalamualaikum warahmatullahi wabarakatuh informasi ppdb smk gita kirtti jakarta barangkali bingung cari sekolah putra putri smk gita kirtti terima daftar siswa terima kasih perhati wassalamualaikum wr wb
Netral,2021,laksana ppdb ajar jakarta
Netral,2021,tutup ppdb tanggal juli homeschooling talenta jakarta timur
Netral,2021,ppdb daerah khusus ibukota jakarta daftar swasta libat serta kuota
Netral,2021,ppdb smk gita kirtti jakarta buka daftar jangkau daftar anak saudara tetangga kah sekolah bidang managemen bisnis maju
Netral,2021,ngetweet ppdb jakarta
Netral,2021,
Netral,2021,
Netral,2021,informasi ppdb daerah khusus ibukota jakarta sila hubung call center jam kerja telepon hotline telepon posko dinas terima kasih
Netral,2021,assalamu alaikum wr wb putra ayah bunda pilih sekolah daftar batas
Netral,2021,informasi ikut instagram
Netral,2021,ombudsman wakil jakarta raya temu duga malaadministrasi ppdb tingkat smk bodebek
Positif,2021,si nder aktif ppdb ppdb jakarta masuk kah organisasi urus ekskul peran nderr coba lakuin kah negeri
Positif,2021,daerah khusus ibukota bagus ppkm salur bansos juta kakak hak program vaksin ajar tatap muka ppdb lancar dead rate covid tinggi turun jakarta pintar jakarta linko warga daerah iri daerah khusus ibukota
Positif,2021,mas goldy papar dampak positif ppdb daerah khusus ibukota jakarta tuai profesional kontra rapat sesuai data latar ekonomi keluarga siswa data tingkat ekonomi kelompok masyarakat daerah khusus ibukota jakarta
Positif,2021,kemarin ppdb jakarta osis jabat osisnya lumayan banget tambah nilai
Positif,2021,ppdb alhamdulillah nya terima salah negeri jakarta pusat poin utama angkat smp ppdb alias gapyear langsung kah
Positif,2021,komisi lindung anak indonesia ppdb daerah khusus ibukota jakarta libat sekolah swasta patut tiru
Positif,2021,korban ppdb jakarta usaha maximal ips rezeki jjr sedih banget asli kacau banget pas terima ips swasta ekonomi bagus yaudahlah ipa inti semangat linjur
Positif,2021,kjp lebih baik daftar tahap swasta biar bagi sekolah swasta kosong ppdb jakarta
Positif,2021,orang tua saran ppdb jamin masuk sekolah tuju beli rumah retweet rw sekolah tuju anak gapyear main sd smp bagus main
Positif,2021,kemarin sore unjung posko ppdb terima serta didik sekolah sman jakarta terima siswa jalan lancar catat aspirasi terima tindak kah dinas kait
Positif,2021,jalur zonasi rumit sih makan pas japres hantem an sekolah sekolah impi sekolah swasta sakit hati terima nilai masuk sekolah
Positif,2021,ppdb jakarta bagus pantau calon serta didik kudet sistem
Positif,2021,semangat ppdb jakarta minggu kemarin ngurusin ppdb tidur alhamdulillah selesai
Positif,2021,terima jakarta nama daftar seleksi login ulang daftar pilih sman zona nya muncul status terima terima terima daftar semangat
Positif,2021,mbak jakarta usul jogja nemu kendala daftar sekolah langsung kah dinas didik konsul sana arah beres kecuali langgar atur ppdb
Positif,2021,hai sekolah jakarta coba hubung bberapa orang tolong anak kawan ancam sekolah gusur ppdb daerah khusus ibukota merespon terimakasih iya
Positif,2021,penuh minta masyarakat psi jakarta buka posko layan ppdb titik daerah khusus ibukota jakarta
Positif,2021,ppdb jawa barat hasil seleksi tidak bisa pantau ppdb jakarta iya
Positif,2021,hallo sahabatdisdik perintah provinsi daerah khusus ibukota jakarta program ppdb program dinas didik provinsi daerah khusus ibukota jakarta kolaborasi sekolah swasta tingkat daya tampung serta didik tingkat tara mutu didik
Positif,2021,hebat posko ppdb jakarta professional amp layan masyarakat sungguh salut pindah kah jakarta pindah kknya genap tahun takut bingung daftar skolah
Positif,2021,ppdb jakarta bagus
Positif,2021,siang ecek jalan ppdb sman manggis jakarta barat proses atur banding catat optimal depan
Positif,2021,terima kasih percaya warga manfaat layan posko ppdb psi jakarta ayo maanfaatkan layan damping daftar ppdb online gratis cek thread informasi kontak lokasi layan
Positif,2021,temu proses ppdb jakarta loh lapor kah kanal adu milik perintah provinsi daerah khusus ibukota jakarta lapor masalah ppdb baca artikel iya
Positif,2021,deh kecewa sistem sumpah yaa doain iya kakak nyoba jalur zonasi terima semangat menyerahh jalur okee always doa yaa love love
Positif,2021,kemarin sila cpdb meng update data sidanira buka peluang siswa menginput data tambah urus siswa osis ekskul siswa orang tua buru hadap sekolah bawa bukti tambah urus osis ekskul
Positif,2021,perintah daerah khusus ibukota jakarta gandeng sekolah swasta tambah daya tampung calon siswa jalur afirmasi terima serta didik ppdb kerja utama lurah milik sekolah
Positif,2021,keren anies beres menteri daftar ppdb
Positif,2021,keren anies beres menteri daftar ppdb
Positif,2021,jakarta update posko ppdb partai adil sejahtera pasar rebo bantu masyarakat
Positif,2021,keren anies beres menteri daftar ppdb
Positif,2021,kriteria nilai seleksi jalur prestasi ppdb daerah khusus ibukota jakarta sila adik anggota keluarga sekolah motivasi
Positif,2021,komisi lindung anak indonesia ppdb daerah khusus ibukota jakarta libat sekolah swasta patut tiru
Positif,2021,ppdb daerah khusus ibukota jakarta libat sekolah swasta pilih didik calon siswa biaya spp siswa terima gratis detikedu
Positif,2021,wakil gubernur daerah khusus ibukota ppdb online jakarta
Positif,2021,ppdb jakarta utara jalan
Positif,2021,perintah kota administrasi jakarta utara laksana daftar serta didik ppdb kendali
Positif,2021,ppdb dinas didik hilang stigma sekolah negeri favorit sekolah negeri jakarta milik mutu bentuk sekolah sekolah negeri variasi serta didik gotong royong maju
Positif,2021,apresiasi disdik provinsi daerah khusus ibukota jakarta layan masyarakat ppdb
Positif,2021,gubernur daerah khusus ibukota jakartaanies baswedanmemastikan masalah situsppdbdki jakarta beres tangan
