sentimen,tahun,tweet
Netral,2018,informasi ppdb menghubungi telepon hunting extension tidak sd smp sma smk smk
Netral,2018,ppdb sdn dki jakarta tidak sertakan kia
Netral,2018,informasi ppdb sds regina pacis jakarta
Netral,2018,ppdb smk telekomunikasi jakarta penerimaan peserta didik ta dibuka informasi smk telekomunikasi sekolah jakarta
Netral,2018,ombudsman perwakilan jakarta raya menemukan dugaan pelanggaran maladministrasi penerimaan peserta didik ppdb online bogor depok bekasi
Netral,2018,informasi pendaftaran ppdb smk telekomunikasi jakarta ta keterangan silahkan hubungi petugas ppdb nomor nomor prosedur
Positif,2018,radar bogor sleman apresiasi ppdb sistem zonasi jakarta radar bogor
Positif,2018,dilayani denga baik posko ppdb online dki jakarta admin memantau proses pelayanan posko
Positif,2018,admin memantau kunjungan gubernur dki jakarta posko ppdb online dki jakarta alhamdulillah ppdb dki jakarta berjalan lancar aman terkendali
Positif,2018,alhamdulillah ppdb sma negeri tahap selesai yartika diterima sma negeri jakarta
Positif,2018,sore ppdb jakarta tahap jalur lokal sman ditutup dinyatakan kandidatnya terima keren proses seleksinya
Positif,2018,overload servernya tenggang diperpanjang jakarta bagus ppdb
Positif,2018,penjelasan pemerintah daerah jakarta berkomitmen anak imunisasi pemerintah daerah tidak anak gagal sekolah belum imunisasi ppdb screening riwayat calon murid jalan baik
Negatif,2019,presiden terbaik seumur hidupku ppdb dki jakarta provinsi indonesia tidak pakai sistem zonasi kasihan tidak sekolah dinegri tidak kebijakan jokowi sekolah gratis
Negatif,2019,ppdb dki jakarta provinsi indonesia tidak pakai sistem zonasi kasihan tidak sekolah dinegri tidak kebijakan jokowi yaitus sekolah gratis
Negatif,2019,rekapin hasil ppdb jakarta bocahnya kelas tertawa
Negatif,2019,ombudsman sesalkan dki jakarta tidak terapkan ppdb zonasi
Negatif,2019,ombudsman sesalkan dki jakarta tidak terapkan ppdb zonasi
Negatif,2019,ombudsman sesalkan dki jakarta tidak terapkan ppdb zonasi
Negatif,2019,merengking ppdb online dki jakarta tidak memenuhi aturan keterangan gambar nilai inisial siswa nilai inisial siswa seleksi tayang online inisial tayang
Negatif,2019,pindah domisili lolos sistem zonasi ppdb jakarta sia sia
Negatif,2019,frustrasi ppdb jakarta
Negatif,2019,ppdb dki jakarta sangat kacau sekolah
Negatif,2019,to admin maaf sistem zonasi seleksi masuk ppdb sman jakarta barat berdasarkan jarak rumah selokah tujuan terdekat grading by nilai tertinggi orang tua murid sistem zonasi ttpby nilai
Negatif,2019,ppdb jalur zonasi sma jakarta diwarnai keluhan pelayanan
Negatif,2019,orang tua keluhkan proses ppdb sistem zonasi jakarta
Negatif,2019,notice besok ppdb jakarta dibuka zonasi dihapus ppdb ulang nilai bagus mati matian belajar keluarin uang hasilnya bodoh lebih baik tidak perlu sekolah biar pendidikan indonesia bobrok
Negatif,2019,ganti model ppdb bingung orang pandai jakarta dunia pendidikan uji coba sistem ayo bimbingan ki dewantoro
Negatif,2019,orangtua murid nilai sistem zonasi ppdb tidak adil
Netral,2019,pengantaran prakerin jakarta ppdb dibuka pendfataran
Netral,2019,smp muhammadiyah jakarta jalan tebet timur ii nomor tebet jakarta selatan jakarta selatan informasi penerimaan peserta didik ppdb pelajaran smp muh
Netral,2019,besok juni ppdb madrasah dki jakarta diumumkan
Netral,2019,prestasi simak mendaftar ppdb dki jakarta jalur prestasi
Netral,2019,prestasi simak mendaftar ppdb dki jakarta jalur prestasi
Netral,2019,syarat lengkap ppdb online jenjang smp sma dki jakarta
Netral,2019,besok juni ppdb madrasah dki jakarta diumumkan
Netral,2019,smp muhammadiyah jakarta jalan tebet timur ii nomor tebet jakarta selatan jakarta selatan informasi penerimaan peserta didik ppdb pelajaran smp muh
Netral,2019,pendaftaran ppdb online sd provinsi dki jakarta
Netral,2019,simak ketentuan jadwal jalur zonasi ppdb sma dki jakarta
Netral,2019,hasil ppdb madrasah man dki jakarta diumumkan cek
Netral,2019,ppdb smk santa theresia jakarta
Netral,2019,passing grade hasil ppdb smp dki jakarta
Netral,2019,sma jurusan bahasa ppdb dki jakarta
Netral,2019,prestasi simak mendaftar ppdb dki jakarta jalur prestasi
Netral,2019,hasil ppdb madrasah man dki jakarta diumumkan cek
Netral,2019,mendikbud jakarta penuhi syarat terapkan ppdb zonasi penuh mendikbud muhadjir
Netral,2019,mendikbud jakarta penuhi syarat terapkan ppdb zonasi penuh mendikbud muhadjir
Netral,2019,smk jakarta pusat ppdb nyimas
Netral,2019,pengumuman hasil ppdb madrasah man dki jakarta
Positif,2019,ppdb dki jakarta selamat diterima sekolah negeri belum diterima jangan putus asa admin hibernasi menjelang ppdb selamat semangat
Positif,2019,alasan penulis status tidak pajang foto presiden kagum ppdb dki
Positif,2019,setuju kemarin coba advokasi kebijakan ppdb alhamdulillah jakarta tidak daerah coba diskusi perbaikan paud terkait konstruksi dinas pendidikan belum paham konstruksi desain ramah anak
Positif,2019,semoga mengevaluasi aturan ppdb jadikan jakarta percontohan sukses terapkan daerah tidak evaluasi mohon copot mendikbudnya
Positif,2019,jakarta dipimpin penerimaan siswa alias ppdb tidak ribet tidak pakai antri pagi syarat daftar sekolah pakai nilai un pakai meteran wali murid terima kasih anies baswedan
Positif,2019,sistem ppdb dki jakarta bijaksana akomodatif menyalurkan aspirasi warganya pendidikan adil layak memperhatikan keseimbangan lingkungan kota penduduk
Positif,2019,dibantuin admin fast respon dimasa ppdb jakarta non dki banget jasa informasinya dimasa genting ppdb sangat terbantu didoain berkah murah rezeki belum ketemu jodoh dipertemukan terbaik terima kasihbanyak
Positif,2019,lancar ppdb jakarta digagas anies baswedan rujukan swamedium
Positif,2019,lancar ppdb jakarta digagas anies baswedan rujukan swamedium
Positif,2019,opini ppdb jakarta fair transparan
Positif,2019,lancar fahira idris ppdb jakarta rujukan kota
Positif,2019,lancar ppdb jakarta rujukan kota
Positif,2019,lancar ppdb jakarta rujukan kota
Positif,2019,lancar ppdb jakarta rujukan kota
Positif,2019,lancar ppdb jakarta rujukan kota
Positif,2019,ppdb jakarta dinilai rujukan baca
Positif,2019,kepala dinas pendidikan kadisdik dki jakarta ratiyono menilai penerapan sistem zonasi sekolah penerimaan peserta didik ppdb jakarta adil
Positif,2019,kadisdik dki klaim penerapan zonasi ppdb jakarta sangat adil
Positif,2019,kadisdik dki klaim penerapan zonasi ppdb jakarta sangat adil
Positif,2019,kadisdik dki jakarta menilai penerapan sistem zonasi sekolah ppdb jakarta adi
Positif,2019,kepala dinas pendidikan kadisdik dki jakarta ratiyono menilai penerapan sistem zonasi sekolah penerimaan peserta didik ppdb jakarta adil
Positif,2019,lancar ppdb jakarta digagas anies baswedan rujukan
Positif,2019,mengular antrean ppdb sma jakarta kondusif
Positif,2019,dukung penerapan sistem zonasi ppdb wali murid peluang diterima sekolah unggulan
Positif,2019,heboh ppdb online jakarta anteng untungnya online perubahan baik daerah jalur ppdb amp zonasi nem patokannya
Positif,2019,setuju dukung admin menyeleksi pakai nilai un jangan dengarkan kepanasan gara gara nemnya tertawa bagus job ppdb jakarta
Positif,2019,pelaksanaan penerimaan peserta didik ppdb dki jakarta berjalan kondusif fsgi kemendikbud mencontoh pemerintah provinsi dki jakarta penerapan sistem zonasi ppdb pengalaman teman teman mengurus
Positif,2019,ppdb dki jakarta dianggap baik dicontoh
Positif,2019,warga apresiasi pelaksanaan ppdb online jalur inklusi jakarta
Positif,2019,warga kelurahan rawa badak selatan koja jakarta utara mengapresiasi jalur inklusi penerimaan peserta didik ppdb online calon pelajar tingkat sd sma smk
Negatif,2020,maaf bos founder tidak ada uang surabaya merdeka bos tertawa sukarno lahir jakarta kota kelahiran umur si ppdb pakai umur niat sekolah tidak tertawa
Negatif,2020,kadisdik dki jakarta blunder ramai kemarin blunder ppdb ujian suka banget blunder tidak tidur nyenyak viral ditelusuri maksud ujian
Negatif,2020,fix ppdb jakarta kepental melulu
Negatif,2020,akibatnya tidak kerja patung masker atap rumah warga fly over tapal kuda cat ganjil genap motor diberlakukan ppdb jakarta umur acuan
Negatif,2020,gubernur anies baswedan baswedan dinas pendidikan dki jakarta digugat ptun dki ppdb ppdb dki seleksi usia melanggar aturan kemendikbud
Negatif,2020,orang tua murid memasukkan gugatan pemerintah provinsi dki jakarta ptun jakarta menerapkan syarat diskriminatif ppdb online merugikan keberlangsungan pendidikan bermutu siswa murid
Negatif,2020,sosialisasi buruk
Negatif,2020,sosialisasi buruk
Negatif,2020,sosialisasi buruk
Negatif,2020,sosialisasi buruk
Negatif,2020,sosialisasi buruk
Negatif,2020,tidak nonton berita ppdb dki jakarta bermasalah
Negatif,2020,demo anies baswedan terkait ppdb dki jakarta solusinya anies baswedan jangan sembunyi baik
Negatif,2020,sadar tidak pelaksanaan penerimaan peserta didik ppdb meninggalkan persoalan jakarta menerima laporan ratusan siswa belum terdaftar sekolah terancam putus sekolah
Negatif,2020,pelajar peraih ratusan penghargaan aristawidya maheswari memperoleh tawaran melanjutkan pendidikan sma sekolah swasta jakarta gagal lolos seleksi negeri
Negatif,2020,kritik anies baswedan ppdb reklamasi presidium barometer jakarta gelar aksi demonstrasi
Negatif,2020,komisi perlindungan anak indonesia komisi perlindungan anak indonesia menyebut siswa tidak lolos penerimaan peserta didik ppdb dki jakarta kisruh syarat usia baca
Negatif,2020,kids belum heboh berita siswi bernama aristawdya maheswari siswi umur berhasil mememiliki piala perhargaan gagal diterima sma negeri jakarta seleksi penerimaan peserta didik ppdb
Negatif,2020,ppdb zonasi dihujani kritik ribuan kursi kosong sekolah jakarta tidak terisi
Negatif,2020,menerapkan sistem ppdb zonasi diknas dki memperhitungkan mensosialisasikan sistem enak kursi kosong jangan smp kursi kosong diperjual belikan loh sekolah favorit jakarta
Negatif,2020,lembaga swadaya masyarakat gmbi dki jakarta menuntut gubernur dki jakarta ppdb dicabut
Negatif,2020,swasta dicampuri bang wali murid rebutan cari sekolah negeri ppdb jakarta kemarin gratis spp dan lain-lain buku dipinjamkan sekolah swasta pindah negeri demi gratis seleksi kacau
Negatif,2020,dikritisi sistem ppdb kacau ditambah model zonasi tidak parah jakarta pakai sistem umur sekolah belum disamakan kasian anak pintar sekolah tidak mendukung halo
Negatif,2020,kebijakan normalisasi sungai jakarta formula monas mengorbankan pohon mahoni penanganan covid bantuan korban dampak pandemi ambur adul ppdb mengorbankan anak berprestasi ketidakmampuanmu anies baswedan baswedan
Negatif,2020,orangnya tidak dendam nyesel kecewa tidak kadang kecewa ppdb zonasi pakai umur oktober harapan japres anak negeri kalah swasta masuk smp netapin masuk sman jakarta sekolah
Negatif,2020,tidak habis fikir kenal orang model emak maki anaknya tidak keterima sekolah negeri gara aturan ppdb jakarta tidak disalahin mendikbud
Negatif,2020,iyaa dipindah kerjanya januari udah malas ppdb jakarta ambon huhu
Negatif,2020,lihat ppdb jakarta paling muda nya tidak salah nyoba jakarta anjing auto swasta
Negatif,2020,tidak tahu lelah banget ppdb jakarta
Negatif,2020,gubernur covid konpres melulu ppdb jakarta diam bodoh
Negatif,2020,kadis pendidikan dki jakarta kebijakan ppdb batas usia akibatnya orang tua pusingg mencari uang daftar anak sekolah swasta konyoll
Negatif,2020,rencana pemerintah dki jakarta anak gagal diterima ppdb ortunya tidak sanggup daftarkan sekolah swasta mahal bagamana
Negatif,2020,semoga orang membiayai melanjutkan skolah adik tidak lolos ppdb jakarta pelajar peraih ratusan penghargaan putus sekolah
Negatif,2020,dewan perwakilan rakyat daerah dki jakarta diam seribu bahasa orang tua siswa dirugikan disusahkan aturan usia ppdb dki jakarta kepala dinas pendidikan anehh perwakilan rakyat kampanye saudara laki-laki mengaku mengaku berjuang rakyat kasihan deh
Netral,2020,jakarta indonesia
Netral,2020,pelajaran sekolah online adik adik semangat belajar kilas ayo jalur ppdb disiapkan pemerintah provinsi dki sih jalur
Netral,2020,tidak baca web nya ppdb jakarta just case
Netral,2020,sejarah mencatat ppdb dki jakarta
Netral,2020,kisruh penerimaan peserta didik ppdb dki jakarta perbincangan
Netral,2020,anies baswedan baswedan kajian penyaluran bantuan siswa gagal ppdb
Netral,2020,pelaksanaan sosperda nomor kepemudaan ketua fraksi nasdem dewan perwakilan rakyat daerah dki jakarta wibi andrino kesempatan menyerap aspirasi kesehatan ppdb dki pelatihan umkm online
Netral,2020,dinas pendidikan dki jakarta menanggapi kabar siswa berprestasi bernama aristawidya maheswari gadis kerap disapa arista gagal lolos ppdb dki memiliki prestasi
Netral,2020,ajaran kursi kuota penerimaan peserta didik ppdb dki jakarta kosong
Netral,2020,nama mengadukan nasibnya komisi perlindungan anak indonesia gagal lolos ppdb dki daftar diserahkan dinas pendidikan dki jakarta ditindaklanjuti
Netral,2020,ppdb jakarta resmi ppdb jakarta menambah syarat usia peserta didik
Netral,2020,ppdb dki jakarta selesai ribuan kursi kosong
Netral,2020,kursi kosong sekolah negeri ppdb jakarta paling jenjang sekolah dasar sd persen kursi
Netral,2020,dinas pendidikan dki jakarta kursi tersisa ppdb
Netral,2020,ppdb jakarta sisakan kursi kosong
Netral,2020,ppdb kursi kosong jakarta penyebab kursi kosong penutupan ppdb zonasi sekolah berlokasi pusat perkantoran kepulauan seribu
Netral,2020,ppdb dki jakarta polemik persyaratan usia pbb halo sahabat fema pelaksanaan ppdb dki jakarta perbedaan penggunaan usia salah faktor pertimbangan penerimaan calon peserta didik
Netral,2020,sdn srengseng pagi kembangan jakarta barat mengadakan sosialisasi pembelajaran jarak pjj wali murid
Netral,2020,iluni universitas indonesia mengadakan webinar profesional kontra kebijakan ppdb dki jakarta webinar seputar inovasi koperasi policy center iluni universitas indonesia mengadakan diskusi diunggah spotify youtube iluni universitas indonesia diskusi aktivis alumni universitas indonesia
Netral,2020,ppdb jakarta bang
Positif,2020,ipa gara kelempar melulu terpaksa milih ips linjur sih ips enak terima kasih ppdb jakarta
Positif,2020,sistem penerimaan peserta didik ppdb menyisakan kisah haru bunda putri sopir angkot berhasil lolos sma favorit jakarta
Positif,2020,cerita ppdb calon siswa keluarga miskin masuk sekolah semangat pendidikan ibukota
Positif,2020,ketua komisi apresiasi bantuan siswa tidak lolos ppdb berita jakarta
Positif,2020,beruntung yaa warga jakarta gubernur sangat peduli uang pangkal pemerintah provinsi dki bantu spp siswa gagal ppdb masuk sekolah swasta
Positif,2020,proses ppdb dki jakarta menuai polemik ketua komisi dewan perwakilan rakyat daerah dki jakarta menilai proses baik
Positif,2020,tvonenews menge tweet pengamat pendidikan pelaksanaan ppdb zonasi dki jakarta keadilan masyarakat menengah
Positif,2020,alhamdulillah masuk ppdb jakarta
Positif,2020,pengurus kader psi dirikan posko bantu warga kesulitan daftarkan anaknya program penerimaan peserta didik ppdb semoga keruwetan penerimaan siswa jakarta teratasi
Positif,2020,pengamat pendidikan pelaksanaan ppdb zonasi dki jakarta keadilan masyarakat menengah
Positif,2020,kabar baik kemendikbud ppdb dki jakarta semoga menyelesaikan kekisruhan
Negatif,2021,pokonya osis ekskul jabatannya langsung ajuin biar poin tidak tahu bandung bagamana krna daerah beda sistem ppdb prestasinya jakarta jelek banget anjr
Negatif,2021,aa queela keren seangkatan jakarta ppdb nya pakai umur menangis umur pasrah banget tidak bisa masuk sma smk tertawa ll do my best
Negatif,2021,ppdb jakarta makan gaji buta gajelas peraturannya kasian anak
Negatif,2021,ppdb jakarta tolong pecat pegawai pegawai tidak bisa kerja kebijakan gamasuk akal gila peraturannya sekola pakai nilai umur
Negatif,2021,ppdb jakarta gajelas
Negatif,2021,oalah luar jakarta offline jakarta ppdb online lupa online servernya heran tidak berubah bertahun
Negatif,2021,kasihan banget lihat pasrah menunggu sisa kursi sekolah ppdb menguras emosii
Negatif,2021,ppdb jakarta kacau banget sistem prestasi pakai umur amppersentil sistem zonasi pakai umur deh umur muda pintar kalah umurnya
Negatif,2021,ppdb jakarta ngaretnya kelebihan ih sia sia bangun pagi anjing
Negatif,2021,ppdb jakarta sistemnya ngeselin
Negatif,2021,ppdb jakarta bagamana sii daftarin sepupu biar cepat tidak milih skolah
Negatif,2021,ppdb jakarta tidak pilihan sekolah nya
Negatif,2021,ppdb jakarta stress anjing
Negatif,2021,salah banget ppdb jakarta masuk sma jdnya swasta sedih banget
Negatif,2021,ppdb dki bermasalah pendidikan berkualitas umur berkualitas tidak keluarga jakarta sekolah swasta pilihan gap year timbulkan gunung es depannya tolong terhormat dipertimbangkan ulang
Negatif,2021,orang jakarta tidak tidak kesel ppdb zonasii keterima jing duhh gni gaush memikirkan nilai umur tua
Negatif,2021,plss depresi banget ppdb jakarta sistem zonasinya adil
Negatif,2021,tua sekolah muda hancurr
Negatif,2021,jalur umur mah jalur zonasi badut banget ppdb jakarta
Negatif,2021,lelah sistem ppdb jakarta
Negatif,2021,tidak bohong banget ppdb jakarta tidak
Negatif,2021,gimanasi ppdb jakarta katamya zonasi pakai umur aneh
Negatif,2021,rebutan booking vaksin jakarta bikin sakit perut berasa ppdb
Netral,2021,dom jakarta tidak pengaruh kemarin ppdb dipakai rapot smstr
Netral,2021,coba search ppdb sebentar muncul nilai murni ppdb jakarta bidang prestasi sekedar informasi kuat nilai lomba lomba pengurus ekskul
Netral,2021,lombanyaa kapann soalya ppdb jakarta gasalaa lombanya maksimal pendaftaran ppdb gituu
Netral,2021,daerah jakarta pakai zona zona ppdb kemarin kalopun jarak sekolah gamasuk zona utamanya jakarta deh
Netral,2021,mengikuti tes seleksi ppdb madrasah istiqlal jakarta jangan terlewat sabtu desember
Netral,2021,presentasi ppdb smp jakarta
Netral,2021,presentasi ppdb smp jakarta
Netral,2021,tim ppdb pelajaran berkunjung smp jakarta
Netral,2021,indonesia
Netral,2021,indonesia
Netral,2021,kemarin ngecek ppdb jakarta sd negeri inceran paling masuk usia mudah an nadim lolos deh smp sma negeri mbak meth sd swasta smp sma nya negeri
Netral,2021,semacem sertif pengurus osis sekolah dilampirin gituu kayak nilai plus ngomong-ngomong ppdb jakarta
Netral,2021,yahh ppdb tidak bisa jakarta deh
Netral,2021,ppdb sma dki jakarta daftar sma swasta terlibat beserta kuotanya
Netral,2021,ppdb sma dki jakarta daftar sma swasta terlibat beserta kuotanya
Netral,2021,ppdb sma dki jakarta daftar sma swasta terlibat beserta kuotanya
Netral,2021,ppdb sma dki jakarta daftar sma swasta terlibat beserta kuotanya
Netral,2021,ppdb sma dki jakarta daftar sma swasta terlibat beserta kuotanya
Netral,2021,ppdb sma dki jakarta daftar sma swasta terlibat beserta kuotanya
Netral,2021,ppdb sma dki jakarta daftar sma swasta terlibat beserta kuotanya
Netral,2021,ppdb sma dki jakarta daftar sma swasta terlibat beserta kuotanya
Netral,2021,ppdb sma dki jakarta daftar sma swasta terlibat beserta kuotanya
Netral,2021,ppdb sma dki jakarta daftar sma swasta terlibat beserta kuotanya
Netral,2021,ppdb sma dki jakarta daftar sma swasta terlibat beserta kuotanya
Netral,2021,smk jakarta timur ppdb jakarta selatan tidak
Netral,2021,deh jakarta timur ppdb sma jakarta selatan tidak
Netral,2021,ppdb sma dki jakarta daftar sma swasta terlibat beserta kuotanya
Netral,2021,ppdb sma dki jakarta daftar sma swasta terlibat beserta kuotanya
Netral,2021,ppdb sma dki jakarta daftar sma swasta terlibat beserta kuotanya
Netral,2021,ppdb sma dki jakarta daftar sma swasta terlibat beserta kuotanya
Netral,2021,sd kartika jaya jakarta kepala sekolah pamuji sukses terbaik dki jakarta tips beliau guru anak orang tua belajar ppdb pandemi ayo kepoin teman-teman
Netral,2021,ngomong-ngomong ppdb jakarta coba ppdb kotamu
Netral,2021,catat baik baik alur ppdb sd sma jalur zonasi jakarta
Netral,2021,adik lulus smp sma ikutlah ppdb dki jakarta beuh ampun deg degan
Netral,2021,dibuka besok tata pendaftaran ppdb sekolah negeri swasta jakarta
Netral,2021,ombudsman perwakilan jakarta raya menemukan dugaan malaadministrasi ppdb tingkat sma smk bodebek
Positif,2021,dki paling bagus ppkm salurkan bansos juta kakak berhak program vaksin belajar tatap muka ppdb lancar dead rate covid tertinggi turun jakarta pintar jakarta linko warga daerah iri dki
Positif,2021,kemarin ppdb jakarta osis jabatan osisnya lumayan banget tambahan nilainya
Positif,2021,ppdb alhamdulillah nya keterima salah sma negeri jakarta pusat poin utamanya angkatan smp ppdb sma alias gapyear langsung
Positif,2021,komisi perlindungan anak indonesia ppdb dki jakarta libatkan sekolah swasta patut ditiru
Positif,2021,kemarin sore mengunjungi posko ppdb penerimaan peserta didik sekolah sman jakarta penerimaan siswa berjalan lancar catatan aspirasi terima tindak dinas terkait
Positif,2021,ppdb jakarta bagus kepantau calon peserta didiknya kudet sistem
Positif,2021,semangat ppdb jakarta seminggu kemarin ngurusin ppdb tidak tidur alhamdulillah selesai
Positif,2021,hebat posko ppdb jakarta professional amp sangat melayani masyarakat sungguh kagum pindah jakarta pindah kknya belum genap setahun takut bingung daftar skolah
Positif,2021,ppdb jakarta bagus
Positif,2021,siang mengecek jalannya ppdb sman kemanggisan jakarta barat proses teratur dibanding catatan dioptimalkan kedepannya
Positif,2021,pemerintah dki jakarta menggandeng sekolah swasta menambah daya tampung calon siswa jalur afirmasi penerimaan peserta didik ppdb kerja diutamakan kelurahan tidak memiliki sekolah
Positif,2021,keren anies baswedan beres baik tidak menteri pendaftaran ppdb
Positif,2021,keren anies baswedan beres baik tidak menteri pendaftaran ppdb
Positif,2021,keren anies baswedan beres baik tidak menteri pendaftaran ppdb
Positif,2021,wakil gubernur dki ppdb online jakarta sangat baik
Positif,2021,ppdb jakarta utara berjalan baik
Positif,2021,pemerintah kota administrasi jakarta utara pelaksanaan pendaftaran peserta didik ppdb terkendali
Positif,2021,apresiasi dinas pendidikan provinsi dki jakarta melayani masyarakat ppdb
Positif,2021,gubernur dki jakartaanies baswedanmemastikan permasalahan situsppdbdki jakarta beres tertangani baik
Positif,2021,perbaikan anak ppdb dki bermasalah program sidanira luar gubernur dki jakarta memantau mantan mendikbud republik indonesia amp vital bibit sumber daya manusia dki jakarta gerak cepat amp monitor yang bersangkutan
Positif,2021,alat pc intel atom memori gb modem flash telkomsel demi kesulitan ketidakcakapan mengakses internet kerap muncul untungnya warung internet jakarta membuka jasa asistensi ppdb solidaritas bagus
Positif,2021,gubernur dki jakarta anies baswedan baswedan gerak cepat kesulitan pengajuan akun ppdb ajaran teratasi diakses
Positif,2021,gerak cepat banget ppdb dki jakarta bermasalah gubernur turun tangan pastikan proses lancar bangga gubernur beliau
Positif,2021,alhamdulillah kendala kemarin muncul dirasakan siswa orangtua mengikuti ppdb jakarta tertangani baik
Positif,2021,selamat tipsnya berguna daftar semoga istirahat semoga bermanfaat yaa
Positif,2021,kasih staff pengurus ppdb dki jakarta sekian daftar japres semoga tidak pelajaran sistem pendidikan indonesia maju memiliki sumber daya manusia unggul
Positif,2021,ombudsman apresiasi perbaikan ppdb dki jakarta
Positif,2021,paling enak ppdb jakarta asli
Positif,2021,taat banget perintah allah pas ppdb jakarta tahajud doa solawat sekolah takdir allah terbaik ketendang sma daftar smk mungkinini terbaik
Positif,2021,maki maki ppdb jakarta bersyukur sangat menemukan teman support support dari pada teman smp yaa enjoy sangat sklhku praktek nya banget namanya smk sih tertawa
Positif,2021,pemberkasan sekolah negeri kemarin berdasar pengalaman mendaftarkan keponakan sd negeri jakarta online sistem ppdb jakarta bagus tahap daftar ulang tidak prosesnya orang tuanya mengurus
Negatif,2022,bagus sih sayang pemerataan pembiayaan pendidikan apbn apbd belum adil siswa mengajukan sekolah ppdb pemerintah provinsi jakarta dilayani kuota negeri dialihkan swasta subsidi jangan kjp pip
Negatif,2022,tidak pas ppdb orang tua demo tidak pemerintahnya ketawa tidak peduli beneran pas unjuk diketawain dibodohin gitu pendemo demi pelajar loh pemerintah sejahat kalau tidak salah pas demo dinas pendidikan jakarta
Negatif,2022,kemendikbud angkatan percobaan nntinya tertawa semangat jujur masuk smk percobaan tertawa orang jakarta kacaunya ppdb jakarta so ppdb kecewa sistem
Negatif,2022,highschool jakarta highschool jakarta ditolak ppdb dki anjing
Negatif,2022,tangerang anjing ppdb jakarta tolak tidak bisa trend high sekolah jakarta sakitnya berasa
Negatif,2022,seandainya dana bantu anak masuk sekolah sedihnya tuhan anak bodoh umur muda tidak sekolah negeri bodoh sekolahkan ppdb jakarta sangat menyakitkan hati orgtua tunggal semoga pemerintah provinsi dki bisa solusi anak
Negatif,2022,gonta ganti kebijakan ppdb jakarta dinilai timbulkan persoalan
Negatif,2022,pejuang ppdb jakarta belum lolos menangis tidak apa-apa ngerasain tidak adilnya sistem usaha semaksimal semangat teman-teman nilai percuma tertawa
Negatif,2022,ppdb jakarta mohon tidak jelas banget
Negatif,2022,iya nih kayaknya error melulu web ppdb jakarta kemarin ngeselin
Negatif,2022,ppdb zonasi jakarta kemarin anjing nama pas pilihan iseng lihat pilihan tidak ada uang nama pas pilihan tidak ada uang yah bolak scroll refresh tidak ada uang anjing panik
Negatif,2022,tidak terima ppdb anjing jakarta tidak pakai nilai zonasi umur
Negatif,2022,ppdb jakarta bantai kesel banget
Negatif,2022,ppdb jakarta anjing untung jawa barat
Negatif,2022,tidak adil banget najis ppdb zonasi jakarta tua masuk sma tidak akal banget anak masuk sma ketendang menunggu masuk sma negeri gila kapaan sistem nya
Negatif,2022,ppdb jakarta gagal melulu jaringan aman
Negatif,2022,ppdb jakarta lemah otak banget
Negatif,2022,web ppdb jakarta beginii
Netral,2022,memenuhi kebutuhan masyarakat layanan paud dinas pendidikan provinsi dki jakarta membuka layanan ppdb ajaran satuan paud negerivtersebar jakarta peminat mendaftar satuan paud negeri meningkat
